address,city,company,company_id,company_type,date,education,experience,job_description,job_name,job_url,people_num,salary
陆家嘴,上海,华融证券股份有限公司上海分公司,CZ157756510,国企,2019-08-09 09:18:48,本科,1-3年,★薪酬体系：基础培育津贴+佣金提成★工作时间：做五休二，8:00----17:00，营销活动期间可自行调配工作时间，灵活机动。★晋升路线：培养型经纪人-理财经理-投资顾问-服务总监。岗位职责： 1. 独立自主开发和服务个人及机构客户，为客户提供资产配置建议与解决方案；2. 在满足客户适当性等要求情况下，向客户推荐和销售金融产品及相关服务； 3. 拓展、维护新型销售渠道及落实具体营销方案；4、收集、整理市场信息和客户建议，向客户传递公司产品与服务信息；5、按公司要求向客户提供与证券经纪业务相关的服务工作；6、严格遵守公司各项销售管理和内控规定。任职要求： 1.综合素质：正直诚信，积极主动；良好的沟通能力与抗挫折能力，较好的亲和力与服务意识；较强的事业心、责任感和团队合作精神； 2. 从业资格：已取得证券从业资格；具有投资顾问、基金、期货等从业资格的可优先； 3. 学历：本科以上； 4. 从业经验：1年以上，优秀者可放宽至应届毕业生； 5.其他：年龄40岁以下，在中国证监会、中国证券业协会及其他金融机构自律组织无负面记录；认同华融证券文化和价值观；身体健康，形象气质良好；  6. 有高净值客户或私募机构资源和开拓能力者优先。,证券经纪人-华融证券上海银城中路营业部,https://jobs.zhaopin.com/CC157756513J00381367507.htm,招10人,6K-8K
厦港,上海,厦门上城建筑设计有限公司,CZ368525210,民营,2019-08-09 09:21:56,本科,3-5年,岗位职责：1、协助项目负责人进行方案创作、技术协调等工作。2、熟悉设计全周期工作流程，能独立完成中/大型住宅项目的方案设计；任职要求：1、建筑学专业、本科及以上学历，3-5年方案设计经验；2、具有较强的总图设计或立面创作能力，并可在面试中展示讲解；3、对建筑创作有执着的追求，有事业心和进取精神，责任心强，有良好的团体合作精神及抗压能力；4、熟练运用各种绘图软件；5、有大型设计院工作经验者优先。,建筑方案设计师（上海）,https://jobs.zhaopin.com/CZ368525210J00309850302.htm,招5人,10K-16K
五里桥,上海-黄浦区,凯熙信息技术有限公司(Shanghai Cachi-info Information Technology Co. Ltd.),CZ120532570,民营,2019-08-09 09:22:37,本科,3-5年,     岗位职责：     至少2-3年工作经验，BI相关领域工作经验     熟练掌握SQL Server，能独立阅读和编写复杂的SQL     有较强的文档能力，能在现有代码的基础上进行文档撰写      有建模或代码调优能力更佳     有一定的沟通能力，能在了解相关知识背景的情况下和业务用户沟通日常需求，有较好的自主学习能力，能独立完成相关工作     有上述ETL和报表工作，有相关BIDW经验（ETL，CUBE，报表等），熟悉微软平台BI经验者优先     工作内容：    SQL脚本编写，数据维护，代码查错，BUG修复，需求沟通与代码实现，能熟练用SQL进行查询，撰写procedure，编写视图，其他数据相关维护事项，数据库为SQL server。    可能因工作需要，使用如下软件: ETL为SSIS，报表工具为SSRS ＋ QlikView ＋Tableau。,BI Engineer,https://jobs.zhaopin.com/CC120532574J00291105502.htm,招1人,10K-15K
光新,上海,中机国能电力工程有限公司,CZ360207210,国企,2019-08-09 09:16:19,本科,5-10年,职位描述：位职责：1、负责市场拓展、项目调研、项目评估；2、负责与项目业主方沟通，确定业务范围和业务模式，起草商务合同及有关协议文件；3、组织项目投标、编制投标文件、商务谈判、合同签订；4、完成已经签订合同项目的后期跟踪，配合公司有关部门，推动项目实施，协助资金回笼；5、负责项目的商务接待，关系网维护。岗位要求：1、大学全日制本科以上学历，英语专业；2、5年以上电力或能源行业市场拓展经验，有工程项目前期开发经验、设计、施工、供应链金融等经验者优先；3、具备丰富的招投标知识、合同法规知识及商务谈判技巧，较强的市场敏锐度和洞察力；4、有团队协作精神，较强的工作抗压能力；具备一定的业务成本控制能力；5、性格外向，喜欢社交活动；6、能适应经常出差。,国际商务经理,https://jobs.zhaopin.com/CC360207211J00311067202.htm,招1人,15K-25K
北外滩,上海-杨浦区,江苏智蓝信息科技有限公司,CZ571965230,民营,2019-08-09 09:13:58,本科,3-5年,"岗位职责：1）基于JAVA平台完成业务服务的设计、开发与单元测试；2）配合开发经理进行详细设计，负责编写需求、设计等项目文档；3）指导初级开发人员进行开发，负责代码 review；任职要求：1、教育经历： 计算机及相关专业本科及以上学历； 2、工作经验： 3~5年JAVA/WEB项目经验； 具有带领3~5人团队的项目经历；（优先录用） 了解如下任一系统：估值系统、恒生交易系统、清算系统；（优先录用） 具有金融/基金等相关从业经验；（优先录用） 3、软件技能： 精通Java后端开发技术，包括但不限于：Spring、SpringBoot、SpringCloud、Hibernate、JSP、Servlet、JavaScript、Tomcat等；  精通SQL技术和Oracle，MySQL等主流数据库的使用及优化； 精通Java开发工具Eclipse、构建工具Maven，Git 版本管理工具； 精通SQL性能优化、Java Web性能优化； 熟悉 Memcached，Redis等缓存机制； 熟悉普元EOS应用开发；（优先录用） 熟悉面向对象、MVC架构、微服务架构等软件架构理念； 熟悉分布式计算、多线程编程、网络编程、网络安全及JVM 原理等； 熟悉OpenShift，Jenkins，Nexus，Docker，Kubernetes, ELK等； 4、基本素质： 有良好的团队合作精神和沟通能力，能快速学习掌握新知识，能独立完成工作任务；  工作认真负责，积极主动，有较强的承压能力；",应用开发工程师（高级/JAVA后端开发）,https://jobs.zhaopin.com/CC571965234J00287308704.htm,招3人,20K-30K
赵巷,上海-徐汇区,漯河市轩泽服饰有限公司,CZ702467130,民营,2019-08-09 09:09:55,本科,不限,熟悉服装业务有自己的客户群体公司已承接外贸加工等各大类品牌订单详情可以关注公司公众号“轩泽服饰”,服装业务员,https://jobs.zhaopin.com/CZ702467130J00165742414.htm,招1人,10K-15K
,上海,德邦物流股份有限公司,CZ156976020,民营,2019-08-09 00:50:57,本科,不限,一、【岗位要求】：1、全日制统招大专及以上学历，20~28岁。2、有较强的抗压能力，沟通能力佳，有上进心。3、认同企业文化及发展方向，愿意从基层开始。4、有优秀学生干部/班干部经历优先。二、【薪资福利】：1、综合工资：月薪5000-8000元，月休6-8天，灵活排班；2、社保、各类带薪休假（法定假日、年假、婚假、产假、陪产假等），提供高于同行业具有竞争力的薪资水平；3、公司99%的管理人员由内部产生，所有员工可以选择管理或专业两条道路发展；4、公司为员工提供各种培训机会，德邦学院根据员工的岗位类别，组织各种业务、工作、能力提升等相关内部培训与户外拓展，如：新员工入职培训，储备经理、高级经理培训、会计培训，专业业技能培训等相关脱产带薪培训。5、入职满1年可享受每月“亲情1+1”（公司补贴100元，员工自己提供100元，每月固定200元打入父母帐户），集体生日等；6、配车福利：公司为每位区域经理级及以上人员配车；三、【晋升机制】：1、管理通道晋升：经理（周期0.6-1年）--高级经理（周期2-3年）--总监（周期3-5年）2、专业通道晋升：专员（周期0.6-1年）--高级专员（周期2-3年）--资深专员（周期3-5年）四、【岗位职责】：1.负责清点件数，对货物重量和体积进行测量。2.负责标签，运单，托运书的检查及异常处理。3.负责检查危险品、违禁品、货物包装等。4.联系客户接货，填写托运书五、【岗位定位】：公司储备管理人员，按照公司的规划和要求，进行部门营销和客户维护活动；配合经理完成部门工作，提升部门收入，完成部门指标，对内营造良好工作氛围，对外展现良好的德邦形象。【温馨提示】：此招聘为公司直招，德邦物流股份有限公司及其下属分公司在招聘过程中不收取任何费用、押金等，敬请各位求职者知晓，以免受骗损失财物。,DPSHB-快递仓管员( 静安和田路),https://jobs.zhaopin.com/CC156976022J00400653305.htm,招10人,5K-8K
,上海,上海业宏市政工程设计咨询有限公司,CZ701322030,民营,2019-08-09 09:15:01,本科,不限,1、普通全日制本科及以上学历，桥梁工程或相关专业毕业；  2、具有持续学习和创新能力，富团队合作精神；  3、具有工程师及以上职称者优先考虑；4、熟练运用CAD及本专业相关设计绘图计算软件，完成过大中型桥梁工程设计项目，熟悉与其他专业的配合关系；  5、对待工作有责任心、具备基本的沟通协调能力；对专业知识有追求，能钻研，能独立解决问题； 6、能融入公司的企业文化，热爱工作，热爱生活；提供具有竞争力的薪酬体系。 ,桥梁设计,https://jobs.zhaopin.com/CZ701322030J00127052204.htm,招1人,8K-10K
虹梅路,上海,江阴市正伟服饰有限公司,CZ543392620,民营,2019-08-09 00:52:39,本科,1-3年,我们需要资深淘宝美工，如果你足够优秀，那就赶紧和我们联系，加入我们的团队。岗位职责：(在线美工请勿投递！我们招聘的是全职，谢谢）1，负责公司店铺的整体视觉，创意风格2、负责店铺的产品优化，包括产品描述，页面设计，分类设计等，以提高产品转化率。3、配合运营部门完成各类活动图片制作，完成各期专题推广海报，及促销活动等平面创意设计。提高点击和转化。4、能独立按时完成店铺美工设计工作任职要求：1，本科或以上学历，美术、平面设计、视觉传达、艺术相关专业优先2   两年以上设计经验。3、能熟练使用Photoshop、coredraw、Dreamwever，C4D等设计软件。4、对色彩搭配、页面整体协调性的把控能力强；沟通能力强、理解能力强，工作态度端正。5、熟悉天猫京东后台优先，有母婴类目工作经验更佳，有敏锐的鉴赏力。工作时间：做五休二  （9:30-18:30）关于我们：芝麻馄饨是一个专注于0-3岁婴童睡眠的自创品牌，创始人来自于国内一流大学并有留学经验，在生下宝宝后对母婴产品精心研究，配上自家经营二十多年的迪士尼外贸指定工厂，创立了这个有爱的婴童睡眠品牌。经过努力，品牌飞速发展。现开始大力开拓销售渠道，欢迎有志在婴童领域的朋友加入我们这个活力四射的团队！,资深美工设计,https://jobs.zhaopin.com/CC543392621J00389118407.htm,招1人,8K-10K
浦江镇,上海,依米康科技集团股份有限公司,CZ191789020,上市公司,2019-08-09 09:23:24,本科,1-3年,职位描述：1、协助销售管理工作：1）根据公司下达的区域营销中心的年度目标，协助进行任务分解和工作计划制定的工作；协助区域营销中心总经理跟进和检查计划的进展、目标达成情况，分析销售状况，做到及时向总经理沟通与汇报，并按月提交统计、分析报表；2）负责按时督促相关营销人员按时按要求编制并提交工作报告及其他业务报告；3）定期制作各营销人员的销售业绩统计表、货款回收情况和费用使用报表，并提交给区域营销中心总经理，以及时了解业务进展情况和有效控制销售费用 。2、营销业务活动的支持：1）负责销售资料管理；2）协助行业销售部、渠道部建立和维护各类客户档案、信息等资料；3）负责协助营销人员制作标书及参加投标活动；4）协助本区域主办或参与的各类商务活动的顺利开展如技术交流、市场拓展会、行业交流研讨会等；5) 协助内外部会务的组织，做好参会的会议记录及会议效果的跟踪；6）协助跟踪销售订单的执行。岗位要求：1、本科学历，市场营销及机械相关专业；2、对数据敏感；4、熟练使用OFFICE常用办公软件；5、工作地上海。,销售运营专员,https://jobs.zhaopin.com/191789026250885.htm,招1人,4K-6K
新浜镇,上海-浦东新区,南京日冲软件股份有限公司,CZ469407420,民营,2019-08-09 09:23:07,本科,1-3年,1、具备良好的职业操守，遵纪守法，无不良从业记录； 2、理解金融、会计学基本原理，掌握会计或者金融业务基本实务，了解监管部门相关政策及法规，熟练掌握财务核算、证券交易结算、估值核算等相关专业知识； 3、全日制大学本科学历，会计、金融、财管、经济等相关财经专业(有相关经验者可不限制专业)； 4、具备半年以上证券、保险、资管、信托等金融机构基金估值相关经验；有基金、证券、期货或其他相关资格证书者优先考虑；工作地点：上海高中路地铁站附近。备注：学历是本科 统招全日制（硬件要求）,会计,https://jobs.zhaopin.com/CC469407425J00392697107.htm,招2人,8K-10K
城隍庙,上海,华融证券股份有限公司上海分公司,CZ157756510,国企,2019-08-09 09:19:38,本科,1-3年,★薪酬体系：基础培育津贴+佣金提成★工作时间：做五休二，8:00----17:00，营销活动期间可自行调配工作时间，灵活机动。★晋升路线：培养型经纪人-理财经理-投资顾问-服务总监。岗位职责： 1. 独立自主开发和服务个人及机构客户，为客户提供资产配置建议与解决方案；2. 在满足客户适当性等要求情况下，向客户推荐和销售金融产品及相关服务； 3. 拓展、维护新型销售渠道及落实具体营销方案；4、收集、整理市场信息和客户建议，向客户传递公司产品与服务信息；5、按公司要求向客户提供与证券经纪业务相关的服务工作；6、严格遵守公司各项销售管理和内控规定。任职要求： 1.综合素质：正直诚信，积极主动；良好的沟通能力与抗挫折能力，较好的亲和力与服务意识；较强的事业心、责任感和团队合作精神； 2. 从业资格：已取得证券从业资格；具有投资顾问、基金、期货等从业资格的可优先； 3. 学历：本科以上； 4. 从业经验：1年以上，优秀者可放宽至应届毕业生； 5.其他：年龄40岁以下，在中国证监会、中国证券业协会及其他金融机构自律组织无负面记录；认同华融证券文化和价值观；身体健康，形象气质良好；  6. 有高净值客户或私募机构资源和开拓能力者优先。,证券经纪人-华融证券上海中山东二路营业部,https://jobs.zhaopin.com/CC157756513J00381366807.htm,招10人,6K-8K
,上海,中电科技(北京)有限公司,CZ276798110,国企,2019-08-09 09:18:17,本科,3-5年,负责工作内容：1、负责研发测试环境数据库系统的日常维护工作，包括数据库系统搭建、数据库版本更新、数据库备份恢复、数据库运行性能监控调优等2、负责排查由于SQL语句产生的数据库系统运行性能问题，并给开发提出SQL语句调优建议3、针对新应用系统需求，进行数据库技术选型及部署架构的设计4、负责数据库自动化运维的解决方案设计工作技能要求：1、有3年以上的DBA工作经验2、深入理解Oracle和mysql数据库的运行机制和体系架构3、熟悉数据库高可用集群、主从复制等技术实现4、掌握数据库的管理和性能调优工具的使用5、能够编写数据库自动化运维脚本，熟悉shell、python语言其中一种6、良好的文档编写能力，积极的团队合作能力，工作细心且具备较强的责任感和抗压能力7、掌握hadoop hive、HBase技术能力的优先,数据库工程师,https://jobs.zhaopin.com/CC276798114J00100343114.htm,招1人,10K-15K
人民广场,上海,江苏长晶科技有限公司,CZ447954820D00300364642,民营,2019-08-09 09:06:53,本科,3-5年,工作内容：1、带领团队，通过自主开发各类销售渠道，增加销售额；2、负责客户关系管理与维护，帮助客户解决问题，跟踪客户投拆处理，提升客户满意度；3、客户临时紧急反馈事项的跟进；4、了解客户发展趋势，不断为客户推荐新产品，提高销售业绩；5、完成公司下达的各项任务和指标；6、跟踪客户的货款回收。 任职要求：1.对二三极管、MOS管、电源管理IC、频率器件、MCU比较熟悉，有一定的客户群；2.熟悉电子元件行业及相关销售业务，能独立开发和维护客户；3.具备电子行业相关工作经验，从事电子行业销售工作3年以上；4.具有良好的职业操守和业务拓展能力，具有较强的市场分析判断能力，敬业、实干，有强烈的工作责任心及团队协作精神，做事持之以恒，有毅力；,销售经理,https://jobs.zhaopin.com/CC447954822J00283284303.htm,招2人,10K-20K
张江,上海-浦东新区,成都费恩格尔微电子技术有限公司,CZ292732880,股份制企业,2019-08-09 09:21:09,本科,1-3年, 1、熟悉linux 基本操作。2、熟练掌握c语音。3、对arm嵌入式有一定了解。4、 对android 了解优先。5、计算机、电子类专业,软件工程师,https://jobs.zhaopin.com/CC292732886J00360758001.htm,招3人,10K-20K
张江,上海,上海鼎衡船务有限责任公司,CZ158863310,民营,2019-08-09 09:24:16,本科,5-10年,职位描述：1、负责组织公司全盘账务处理（包括：会计核算、填制会计凭证、登记会计账簿、月度结账、编制会计报表等）； 2、负责审核出纳的工作，包括收付款凭证，核对银行往来账等； 3、负责审核各类报销单据，包括员工日常报销，成本单据入账等； 4、负责与供应商及客户的往来对账以及销账等； 5、负责向主管税务机关（国税、地税）定期纳税申报； 6、协助财务负责人拟定并完善相关财务、会计制度，并协调执行； 7、协助财务负责人与相关业务部门合作，参与业务流程以及内部控制流程的制定，保障公司财务运营与会计核算的效率及有效性； 8、负责与人事部门社保、公积金、工资薪酬福利的记录核算工作；9、财务部负责人安排的其它工作。 基本任职资格： 1、学历和技能：财务会计、审计、金融等相关专业，本科以上学历；能熟操作用友、金蝶、WORD、EXCEL等办公软件； 2、工作经验：5年或以上财务工作经验，其中：具船舶航运类公司经验者优先；熟悉金融政策法规以及会计法规、会计准则、财税政策法规； 3、具良好职业道德及沟通交往能力，责任心及自我管理能力强，良好团队协作精神； 4、中级会计师职称优先。,财务主管,https://jobs.zhaopin.com/158863319250018.htm,招1人,6K-8K
徐泾,上海-闵行区,广东触电传媒科技有限公司,CZ841069170,国企,2019-08-09 09:04:33,本科,1-3年,工作职责：1、筛选“触电新闻”平台优质且有传播性内容，包括但不限于图文、短视频、直播；2、建立“触电新闻”内容对外分发及转发架构体系，并维护与平台方良好关系；3、负责今日头条、一点资讯、企鹅号、百家号等新媒体平台内容传播工作，并提高内容阅读量；4、负责视频平台的短视频、直播等内容分发工作，并提高内容阅读量；5、建立水军资源，负责将精选内容通过社群传播等方式提高阅读量；6、根据不同平台目标用户特性，选取相应内容进行营销曝光，从而提高全平台阅读量；7、密切关注平台最新政策，及时反馈跟进和推广优化；8、完成上级安排的部门其他工作。岗位要求：1、本科及以上学历，2年以上相关工作经验，有各类自媒体、短视频、直播平台官方资源，能够拿到推荐资源；2、熟悉各自媒体、短视频、直播平台后台操作设置；3、做过内容，懂营销，对内容有感觉，网感好反应快，善于发现热点，懂数据分析优先；4、具备良好学习能力，善于提出自己的观点和意见；5、有耐心，关注工作，事无巨细，不计较个人时间。,新媒体运营（内容分发）,https://jobs.zhaopin.com/CC841069170J00291483806.htm,招1人,6K-12K
老西门,上海,上海灵硕会展服务有限公司,CZ201734420,民营,2019-08-09 00:50:49,本科,1-3年,"岗位职责：1、国内外行业媒体合作洽谈与落地；2、新闻稿与自媒体软文撰写、H5及EDM制作；3、精准扩充行业数据库；4、百度、谷歌、微信、微博、领英、脸书等多渠道营销与账号运营；5、协助策划总监进行线下市场活动策划与执行；6、制定项目市场目标并进行预算管理；7、完成公司交付的工作任务。任职要求：1、本科及以上学历，市场营销、英语、商学、管理等专业优先；2、良好的中英文书面及表达能力；3、敏锐的市场嗅觉及学习能力；4、充满活力与激情，结果导向，抗压性强；5、有相关体育或会展行业经验者优先。公司福利*上海市中心陆家浜路地铁站(8,9号线)，步行2分钟直达*无责任底薪+项目奖金+多样丰富的奖励制度*清晰的晋升制度*节假日福利*年假*定期专业业务培训*年度旅游*弹性工作制，和谐的工作氛围*定期Team Building*生日福利*有机会和体育明星和行业大咖零距离接触-如果你对自己的未来职业规划还有些模糊；-如果你喜欢体育，并想把兴趣真正作为职业；-如果你渴望发挥你的外语才能；-如果你觉得自己没有充分受到挑战，需要释放激情；-如果你不愿意熬年头、论资排辈，需要一个敢于任用年轻人的平台；-如果你对推诿指责及拉帮结派充满厌恶，渴望简单的人际关系和平等的文化氛围；-如果你善于快速理解和自我学习，具有探索新事物的好奇心；那么，在灵硕体育，您将有机会：1、获得远高于传统行业的收入；2、成为优秀的体育+会展的复合型人才，市场专家，谈判专家，心理学专家，管理人才；3、为各国政府、行业内大型集团公司的精英提供专业的咨询服务，并与他们建立长期的信任关系；4、学习到世界上先进的会展活动制作模式，与饱含激情的年轻人一起工作，一起制作出超越客户满意度的体育会展及活动项目；5、为国家经济战略和体育事业发展贡献自己的力量；这里只看能力，不会论资排辈，没有天花板公司信息灵硕人一直围绕为客户创造并管理品牌价值，打造具有竞争力的品牌营销机构！高效的执行力是灵硕人立足行业的根本。灵硕体育隶属于灵硕集团，其总部位于上海。是一家专注于为体育行业提供全产业链会展活动策划、赛事组织、体育营销、培训、商务考察及行业咨询，同时也为体育行业的组织与企业提供专业形象设计展示等服务的综合型企业。灵硕集团业务遍布全球，精工细作，以上海总部为中心，分别在德国、马来西亚、中国香港、北京、广州成立分公司，年服务客户超过2500家。集团以立足上海，联合运营，跨国发展为企业发展风向标，为客户提供专业的全球展览产业链一站式服务。简单来说，作为领先的展览全产业链服务提供商，灵硕集团已经成为行业的标准。  国内首批通过ISO9001:2000质量管理体系认证会展公司；中国会展设计企业推荐30强；中国会展协会十大影响力企业；上海会展十佳优秀企业；上海市工程建设零投诉标杆企业；工作地址上海市黄浦区陆家浜路1332号南开大厦1901室",国际会展市场主管--体育事业部,https://jobs.zhaopin.com/CC201734422J00069984603.htm,招1人,8K-10K
,上海-松江区,郑州誉业文化传播有限公司,CZ371776380,民营,2019-08-09 09:12:03,本科,3-5年,市场拓展经理岗位职责：1、 根据产品策略，制定公司的产品推广策略及推广方案；2、  负责公司品牌、产品的线下推广执行；3、  负责通过网络、第三方机构收集客户信息；4、  开拓产品新市场。任职要求：1、大专以上学历，市场营销相关专业；2、有活动策划、市场拓展营销策划工作经验；3、认同公司企业文化、价值观；4、有超强的团队合作意识和执行力；有良好的观察、沟通、协调、协作能力。,市场经理,https://jobs.zhaopin.com/CZ371776380J00174799210.htm,招1人,10K-15K
