address,city,company,company_id,company_type,date,education,experience,job_description,job_name,job_url,people_num,salary
,上海,上海善准生物科技有限公司,CZ728112080,民营,2019-08-09 09:19:28,本科,1-3年,工作职责：1. 销售所需宣传品管理，主要是印刷、邮寄和登记工作。2. 销售所需合同文件的校对和归档，主要是配合商务总监完成合同评审流程并打印、盖章、扫描和备案。3. 配合商务总监完成代理商外送样本的电子申请流程发起，流程监测，定期向商务总监反馈样本检测状态。并对外送样本进行登记管理。4. 如果代理商需要发票，按照客户要求向公司提出发票申请。5. 按照商务总监提供的行程单，给公司同事预定车票或机票。6. 临时处理商务总监交代的工作日常。任职资格：1、形象端庄、性格开朗、善于沟通；2、熟练运用Win/Office/PS等软件；,销售行政,https://jobs.zhaopin.com/CZ728112080J00429929501.htm,招2人,4K-6K
虹梅路,上海,上海禹化信息科技有限公司,CZ638090980,民营,2019-08-09 09:12:12,本科,不限, 岗位描述：   1、日常业务，包括SDS编制、标签编制、危化品系统填报、咨询及培训服务等；  2、研究相关化学法规/标准；  3、数据库的整理及审核；  4、新产品研发的技术支持及测试；  5、挖掘与捕捉用户需求，分析数据，结合市场状况以及公司内部资源，持续优化和改进产品细节。  岗位要求：  1、正规统招本科及以上学历，有机化学、应用化学、化学工程与工艺等化学类专业；  2、熟悉办公软件，耐心细致，为人真诚踏实，热爱化学，性格乐观，有自己价值观且愿意为之奋斗；  3、具备数据分析、使用和总结能力，善于通过数据发现问题或机会；  4、良好的沟通能力及团队合作精神，学习能力佳，敢于接受挑战；  5、 对工作充满热情，富有创新精神；  6、 在化学品检测行业或化学品法规服务行业有工作经历者优先。,技术岗位,https://jobs.zhaopin.com/CZ638090980J00344456803.htm,招8人,4.5K-6.5K
,上海,上海美特斯邦威服饰股份有限公司,CZ000612160,上市公司,2019-08-09 09:18:19,本科,1年以下,工作职责:1、根据电商业务需求，结合品牌策略，参与制定全渠道的营销计划与方案；2、各类营销活动、话题策划、专案统筹工作；3、大型营销活动（如品牌周年庆、618年中大促、双十一大促等）活动项目方案策划，跟进、执行及总结分析；4、策划淘宝、天猫商城等线上平台的产品详情页文案和产品广告文案；5、市场推广的其他配合事宜。任职资格:1、希望你关心时事热点，对时尚与前沿资讯的敏锐度很重要。2、你应该富有责任心，有良好的文案功底及营销策划能力，能完成营销推广方案。3、我们希望你服从指挥，美邦是个开放的集体，部门同事都会非常NICE，会有人带教工作并且赏识年轻人的想法，但是需要虚心努力，所有人都盼望你的成长。4、了解各类活动推广和活动发布渠道，同时对时下各种营销方式都有一定的了解。5、希望你是个富有活力，有想法有追求的年轻人，公司氛围开放愿意接纳新人，相信这里将是你的新起点~6、上班地址在浦东新区康桥东路800号——美邦总部，有班车，有住宿~有感兴趣或想要了解的都可以投递简历，我们详谈呗~,新媒体 营销推广 文案,https://jobs.zhaopin.com/CC000612162J00407555501.htm,招1人,5K-8K
,上海,"GUIDEPOINT GLOBAL,LLC(SINGAPORE BRANCH)",CZ286004410,外商独资,2019-08-09 09:25:38,本科,1年以下,此职位需有日语听说读写能力和良好的英语能力职责描述：· 负责行业动态和热点新闻的跟踪；· 负责目标领域和目标公司业务模式、组织结构的调研；· 负责行业资深人士的定位、寻找和邀约；· 负责项目资料和推荐信的撰写与翻译；· 负责电话会议、展会、沙龙的创建、协调与看护；· 负责项目后续事项的跟进；· 负责项目及日常工作汇报。我们提供：· 宽裕的假期：全年14日带薪年假，7日不扣薪病假· 美资公司，英文的工作环境、年轻人为主的轻松工作氛围· 定期团队建设活动、额外补充医疗保险等,アソシエイト　日本語・中国語対応,https://jobs.zhaopin.com/CC286004410J00237798602.htm,招2人,8K-10K
北外滩,上海-虹口区,北京华锐童之摇篮商业有限公司,CZ859330340,民营,2019-08-09 09:04:50,本科,3-5年,岗位职责：1、 根据部门销售目标、负责规划淘宝、京东等电商销售渠道的运营方案;2、 负责针对店铺的整体规划、营销、活动策划、推广、客户关系管理等系统经营性工作；3、 指导开展店铺运营诊断分析，通过行业、竞争对手数据分析，发现店铺存在问题并向运营团队提出优化建议;4、 分析各项数据，进行店铺及产品优化，提升成交转化率、回购率等;5、 负责完成店铺月季、季度、年度销售任务;6、 制定并完善电商运营团队的工作流程、执行规范等基础制度，并落地实施。岗位要求：1、具有大专以上学历，有服装、百货、卡通衍生品、体育品牌行业电商经验优先考虑；2、有3年以上互联网电商平台运营经验，有淘宝、天猫及京东平台代理运营经验者优先考虑;3、掌握平台运营模块系统的方法论及实操技巧;4、有丰富的网站产品品类管理、运营和推广的实战成功经验;5、对数据有高敏感度，能够通过对各种运营数据的归纳、分析，发现问题并解决问题;6、有较强的沟通能力，能够赋能团队成员;7、有较强的管理能力，能够带动团队的发展。,电商运营经理,https://jobs.zhaopin.com/CC859330340J00166302514.htm,招1人,15K-25K
江湾,上海-虹口区,上海蓝色畅想图书发行有限公司,CZ145169550,国企,2019-08-09 09:23:14,本科,不限,岗位职责：岗位职责：1、负责省区经销渠道管理工作，确保良好的产品流通秩序，包括日常销售业务、销售渠道建设与管理、风险控制与市场秩序维护、销售信息的管理与服务；2、协助高等教育出版社相关部门在华东区的营销与管理工作。任职资格：1、全日制本科及以上学历；2、38岁以下，身体健康，能经常出差；3、具备良好的职业道德与素养，具有较强的协调沟通能力、市场拓展能力，以及良好的市场调研分析能力和文字表达能力。4、有教育行业工作经历或本行业工作经验者优先。 公司地址：上海市虹口区宝山路848号交通：地铁3号线至东宝兴路站、地铁8号线至虹口体育场站邮箱：hepsh1@163.com,销售管理/渠道管理/业务员,https://jobs.zhaopin.com/145169555250026.htm,招2人,10K-15K
,上海,上海文化广场剧院管理有限公司,CZ402719720,国企,2019-08-09 09:10:38,本科,1-3年,职位描述：执行主剧场、附属场地及剧院联动资源的租用事宜，负责剧院经营业务的推广和关系的维护，以增强运营效益，提升剧院影响力。 任职要求：1. 全日制本科及以上学历，企业管理、艺术管理、市场营销等相关专业；2. 熟悉舞台艺术和演艺行业，具备一定的经营管理工作经验；3. 具备良好的服务意识和分析问题、解决问题的能力，出色的团队合作精神和执行能力以及良好的职业道德操守；4. 善于沟通协调，变通应对能力强；5. 具备良好的中文书面能力和语言口头表述能力，英语听说读写熟练，办公软件操作技能娴熟；6. 相貌端正，身体健康，无慢性病史，无不良嗜好。,场地经营管理执行,https://jobs.zhaopin.com/CC402719727J00069136705.htm,招1人,6K-8K
江湾,上海-虹口区,上海蓝色畅想图书发行有限公司,CZ145169550,国企,2019-08-09 09:23:14,本科,不限,岗位职责：岗位职责：1、负责省区经销渠道管理工作，确保良好的产品流通秩序，包括日常销售业务、销售渠道建设与管理、风险控制与市场秩序维护、销售信息的管理与服务；2、协助高等教育出版社相关部门在华东区的营销与管理工作。任职资格：1、全日制本科及以上学历；2、38岁以下，身体健康，能经常出差；3、具备良好的职业道德与素养，具有较强的协调沟通能力、市场拓展能力，以及良好的市场调研分析能力和文字表达能力。4、有教育行业工作经历或本行业工作经验者优先。 公司地址：上海市虹口区宝山路848号交通：地铁3号线至东宝兴路站、地铁8号线至虹口体育场站邮箱：hepsh1@163.com,销售管理/渠道管理/业务员,https://jobs.zhaopin.com/145169555250026.htm,招2人,10K-15K
,上海,上海文化广场剧院管理有限公司,CZ402719720,国企,2019-08-09 09:10:38,本科,1-3年,职位描述：执行主剧场、附属场地及剧院联动资源的租用事宜，负责剧院经营业务的推广和关系的维护，以增强运营效益，提升剧院影响力。 任职要求：1. 全日制本科及以上学历，企业管理、艺术管理、市场营销等相关专业；2. 熟悉舞台艺术和演艺行业，具备一定的经营管理工作经验；3. 具备良好的服务意识和分析问题、解决问题的能力，出色的团队合作精神和执行能力以及良好的职业道德操守；4. 善于沟通协调，变通应对能力强；5. 具备良好的中文书面能力和语言口头表述能力，英语听说读写熟练，办公软件操作技能娴熟；6. 相貌端正，身体健康，无慢性病史，无不良嗜好。,场地经营管理执行,https://jobs.zhaopin.com/CC402719727J00069136705.htm,招1人,6K-8K
临港,上海,上海电巴新能源科技有限公司,CZ303626410,股份制企业,2019-08-09 00:51:36,本科,1-3年,"岗位职责：1.负责董事长的行政管理和日常事务，协助董事长进行各部门的综合协调，落实公司规章制度，加强对各项工作的督促和检查，沟通，内外联系，负责对会议文件决定的事项进行催办，查办和落实，加强对外联络，拓展公关业务，负责全公司组织系统及工作职责研讨修订； 2.协调公司各部门之间的关系，负责组织各部门的信息传递工作，保证各部门信息沟通顺畅；协调各部门的工作行为，使工作流程顺畅，实现共同的战略目标；3.负责公司对外形象宣传、公共关系和公司企业文化建设，代表公司与相关部门、上下级单位往来，保持与政府部门及相关企业的良好合作关系；负责公司的对外工作，协调公司与政府部门及企业的关系；负责组织公司企业文化建设，提炼和宣传企业理念；4.协助落实风控处工作规划及年度工作计划；5.根据年度工作计划,开展集团风险管理体系建设:包括风险识别、风险评估、建立风险信息库、风险应对及处置等；6.关注国家、行业等各类法律法规、政策等,结合集团各板块实际需求进行分析并提示风险; 结合集团各板块实际需求,协助业务单位完善重点薄弱环节,并针对开展的新项目/业务进行事前风险提示; 7.撰写各类风控工作报告，协助修订风控处各类专业制度；8.董事长安排的其他工作；任职资格：1.全日制本科以上学历（研究生优先）；2.良好的英语听说读写的能力；3.具备较强的组织协调、沟通计划和执行能力，丰富的应对突发事件的经验；4.文字功底扎实，逻辑思维严谨和全面的分析判断能力；5.能承受较大的工作压力，接受出差。公司提供免费的食宿",董事长助理,https://jobs.zhaopin.com/CC303626416J00280157702.htm,招1人,15K-30K
曹家渡,上海-静安区,上海桐栖信息科技有限公司,CZ291045580,民营,2019-08-09 09:00:56,本科,1-3年,1、本科及以上学历2、3年及以上前端工作经验3、熟练使用html/css/less/scss进行像素级页面还原4、熟练使用js/es6+进行业务逻辑开发5、熟练使用react或vue全家桶进行页面开发，有实际的项目经验6、 有websocket使用经验7、熟练使用echarts进行图表开发8、熟悉一门后端语言，包括但不限于(java/nodejs/go/python)9、有微信相关开发经验，熟悉微信jssdk的应用 者优先,web前端工程师,https://jobs.zhaopin.com/CC291045580J00382416007.htm,招3人,10K-15K
莘庄,上海,上海三安实业有限公司,CZ412464120,民营,2019-08-09 09:20:18,本科,1-3年,岗位职责：1、负责整体店铺的销售目标的完成和完成相应工作计划2、负责日常店铺工作：新品上架，错误标题调整，详情页优化，关联页面制作，评价（差评和广告）维护3、负责店铺日常活动报名，淘宝小二业务帮忙以及活动策略制作4、负责与美工沟通制作相关的活动承接页面以及活动策略5、负责店铺后台的各项维护：投诉，违规，售后，异常订单等相关维护及处理6、负责日常店铺与品牌方对接、反馈、调整以及价格体系的维护任职要求：1、熟练天猫后台以及天猫业务，任职至少1年以上2、能够及时完成和平台小二的对接和相应的沟通3、能统筹运营助理及美工的相关工作协调完成任务4、有一定专业能力，活动资源拓展及推广能力5、有1-2年以上的电商行业经验,天猫超市运营专员,https://jobs.zhaopin.com/CC412464128J00076742105.htm,招2人,8K-10K
肇嘉浜路,上海,萨孚凯信息系统有限公司,CZ277851710,外商独资,2019-08-09 00:53:01,本科,3-5年,1、   本科学历，计算机相关专业，2、   2年或以上web应用项目开发经验，熟悉HTML5，JavaScript，CSS；3、   具有阅读需求文档理解业务需求的能力和语言沟通表达能力；具有强烈的责任心和吃苦耐劳的精神，擅于协作，具备良好的团队合作精神，能够承受项目开发中的压力；4、   具有人力资源行业相关软件开发或解决方案研发经验的优先录用；5、   具有vue、ES6经验；,前端开发工程师-上海-00567,https://jobs.zhaopin.com/CC277851712J00283828904.htm,招1人,10K-15K
金沙江路,上海,上海文沥信息技术有限公司,CZ164392120,民营,2019-08-09 00:51:25,本科,3-5年,"职位信息1、负责公司产品以及项目中Web前端的研发；2、配合产品、设计、研发人员，根据UX需求，实现页面互动以及后台数据交互的功能；3、确保WEB前端在不同平台、浏览器的兼容性；4、不断优化用户体验，提升页面响应速度、界面的友好性以及易用性。任职要求：1、3年以上工作经验，计算机相关专业，本科及以上学历；2、精通至少vue.js，react.js其中一种，熟悉一种或多种大型前端框架，如Vue，EasyUI ，angularjs等，对各种JS框架有快速学习能力，有Vue框架项目经验优先考虑；3、精通web相关技术，HTML5,CSS3,jQuery,Bootstrap,Javascript；4、代码简洁、高效，达到业级别代码标准；5、对前端设计，用户体验有深入的理解；6、具有自建原生JS代码完成特定动态效果的能力；7、对微服务有与系统架构有深刻的了解，能够根据前端需求与架构师设计系统架构；8、能够在敏捷团队中主导前端需求的实现和开发(Scrum Master)。",高级前端工程师,https://jobs.zhaopin.com/164392122250688.htm,招1人,15K-30K
五角场,上海,上海梅思泰克环境股份有限公司,CZ216648210,股份制企业,2019-08-09 09:10:17,本科,1-3年,职位概要：配合工艺设计、审核相关通风的施工方案及施工进度并参与指导，提出专业化的建议。一、职位描述1. 通风设计专业分工，根据工艺设计要求，独立开展工业通风收集管线施工图设计，出具风管轴侧图、布置图、工程量清单、施工设计说明、阀门及仪表提资；2. 负责通风专业设计交底，图纸变签；3. 通风管道水力计算、校核，提出通风工程调试技术指标；4. 对接通风工程专业分包单位，明确设计参数、技术要求，对阀门等重要部件的选型进行控制；5. 配合其他工程师的相关工作。二：职位要求：1. 供暖与通风、热能与动力工程、环境类等相关专业专科以上学历；2. 精通通风专业设计，持有注册公用设备（暖通）工程师证书者优先考虑；3. 熟练应用CAD制图软件及办公软件；4. 熟悉本专业各项规范，以及各种材质风管的设计、制造、安装技术；5. 细心严谨，有良好的职业素质、团队精神及语言组织和沟通协调能力。公司待遇：1、工作时间每天小于等于7.5小时，周末节假日双休；2、公司为员工缴纳五险一金，每月职称补贴另计；3、提供午餐补贴、出差津贴、带薪休息、年终奖等；4、薪资：税前6000元起，奖金另计等；5、公司拥有羽毛球俱乐部、健身俱乐部，定期有赛事等。您可以访问我们公司的主页：http://www.masteckcorp.com企鹅号2542354353,通风设计工艺工程师,https://jobs.zhaopin.com/216648213250281.htm,招2人,6K-12K
徐泾,上海-青浦区,德邦物流股份有限公司,CZ156976020,民营,2019-08-09 00:50:25,本科,3-5年,岗位职责:根据行业优秀经验，完善现有销售体系（包含但不限于：销售人员招聘、培训、日常销售的过程管理机制等）任职要求:1、有2-3年知名物流公司的销售类工作经验，且其中1年为销售主管、销售经理或销售高级经理；2、洞悉市场，逻辑思维佳、具有较强的沟通表达能力。,销售经理,https://jobs.zhaopin.com/CC156976022J00321662705.htm,招2人,20K-30K
半淞园路,上海-黄浦区,上海山田律师事务所,CZ202274120,民营,2019-08-09 09:03:40,本科,1-3年,职位描述：1、法律本科以上学位，持有律师执业证两年以上，有在国内外律所独立办理案件的经验。2、执业操守良好，形象大方端正，诚实敬业，胜任法律事务工作。3、有较好的中文文字功底及语言表达能力。4、工作责任心强，为人稳重，能和团队和谐相处，维护本所的信誉和利益。,授薪律师,https://jobs.zhaopin.com/CC202274122J00223899805.htm,招5人,7K-10K
张江,上海,上海市地江建设工程有限公司,CZ296120530,民营,2019-08-09 09:05:47,本科,不限,1、审核公司合同、相关单据与各项记账凭证，整理保管财务会计档案；2、登记保管各种明细账、总分类账，统计、打印、呈交、登记、保管各类报表和报告；                                                                                                           3、银行开销户以及涉税事宜；   4、协助审核记账凭证、核对调整账目、预算分析、控制日常费用、管理固定资产及低值易耗品的登记备案。                                                                                                                      5、完成上级领导交办的其他工作任务                                              岗位要求：    1、本科及以上学历，财务管理相关专业；    2、应届毕业生亦可，有1-3年财务工作经验者优先，具有财务类相关岗位资格证书，有建筑行业相关工作经验优先；             3、熟悉运用各类财务软件、办公软件；    4、优秀的敬业精神和职业道德，具有主动学习意识和创新精神；良好的组织、协调、沟通能力和团队协作精神，以及良好的抗压性；   ,财务助理,https://jobs.zhaopin.com/CC296120536J00172476606.htm,招1人,4K-6K
,上海-浦东新区,上海犀浦智能系统有限公司,CZ445520780,股份制企业,2019-08-09 09:16:41,本科,5-10年,职责：1、根据客户的工程需求，设计电子及电气自动化控制系统，电气图纸绘制、电气控制柜设计、电气部件选型、现场程序调试、系统集成等2、PLC、数控设备及机器人的编程与调试3、触摸屏上位机的HMI人机界面的设计和组态4、电子及电气部件选型和物料清单输出5、现场设备的安装、调试指导工作以及现场技术支持工作任职要求：1、电气自动化、自动控制、机电一体化相关专业本科及以上学历2、熟悉西门子、三菱、欧姆龙等PLC编程、熟悉WinCC、Intouch、Citect等HMI软件，了解cc-link、devicenet、profibus等现场总线4、可熟练使用AUTOCAD或EPLAN绘图软件，专业知识扎实，动手能力强，有团队合作精神；5、熟悉伺服控制系统，有数据采集或非标自动化设备控制经验者优先6、具有较强的工作主动性、语言表达能力及沟通协调能力7、参与过智能工厂方案设计、具有相关项目实施经验及项目管理经验，了解物联网、工业4.0、工业互联网相关技术方案者优先公司为应聘者提供有竞争力的薪酬及奖金，以及丰厚的福利待遇。员工同时享有临港地区特有的人才加分、住房补贴政策。欢迎您的加入！,高级自动化工程师,https://jobs.zhaopin.com/445520788250003.htm,招1人,15K-25K
北新泾,上海-普陀区,上海同策房产咨询股份有限公司,CZ000509950,合资,2019-08-09 09:11:17,本科,3-5年,岗位职责：  1. 构建并维护移动端推广平台以及各项自媒体渠道（官网、微信公众号等）。  2. 建立新媒体网络营销的模式，进行品牌在移动互联网的营销推广。  3. 配合公司部门战略计划，制定并实施线上推广方案，并对效果、反馈等市场回馈信息及数据负责。  4. 通过线上及数字营销手段，配合完成公司及项目的各项数据信息及资料库的建立。岗位要求：  1. 本科及以上学历，市场营销、计算机或互联网营销等相关专业毕业。  2. 三年以上线上多媒体渠道策划与实践经验，具有丰富的新媒体策划运营、移动互联网营销推广经验。  3. 具有地产项目或广告公司的同类服务经验优先考虑。  4. 具备扎实的技术背景，并具有良好的市场推广、活动策划、创新能力。  5. 对热点事件、流行元素、新潮语言、新闻事件有很强的敏锐度。,新媒体运营经理,https://jobs.zhaopin.com/CC000509954J00178140404.htm,招1人,10K-15K
,上海-浦东新区,上海天牧软件有限公司,CZ307152630,民营,2019-08-09 09:05:46,本科,5-10年,"1、5年以上工作经验，计算机相关专业毕业;2、熟练掌握ElasticSearch、Logstash、Kibana 和kafka,有线上系统部署和开发经验优先;3、熟练掌握Java编程语言,熟悉一门脚本语言;4、熟悉业界主流日志系统架构;5、人工智能或大数据相关经验优先; 6、去上海浦东金融公司（中国外汇交易中心直属子公司）外派岗位，福利面谈哦",大数据架构师,https://jobs.zhaopin.com/CC307152638J00314092408.htm,招1人,20K-40K
七宝,上海,灏腾国际贸易(上海)有限公司,CZ536021120,民营,2019-08-09 00:50:30,本科,3-5年,1、负责公司的会计核算事宜，及时做好凭证的编制、登记，做到帐证相符、帐表相符。 2、按月度及时填制并报送会计报表，包括成本报表、费用报表、工资报表、报表附注、科目余额表和财务情况说明等。 3、按月、季、年度及时进行税务申报及汇算清缴，依法正确计提和上缴各项税费，并负责公司税费台帐的登记和管理。 4、根据计划、预算指标审核各类成本费用支出单据，并报告计划和预算的执行情况。 5、负责公司对外统计工作，按要求及时上报统计报表。 6、负责公司固定资产核算，做到帐、卡、物相符，并按规定准确分类、编号、计提折旧。 7、做好会计基础工作，建立并负责公司固定资产、低值易耗品台帐管理，直接参与公司各项资产的清查和盘点。 8、配合各经营管理部门，及时清理债权债务，加速资金周转。 9、对公司的会计凭证、各类帐表定期打印、收集整理、装订成册、登记编号，按照《会计档案管理办法》妥善保管，并按照规定程序办理销毁报批手续。 10、负责公司相关验资、审计、税务咨询等事宜。 11、负责公司会计电算化核算系统的安全。 12、完成上级领导交办的其他事务。,主办会计,https://jobs.zhaopin.com/CC536021128J00107920801.htm,招1人,8K-10K
