address,city,company,company_id,company_type,date,education,experience,job_description,job_name,job_url,people_num,salary
凉城,上海,上海和邑信息科技有限公司,CZ679687830,民营,2019/6/30 18:19,本科,3-5年,1.精通Springboot， Spring Cloud；2.熟练使用Hadoop；3.熟练使用logstash+elasticsearch+kibana微服务后台日志管理系统；4.熟练掌握Linux脚本。备注：大学毕业后工作经验不足三年请勿投递；每年跳槽者，不建议投递；谢谢！ ,java开发工程师A1,https://jobs.zhaopin.com/CZ679687830J00073175908.htm,招5人,16K-27K
花木,上海-浦东新区,上海丽兹行房地产经纪有限公司-SH-Y5,CZ418846210D00112983621,民营,2019/6/30 19:50,本科,1-3年,【薪资福利】1、薪资构成：无责底薪6000~7000元/月+提成（5%-68%）+精英留任奖+年终奖2、六险一金：养老、失业、医疗、工伤、生育、商业保险，公积金，均缴纳上海本地的3、各类奖项拿到手软：新人奖、品质及价值范、支持个人及团队奖、个人月度销冠奖、团队月度奖……4、海内外任你游：泰山、青岛、杭州、海南、云南、泰国、韩国、马尔代夫.......就等你来！5、重磅奖励：员工父母——北京、上海、青岛、杭州等城市旅游，员工也放假呦！ 【岗位职责】1、爱学习，有耐心：通过公司系统化培训熟悉房地产基本业务及相关法律、金融知识，不功利服务客户，耐心为客户在房产交易中遇到的各类问题；2、会聆听，会提问：详细了解客户的核心诉求，精准匹配合适的产品信息，具备和用户良好的沟通能力，有团队协作意识和服务意识；3、爱琢磨，善思考:热衷于用户心理研究，善于从用户数据中提炼用户需求，利用个性化、精细化运营手段，提升用户体验； 【岗位要求】1.21-35周岁，二本及以上学历；2.具有良好的亲和力、理解能力、逻辑协调和沟通能力；3.积极乐观开朗，为人诚实守信，工作积极主动，注重团队合作；4.愿意服务于高端客户，并且通过与高端客户面对面沟通有意愿提升自己的综合能力；5.愿意参加公益活动，具有爱心和感恩之心 【带薪培训】1、77堂课程;房产知识、营销知识、交易知识、法律法规、客户维护、目标管理、谈判技巧、心理学、经济学;2、成长陪伴：一对一的师徒辅导3、线上自主学习平台;丽兹V学院，专业团队制作，每周大咖分享4、储备及管理课堂： LEC菁英俱乐部、黄埔培训班、虎将训练营、北京大学光华管理学院MBA 【晋升发展】公开、公平、透明的晋升体制（1）营销专家：豪宅顾问——资深豪宅顾问——高级客户经理——资深客户经理（挑战高薪）（2）管理岗位晋升：店经理（年薪40万起）——店面总监（年薪百万起）——大区总监 【面试攻略】联系方式：Bella  ***********（微信号）简历投递：**********************面试地址-上海浦东新区浦电路577号平安财富大厦东楼107乘车路线：上海地铁2号线上海科技馆/4号线浦电路下车步行5-7分钟均可到达公司详情咨询公司官网：www.lizihang.com,【别墅销售】底薪7k/金融转行首选,https://jobs.zhaopin.com/418846213274088.htm,招20人,7K-12K
莘庄,上海-闵行区,上海迪夫格环境科技有限公司,CZ555058720,民营,2019/6/30 20:04,本科,3-5年,岗位职责：1.负责垃圾焚烧行业VOC有机废气或一体泵站相关领域内的市场信息搜集、市场开发及项目发现； 2.负责深入的市场分析，提供市场运作的方向性建议； 3.负责销售渠道建立，依据客户需求做好售前、售后服务；对项目和客户进行深度跟踪； 4.负责制定销售计划，适时调整销售方案和策略，达成销售目标； 5.编制项目销售预算和项目销售决算； 6.负责签约项目的推进、监督实施及项目回款。任职要求：1.有丰富的环保、电力、钢铁冶金、化工、VOC有机废气等行业销售工作经验，熟悉行业情况和特点； 2.环境工程、化工、国际贸易、营销等专业本科及以上学历； 3.三年以上相关行业从业经验；具有良好的市场拓展能力； 4.热爱销售工作，具有强烈的责任心和进取心； 5.个性成熟、善于交流，具有良好的书面写作能力、沟通协调及解决问题能力； 6.较强的公关能力、客户服务意识及团队领导、搭建能力； 7.身体健康，能适应出差。,销售经理,https://jobs.zhaopin.com/555058720250003.htm,招2人,10K-15K
外高桥,上海,上海中信国安科技工程有限公司,CZ121077450,国企,2019/6/30 20:12,本科,3-5年,岗位职责：1、熟悉掌握财务制度、会计制度和有关法规。2、按照会计制度，审核原始凭证，编制记账凭证。及时记账算账、按时结账、如期报账、定期对账。3、严格票据管理，保管和使用空白发票、收据要合规范。4、妥善保管会计凭证、会计账簿、财务会计报表和其他会计资料，负责会计档案的整理和移交。5、及时清理往来款项，协助资产管理部门定期做好财务清查和核对工作。6、对主管部门和审计、财务、税务等部门依照法律和有关规定进行的监督，要如实提供会计凭证、会计账簿、财务会计报表和有关资料。7、负责编制公司的会计报表，执行公司经营中的财务预决算，经营活动分析、成本核算、控制；进行公司纳税申报。8、熟悉国家及上海市有关税务政策及相关规定，熟练掌握和使用国家金税系统。任职要求：1、大学本科学历，财务相关专业者优先。2、三年及以上工作经验，有建筑施工行业的会计工作经验者优先。,会计,https://jobs.zhaopin.com/CZ121077450J00237358402.htm,招1人,6K-8K
花木,上海,锐闻士信息咨询(上海)有限公司,CZ354517210,外商独资,2019/6/30 19:56,本科,不限,"融数据开发工程师 – RIMES Shanghai位置：上海部门：金融数据  描述：RIMES于1996年成立于美国纽约。近20年以来，一直专注于为全球大型机构客户提供专业金融数据服务。本公司是数据管理服务领域的开拓者，依托互联网云技术，为客户量身定制、分发金融数据。RIMES从创立伊始至今，一直以为客户提供一流的金融数据并为客户提供支持服务为己任。目前，我们正在寻找适合的金融数据开发工程师，加入我们上海的金融数据团队。 作为一名RIMES金融数据开发工程师，您将主要负责金融数据库ETL流程的开发和维护，确保每日数据库的稳定运行，并持续发现和解决潜在的问题。您将着手于设计和建立金融数据的获取和采集，自定义分析，以及分发的程序，并配合客服部门和数据质检团队为其提供高质量的数据支持。  岗位职责：- 金融数据的处理与开发，完成相应功能设计和模块开发工作- 客户与各部门新需求分析，参与新数据源、产品的设计工作- 现有系统的维护和优化 岗位基本要求：本科及以上学历，计算机、工程科学、物理学、化学、数学等相关专业优先熟悉Perl/Python, SQL优秀的逻辑分析能力，善于发现和解决问题较好的解决方案设计能力能独立工作、认真勤奋以及注重细节可以高效灵活的完成多项任务较强的英语口头及书面沟通能力 在达到基本要求的基础上，我们将会优先考虑具有以下能力的申请者：较强的编程能力, 适应远程合作和多任务的工作环境了解AWS云技术, Java, NoSQL, Hadoop, Git, 大型分布式数据处理框架对金融市场或金融数据方面有兴趣和学习意愿  请发送您的中文和英文简历至邮箱 **************, 并且请标明邮件的主题为“Data Developer - Shanghai”。想了解更多关于RIMES的信息，请登录 www.rimes.com。  ",金融数据开发工程师（Data developer）,https://jobs.zhaopin.com/CC354517216J00133497902.htm,招1人,10K-15K
江川路,上海-闵行区,乐世买(上海)实业发展有限公司,CZ583260620,民营,2019/6/30 19:59,本科,3-5年,"岗位职责：人事行政工作：1.人员招聘 2.合同管理 3.绩效考核。管理工作：1.工厂监管 2.仓库管理 3.采购管理 4.供应链管理。其他工作：1.文件草拟，2.政府接洽等任职要求：1．大专及以上学历，工作满三年以上；2．熟练使用WORD，PPT等办公软件，并熟练操作EXCEL数据计算统计功能；3．有良好的沟通协调能力，有解决突发事件的应变能力；4．开拓进取、吃苦耐劳、认真负责，有较强的工作责任心及团队合作精神；5．有一定的财务知识者优先考虑；英语听说读写良好者优先福利待遇:* 职位工资:试用期2个月，试用期8-10K，表现优异者转正后加薪+提成。* 只要你真心付出，薪资不是问题。* 员工福利包括年底红包，以及带底薪的假期！* 新员工公司提供带薪岗前培训,工作时间:周一至周五 上班时间:早上9点至下午18点, 大小礼拜。* 满1年以上享受年休假；结婚礼金；生育礼金；法定节假日慰问金；住院慰问金、年度体检、年度旅游拓展等等。晋升渠道：试用期——>总经理助理——>运营总监——>公司副总经理公司地址：宝山区蕰川路516号泰德科技园A座522工厂地址：闵行区天宁路51号5号楼3楼聚香楼",总经理助理/厂长助理,https://jobs.zhaopin.com/CC583260621J00059873207.htm,招2人,8K-10K
,上海-虹口区,上海丽兹行房地产经纪有限公司SH-Y9,CZ418846210D00113142861,民营,2019/6/30 19:27,本科,1-3年,【岗位要求】1.21-35周岁，本科及以上学历，较强的学习能力；2.具有良好的亲和力、沟通表达能力；3.理解能力、逻辑协调佳，乐观开朗，为人诚恳，乐于分享；4.工作积极主动，注重团队合作，愿意服务高端客户，想积累人脉、拓展视野，更想体现自己的价值，实现梦想 ；5.愿意参加公益活动，具有爱心和感恩之心。 【岗位职责】1.新员工入职，熟悉了解产品信息（一二手高端楼盘项目+金融产品等）；2.详细了解客户的核心诉求，了解公司产品，帮助客户进行房源的高效匹配，精准匹配合适的产品信息；3.带客户实地看房，进行商务磋商，谈判，促成豪宅成交，为客户提供最新豪宅市场分析报告，帮助客户做资产配置；4.与客户面对面沟通，通过Ipad、豪宅APP、楼盘字典等营销工具前期介绍产品信息，带客户看房、讲盘，通过市场数据分析，进行磋商、谈判，促成产品成交等； 【薪资收入】（1）显性收入：无责底薪6000~7000元/月+高提成5-68%+菁英留任奖+年度业绩累加奖（2）隐性收入：高端人脉积累、视野拓展、广阔晋升、管理经验、轻松简单的工作氛围、全面专业市场知识带薪培训  【其他福利】1.六险一金：养老、失业、医疗、工商、生育、商业保险；住房公积金；2.拨打电话免费：企业内部通话免费；3.多重奖励：新人奖、品质奖、价值范、支持个人及团队、职能嘉奖、破纪录奖；4.年度国内外旅游：泰山、青岛、厦门、海南、云南、泰国、韩国都曾留下我们的身影； 【晋升机制】公开 公平 透明的竞聘机制1.营销专家：豪宅顾问→资深豪宅顾问→高级客户经理→资深客户经理2.管理岗位晋升：店经理→店面总监→大区总监 【培训体系】1.师徒制：一对一的师徒辅导，除了工作，还有生活，有句话叫“有事找师傅”2.内训：（1）针对豪宅顾问——房产知识、营销知识、交易知识、法律法规、客户维护、目标管理、 谈判技巧、金融知识、心理学；（2）针对销售精英——百万尖子班；（3）针对管理岗位——黄埔培训班、虎将训练营3.外训：（1）中层管理者—PMBA课程、EMBA课程；（2）高层管理者----北大、清华总裁培训班，中欧课程4.行业交流：我们会不定期地请行业中的佼佼者进行交流学习,月入过万 销售代表/销售经理/客户代表,https://jobs.zhaopin.com/CC418846213J00054462113.htm,招20人,8K-10K
唐镇,上海,上海安赐环保科技股份有限公司,CZ193400010,民营,2019/6/30 18:24,本科,3-5年,岗位职责：1、负责设备管道布置图设计和工艺管道设计； 2、负责设备管口方位的确定；3、根据压力管道设计基础资料、数据和软件，进行压力管道设计计算，制定初步的管道等级表；4、完善三维设计软件中的管道元件库； 5、在项目执行阶段，和其他相关单位进行技术沟通交流，协调工程进度； 6、负责管道建设项目进度计划，监督施工进度，审定施工的相关费用； 7、按工程设计规定开展设计文件的编制工作，负责管道设计文件的整理和归档工作； 8、完成领导分配的其它工作。 任职资格要求： 1、化学工程与工艺或过程装备与控制专业本科学历； 2、环境工程公司、化工设计公司项目设计工作经验3年以上，熟悉化工装置工艺流程及平面布置；3、熟练掌握PDSOFT&PDMS绘图设计软件及办公自动化软件，有PDMS数据库管理经验更佳；4、具有较强的不断学习新技术的能力； 5、掌握工作领域的法律、法规、规范、标准； 6、能独立完成工程的方案与详细设计； 7、具备吃苦耐劳，能适应公司项目出差的需求。 8、具有较强的团队意识和协作意识；,管道设计工程师（化工环保）,https://jobs.zhaopin.com/193400019250800.htm,招1人,9K-15K
四川北路,上海,杭州亚学教育科技有限公司,CZ317455530,民营,2019/6/30 16:39,本科,不限,"ob Description/职位介绍   Understanding the internal corporate partner program processes of the Asia Institute.了解项目的内部管理和操作流程；   Collecting contact information for new corporate partners and confirming enough corporate partners to provide strong support for XPL programs.收集并整理潜在合作伙伴的联系信息，确保满足项目需要；   Assist manager with company visit engagement in support of short-term faculty-led education programs with a goal of 250 secured corporate speakers, including factory tours, throughout Asia and 60 internship placements in Asia.协助项目经理安排公司拜访，支持亚洲学院短期学习项目；   Work with our Program Management team to complete program materials for university partners, including Program Guides and timeline management, as well as on-time fulfillment of corporate and alumni contact requests.与项目管理团队一起为学校合作伙伴制定项目课程方案，包括制定项目指南手册及日程管理，并积极响应合作公司或校友的需求；   Managing the corporate partner database, including knowing well, logging date into the software, updating in time, etc. 管理企业合作伙伴数据库，将有关数据录入系统并及时更新；    Maintaining and expanding corporate partners. 维护并发展新的合作伙伴； Job Requirements / 职位要求   Good ability in reading, writing and communication in English.有良好的英语书写和沟通能力；   Quick learner, careful, hardworking and a strong sense of responsibility.学习能力强，工作认真仔细，有强烈责任感优先；   Strong ability to data collecting and analysis.较强的数据收集及分析能力   Proficiency with Word, Excel, PPT, PDF etc.熟练使用Word, Excel, PPT, PDF 等办公软件；   Bachelor degree or above.在读本科或以上学历；   Senior student preferred and provide opportunity to be a full-time member.大四学生可提供实习转正机会；   Open to any major 专业不限 Application Deadline / 申请截止日期: Jul 31st, 2019 / 2019年7月31日Position Location / 工作地点: Hongkou District, Shanghai / 上海市虹口区Send Resume to/请将简历发至: issa.wang@asiainstitute.cnContact/联系人: Issa Wang/汪小姐",企业合作伙伴经理助理,https://jobs.zhaopin.com/CC317455536J00129242102.htm,招1人,6K-8K
花桥,上海-嘉定区,上海浪旗实业发展有限公司,CZ307305130,民营,2019/6/30 19:23,本科,不限,职位描述：1.开展外贸销售业务，拓展海外市场，开发，维护国外客户；2.参加公司组织的各类展会及面对面与客户洽谈；3.及时给客户报价和按要求打样；4.签单后协调跟单员处理订单的后续跟进；6.售后服务。7.适应短暂出国出差。8.对公司的产品进行定位，带领业务团队发展业务。任职资格：外包业务员1.本科以上学历，英语四级以上，英语、国际贸易及理工科专业；2.致力于外贸行业的长期发展，有橡胶机械类行业工作经验者优先考虑；3.熟悉外贸和订单管理流程，具备扎实的行业经验，应届生亦可考虑；4.优秀的书面及口语表达能力，较强的商业意识及谈判技巧，开拓客户能力强；5.具有较强的进取心及团队合作精神，工作认真，责任心强，抗压能力强。6.有外贸团队管理经历。,外贸业务员（欢迎应届生）,https://jobs.zhaopin.com/CC307305132J00097762702.htm,招4人,4K-6K
镇宁路,上海,住化电子管理(上海)有限公司,CZ529421720,外商独资,2019/6/30 16:37,本科,5-10年,性别：不限年龄：35岁左右学历：海外留学或硕士以上学历优先考虑专业：法务相关专业工作经验：有8年以上相关工作经验语言/级别：日语熟练，英语良好  资格要求：通过司法考试，有律师资格主要业务内容：1、与外部律师联络，解答公司相关法律咨询2、公司合同审核、公司决裁合法性分析3、诉争案件、纠纷案件、合规问题协调及处理4、上级指派的其他业务5、管理指导下属人员,法务科长,https://jobs.zhaopin.com/CZ529421720J00236647105.htm,招1人,15K-20K
江湾,上海,上海识装信息科技有限公司,CZ699283530,民营,2019/6/30 18:05,本科,3-5年,岗位职责：1、审核公司各项成本的支出，进行成本核算、费用管理、成本分析，并定期编制成本分析报表2、协助各部门进行成本经济核算，收集有关信息和数据，进行有关盈亏预测工作3、评估成本方案，及时改进成本核算方法4、负责公司资产的管理及维护工作5、负责自营及周边产品业务模块成本的整体核算工作6、主管领导安排的其他工作等任职资格：1、会计、财务或相关专业本科以上学历2、3年以上互联网电商或大型企业集团财务工作经验3、熟悉税法政策、营运分析、成本控制及成本核算4、工作细致、严谨，并具有战略性前瞻性思维5、具有较强的判断和决策能力、人际沟通和协调能力、计划与执行能力6、具有一定的英语书写能力,资深会计,https://jobs.zhaopin.com/CC699283530J00264215102.htm,招1人,7K-12K
陆家嘴,上海-浦东新区,上海人瑞集团汇丰项目部,CZ340479010D00300595452,民营,2019/6/30 16:39,本科,不限,工作内容：一、淘宝客服日常工作1. 承接好前来咨询的客户，引导客户下单，完成销售业绩；2. 及时查看后台订单，对于已经下单的订单及时发货，核实客户收货地址；3. 处理好店铺的售后问题，降低退款率；4. 将店铺后台订单情况反馈给店铺运营，及时调整运营策略；5.对于拍下没有下单的客户，进行进一步的休咨询，记录客户的顾忌，在下一次销售的时候，可以从容面对；6.维护好老客户。对于店铺的老客户要保持联系，在活动或者节假日送去问候，提高店铺的回购率。职位要求：熟练操作电脑的能力工作时间：朝九晚六，周末双休,淘宝客服专员,https://jobs.zhaopin.com/CC340479015J00209756902.htm,招20人,6K-8K
张江,上海,上海南方基因科技有限公司,CZ121039380,合资,2019/6/30 19:11,本科,不限,"岗位职责：1. 科研方向：利用生物信息软件和统计学方法进行生物数据的分析研究，；2. 精准医疗方向：挖掘解读数据；3. 软件开发与流程搭建方向：根据生物医学行业趋势，对新软件和分析流程进行研发和创新。任职要求：1. 本科以上学历，生物学、计算机、数学、遗传学、生物信息学等理工科专业背景，具备高通量生物芯片数据分析，二代高通量测序数据分析工作经验者优先；2. 熟悉生物网站、数据库及相关软件；3. 有一定的计算机操作基础，熟悉linux系统者优先；4. 有一定的编程基础，python/perl/R语言优先；5. 具有良好的中英文阅读写作能力, 熟练阅读相关领域专业英文文献；6. 具备优秀的团队协作能力，良好的理解能力和沟通能力 。 ",生物信息工程师,https://jobs.zhaopin.com/121039381250020.htm,招3人,10K-15K
梅园,上海,上海惠汝国际贸易有限公司,CZ538984030,民营,2019/6/30 16:49,本科,5-10年,任职要求：1、金融、经济或相关专业大学本科以上学历2、五年以上信托公司或者其他金融机构市场营销工作经验；3、具备良好的语言沟通能力及协调能力；4、能够分析客户心理，优秀的谈判力，能够推荐适合客户的产品并有效维护原有客户，拓展更多高净值个人客户及机构客户；5、具有较强的团队协作精神，品行端正、严谨细致、踏实负责。工作内容：1、高净值个人投资客户及机构客户的开发及客户管理；2、集合信托产品市场营销及产品推介，完成营销任务；3、金融理财市场的跟踪、分析和研究；4、为客户提供财富管理咨询及其他增值服。,高级理财经理/私人银行/财富管理/信托,https://jobs.zhaopin.com/CC538984030J00072335404.htm,招2人,50K-70K
徐泾,上海-青浦区,德邦物流股份有限公司,CZ156976020,民营,2019/6/30 0:51,本科,3-5年,岗位职责:根据行业优秀经验，完善现有销售体系（包含但不限于：销售人员招聘、培训、日常销售的过程管理机制等）任职要求:1、有2-3年知名物流公司的销售类工作经验，且其中1年为销售主管、销售经理或销售高级经理；2、洞悉市场，逻辑思维佳、具有较强的沟通表达能力。,销售经理,https://jobs.zhaopin.com/CC156976022J00321662705.htm,招2人,20K-30K
,上海-普陀区,上海丽兹行房地产经纪有限公司-SH-Y5,CZ418846210D00112983621,民营,2019/6/30 11:03,本科,不限,【岗位职责】为高净值客户提供专业的高端房产成交服务。1. 熟悉了解产品信息（京、沪、美、英、澳大利亚、加拿大豪宅项目+金融产品等）；2. 与客户面对面沟通，详细了解客户的核心诉求，通过Ipad、豪宅APP、楼盘字典等营销工具向客户介绍产品信息；3.定期向客户发送市场行情分析报告，价值对比分析报告，做客户的私属房产投资顾问；4.带客户看房、讲盘，进行磋商谈判，促成产品成交； 【薪资待遇】给你基本生活保障，让你无忧挑战高薪无责任底薪6000元/月+1000学历津贴+高额提成5%-68%+精英留任奖+年终奖+带薪年假 【岗位要求】比起专业和行业经验，我们更看重你的学习能力和发展潜力。1.21-35周岁，统招二本及以上学历；2.具有较强的学习能力、沟通表达能力、理解能力、逻辑感、目标感；3.工作积极主动，有上进心，有一定抗压能力，注重团队合作 ；4.愿意参加公益活动，具有爱心和感恩之心；  【公平晋升体制】公开、公平、透明的晋升体制（1）营销专家：豪宅顾问——资深豪宅顾问——高级客户经理——资深客户经理（挑战高薪）（2）管理岗位晋升：店经理（年薪40万起）——店面总监（年薪百万起）——大区总监 【系统培训】师徒传承制度，一对一的师徒辅导；全年93节课程，快速吸收行业知识，成就专业梦想1.针对豪宅顾问—行业知识、营销知识、交易知识、法律法规、客户维护、目标管理、谈判技巧、金融知识、心理学……2.针对销售精英——百万尖子班、LEC（真正体验高端客户生活）3.针对管理岗位——黄埔培训班、虎将训练营 如果你想扩展自己的高端人脉圈如果你想在职场中实现自己的人生梦想如果你想在激烈的人才市场中成为不可替代的专业人才那么加入我们，一起打造最值得信赖的高端不动产品牌，顺便再挣点钱 欢迎加投递简历或直接跟我联系。丽兹行HR Bella ***********（同微信号）简历投递邮箱：**********************面试地址：上海浦东新区浦电路577号平安财富大厦（原葛洲坝大厦）主楼107,【别墅销售】无责底薪7k起+高提成 销售代表,https://jobs.zhaopin.com/418846213274074.htm,招20人,7K-13K
