address,city,company,company_id,company_type,date,education,experience,job_description,job_name,job_url,people_num,salary
金桥,上海,中建八局装饰工程有限公司,CZ138201670,国企,2019/6/30 15:05,本科,5-10年,一 、主要职责与工作任务  职责一职责表述：项目成本测算、项目管理目标责任书管理工作任务参与新开工项目的投标交底，对前期投标价、中标价情况了解及分析，完成前期资料的收集，为成本测算做准备；对中标项目进行标价分离，确定项目施工预算成本、责任成本，完成项目成本测算管理工作；完成项目管理目标责任书起草、签订及交底管理工作；督促岗位合同签订和风险金缴纳的管理。   职责二职责表述：项目成本过程管控工作任务按照公司要求完成在建项目成本过程管理；完成在建项目工程量增减、项目停复工、工期延长、项目经理更换等的成本重新测算及补充项目管理目标责任书签订；按照公司要求完成在建项目进行过程优化和季度过程效益考核、兑现工作；项目各类现场费用过程预控和警示；潜在亏损项目的预警、防范和监控管理。建立项目风险金台账，了解项目人员风险金转移、返还等动态情况  职责三职责表述：项目完竣工考核兑现管理工作任务根据公司要求督导竣工考核项目完成各项数据的确认、关账；根据公司要求完成项目完竣工考核工作，审核考核资料的完善与合规性，组织项目考核。督导完竣工项目考核资料（关账计提表、项目竣工考核书、项目效益及奖罚计算表、项目计提奖励发放明细表、完竣工项目考核兑现情况表等）收集、上报、完善及保管管理。   职责四职责表述：其他管理工作  工作任务积累、分析成本数据，总结管理经验；参与、指导公司成本管理业务争议问题的处理；参与项目成本管理工作监督、指导、检查和考核；成本报表管理；完成管理系统录入，监督项目完成系统录入；完成相关培训、商务例会的组织及管理，以及资料保管和报表上报；完成领导安排的其他工作（项目数据统计、部门后勤管理等）。内部协调关系机关各部门、项目部三、任职资格教育水平、职称及专业本科以上学历，助理工程师以上职称经验6年以上工作经历，至少4年项目或基层工作经历知识熟悉国家相关法律、法规；熟悉工程造价业务知识；熟悉项目成本业务知识；较强的文字处理能力、良好的沟通与协调能力、掌握计算机相关知识培训每年接受相关法律、法规的学习；工程造价业务知识；施工企业成本知识；企业管理及相关知识培训不少于40学时其它热爱本职工作，热爱团队；团结同事；原则性较强，廉洁自律；身体健康，责任心强、工作主动；有工作热情，不抱怨；服从工作调整和安排。特别优秀的可适当降低标准,商务管理部（机电工程成本管理）,https://jobs.zhaopin.com/CC138201678J00283786708.htm,招2人,10K-15K
莘庄,上海,上海渭以甲实业有限公司,CZ645098330,民营,2019/6/30 16:47,本科,无经验,"1. 负责公司产品的结构设计，零件选型，设计图纸输出。2. 负责设计产品的模具跟踪及样件制作；3. 协助电子研发工程完成相关工作，并可以向电子方面发展。任职资格：1.精通CATIA、CAD、等设计软件的使用，了解模流分析应用。2.能独立设计零部件结构。3.了解注塑模具，IMD模具及注塑工艺；4.有汽车项目产品设计经验优先考虑。5.性格乐观开朗、积极进取,易于合作和沟通。6. 可接受自动化专业本科学历应届毕业生",结构工程师,https://jobs.zhaopin.com/CZ645098330J00220782702.htm,招1人,4K-8K
外滩,上海,北京蓝汛通信技术有限责任公司,CZ000405630,上市公司,2019/6/30 0:50,本科,1-3年,1、开发互联网行业新客户，行业拓展；2、根据公司市场战略，对重点行业、客户进行跟进；3、收集各种有关市场销售信息，及时反馈客户资源信息，提出有效的市场运作及销售建议；4、为不同类型的商业客户提供技术解决方案；5、准备客户的销售计划、技术交流、Demo、建议书；6、配合技术支持部门，完成销售订单任职要求：1、对互联网行业有一定了解，从事过相关互联网在线服务销售优先；2、数据中心托管和CDN业务有经验者优先；3、2年左右销售经验，开拓或维护大客户能力优秀优先；4、迅速熟悉陌生人的能力独立开发新客户能力；良好的沟通技巧迅速拉近陌生人关系，创造交流感觉；5、善于总结经验，能吃苦耐劳，对新领域有高度好奇心，承受高强度压力。,销售代表,https://jobs.zhaopin.com/CC000405635J00050019414.htm,招1人,10K-15K
周家桥,上海,上海简中商务咨询有限公司,CZ426487720,外商独资,2019/6/30 16:40,本科,不限,"JobDescription: Human Resources and Accounting Coordinator PositionSummary: l  The Human Resources andAccounting Coordinator is responsible for supporting Human Resource services,primarily in benefits administration, recruiting, new employee onboarding and avariety of general administrative Human Resources tasks.  l  During peak season thisCoordinator will assist the finance department with administrative tasks aswell. The role maintains a thorough knowledge of Atelier Fusari Product andServices; as well as awareness of other roles and responsibilities throughoutthe organization. Primary Duties and Responsibilities ·        Assist withrecruitment process for all open positions such as posting jobs, prep applicantpackets, and screen applications, schedule interviews, manage interviewprocess, follow up with candidates, forward rejection letters  ·        Maintain all pertinent applicantand interview data in a spreadsheet; Administer and coordinate the day-to-day processing of benefit programsincluding new employees, changes, terminations, insurance claims and disability,keeping all tracking and records up-to-date   l   Oversee processing of accounts payable andreceivable and ensure prompt collection of receivables  l   Prepare accounting reports related to payroll;Oversee and maintain contracts with related vendors  l   Maintain an orderly and accurate financial filingsystem; Maintain an accurate chart of accounts  l   Work with the executive assistant to preparemonthly and annual operating budgets; Prepare accurate monthly financialstatements.  l   Supervise the recording of cash receipts and bankdeposits • Performs monthly reconciliations of bank accounts  l   Tag and monitor fixed assets and equipment; Ensureall bills and invoices are paid within 30 days of receipt.         Contact: CV and introduction in English to lin@atelier-fusari.com1.人力资源和会计协调员负责支持人力资源服务，主要是福利管理，招聘，新员工入职和各种一般管理人力资源任务。 2.在电子表格中维护所有相关申请人和访谈数据; 管理和协调福利计划的日常处理，包括新员工，变更，终止，保险索赔和残疾福利，使所有跟踪和记录保持更新。  3.与行政助理合作，编制月度和年度运营预算; 准备准确的月度财务报表。 4.监督现金收据和银行存款的记录•每月对银行账户进行对账 5.标记和监控固定资产和设备;确保所有账单和发票在收到后30天内支付。要求： 1.优秀的组织部门协调能力。2.强大的沟通技巧，能够用基本的会话英语。3.能够在团队导向的环境中良好地工作; 注重细节。4.对人力资源管理和时装业的热情。薪资：根据经验来定联系方式；请将CV及英文介绍发送至邮箱lin@atelier-fusari.com",人力资源/人事/HR/会计,https://jobs.zhaopin.com/CC426487720J00383421205.htm,招1人,6K-8K
,上海-徐汇区,上海丽兹行房地产经纪有限公司SH-Y9,CZ418846210D00113142861,民营,2019/6/30 12:40,本科,1年以下,【薪资福利】1.薪资构成：无责底薪6000~7000元/月+提成（5%-68%）+精英留任奖+年终绩效2.六险一金：养老、失业、医疗、工伤、生育、商业保险，公积金，均缴纳上海本地的哟~3.各类奖项拿到手软：新人奖、品质及价值范、支持个人及团队奖、个人月度销冠奖、团队月度奖等等4.海内外任你游：泰山、青岛、杭州、海南、云南、泰国、韩国、马尔代夫.......就等你来！5.重磅奖励：员工父母——北京、上海、青岛、杭州等城市旅游，员工也放假呦！ 【岗位职责】1.爱学习，有耐心：通过公司系统化培训熟悉房地产基本业务及相关法律、金融知识，不功利服务客户，耐心为客户在房产交易中遇到的各类问题；2.会聆听，会提问：详细了解客户的核心诉求，精准匹配合适的产品信息，具备和用户良好的沟通能力，有团队协作意识和服务意识；3.爱琢磨，善思考:热衷于用户心理研究，善于从用户数据中提炼用户需求，利用个性化、精细化运营手段，提升用户体验； 【岗位要求】1.21-35周岁，统招公办本科及以上学历；2.具有良好的亲和力、理解能力、逻辑协调和沟通能力；3.积极乐观开朗，为人诚实守信，工作积极主动，注重团队合作；4.愿意服务于高端客户，并且通过与高端客户面对面沟通有意愿提升自己的综合能力；5.愿意参加公益活动，具有爱心和感恩之心 【培养路径】1.77堂课程;房产知识、营销知识、交易知识、法律法规、客户维护、目标管理、谈判技巧、心理学、经济学;2.成长陪伴：一对一的师徒辅导3.线上自主学习平台：丽兹V学院，专业团队制作，每周大咖分享4.储备及管理课堂： LEC菁英俱乐部、黄埔培训班、虎将训练营、北京大学光华管理学院MBA 【晋升发展】营销【精英】发展规划：A0豪宅顾问-A8资深客户经理营销【管理】发展规划：（半年之后就可竞聘）1.A2豪宅顾问——店经理（B1—B9）2.店经理B3——店总监（C1—C3）3.店总监C2——运营总监内部【竞聘】公司职能岗位：如市场、渠道拓展中心、法务部等都是内部竞聘 ,月入过万 销售代表/奢侈品销售/客户服务,https://jobs.zhaopin.com/CC418846213J00054388213.htm,招20人,8K-10K
江川路,上海,格思培训学校,CZ485714830,合资,2019/6/30 14:13,本科,不限,1.为初中学生制定个性化学习方案，进行1对1、1对3、小班教学工作；2.帮助学生提高学习兴趣，养成良好的学习方法及习惯；3.为学生查残缺补漏，帮助学生尽快提高学习成绩；4.参加学科教研，学习活动、提高教学水平；岗位要求：1.统招本科学历以上，有教师资格证优选考虑；2.热爱教育教学工作，热爱学生；3.讲课条理清晰、风趣幽默、能够因材施教、启发教学；4.具有责任心、执行力强；员工福利待遇1、购买五险一金2、公司实行公平考核晋升的薪酬体系3、公司每月颁发优秀员工奖项和奖金4、公司不定期组织员工旅游等娱乐活动5、良好的职业生涯发展通道，助你成就事业梦想,初中物理教师,https://jobs.zhaopin.com/CC485714834J00382712105.htm,招10人,10K-15K
北蔡,上海-浦东新区,上海湃耳网络科技有限公司,CZ825710350,民营,2019/6/30 18:00,本科,1-3年,职位描述：1、负责和合作伙伴进行商务谈判，确保获得最优惠的商务条件，互利共赢。2、项目落地过程中内外部沟通协调。3、巩固、维护合作关系。任职要求：1、本科及以上学历，2年以上商务相关工作经验；2、具备良好的沟通能力，商务谈判技巧，思路清晰，表达顺畅；3、具备较强的自我驱动力和抗压能力；4、具备较强的执行力和良好的团队合作精神。,商务经理/商务主管/商务,https://jobs.zhaopin.com/CZ825710350J00273315104.htm,招1人,8K-12K
浦江,上海,上海杉一植物科技有限公司,CZ469466110,民营,2019/6/30 16:31,本科,5-10年,职责描述：1、负责统筹品牌、策划、交易的客户体系建立与调整的业务经营任务，制定公司市场策略与战略规划，为业务经营结果负责；2、负责统筹年度市场任务的制定，建立年度、月度、周、日目标管理体系，并监督执行，实现市场任务和目标；3、负责统筹制定市场策略，建立、完善销售各项流程、制度、规范，进行专业化、规范化管理；4、负责市场组织架构梳理、团队建设、团队管理工作；5、负责以结果为导向的市场绩效考核体系的建立并实施，并不断调整和完善；6、负责统筹市场体系大数据系统的建立，收集、汇总、分析，进行实时控制；7、负责统筹市场体系作业链、工艺链、工具包的建立与完善，专业化、精细化管理；8、负责市场体系年度、月度报告工作，进行工作分析与总结；9、负责处理市场体系出现的各项重大问题。任职要求：1、本科以上学历，广告学、市场营销等相关专业，35岁以内；2、掌握品牌、策划等专业知识，人员管理、综合管理等管理知识；具有7年以上相关工作经验，4年以上管理经验；能够独立建立市场体系，承担市场职能；3、责任心强、事业心强，具备系统性思维，学习能力强。,市场总监,https://jobs.zhaopin.com/CC469466112J00275768104.htm,招1人,15K-20K
花木,上海-嘉定区,上海丽兹行房地产经纪有限公司-SH-Y6,CZ418846210D00113009241,民营,2019/6/30 12:46,本科,不限,【岗位职责】1.新员工入职，熟悉了解产品信息（一二手高端楼盘项目+金融产品等）；2.详细了解客户的核心诉求，精准匹配合适的产品信息；3.与客户面对面沟通，通过Ipad、豪宅APP、楼盘字典等营销工具前期介绍产品信息，4.带客户看房、讲盘，通过市场数据分析，进行磋商、谈判，促成产品成交等；【岗位要求】1.21-35周岁，统招二本及以上学历，经验不限，较强的学习能力；2.具有良好的亲和力、沟通表达能力；3. 理解能力、逻辑协调佳；4. 工作积极主动，注重团队合作 ；5.愿意参加公益活动，具有爱心和感恩之心；、【薪资待遇】无责任底薪6000元/月+高额提成5%-68%起+六险一金+精英留任奖+年终绩效奖+带薪年假【其他福利】六险一金：养老、失业、医疗、工伤、生育、商业保险；住房公积金；享受免费健康检查；节日福利：法定节假日、10天春节假、带薪年假.....带薪培训：一对一师徒辅导制；业务训（房产、金融、心理学、美学等）、管理者培训（中欧、北大光华等）、国内外交流沙龙...多重奖励：新人奖、品质奖、价值范、支持个人及团队、职能嘉奖、个人破纪录奖、个人/父母年度海内外旅游（泰山、青岛、杭州、海南、云南、韩国、马尔代夫...等你来！）逢节必过：圣诞节、儿童节、中秋节、感恩节...节日不停，happy不停；花式活动：爱心义卖、公益活动、舞蹈大赛、运动会、演讲大赛、文化沙龙、轰趴、生日party...还有：企业内部通话免费；不定期零食、甜汤、水果等；最简单坦诚开心的工作环境...公司总部地址：上海浦东新区浦电路577号葛洲坝大厦（平安财富大厦）详情咨询集团官网：www.lizihang.com,急聘销售顾问无责底薪6000+提成+六险一金,https://jobs.zhaopin.com/CC418846213J00137899113.htm,招50人,7K-14K
,上海-青浦区,上海丽兹行房地产经纪有限公司-SH-Y6,CZ418846210D00113009241,民营,2019/6/30 12:46,本科,不限,【岗位内容】1. 了解客户需求和公司豪宅项目，2. 为高端客户精准匹配投资产品3. 给客户提供豪宅市场最新投资讯息，4. 面对面磋商促成客户满意成交度 【必选理由】1. 21-35周岁，本科及以上学历——你的同事也都是这个学历起2. 无责底薪6000-7000+提成，无责底薪！——无业绩淘汰，高薪资生活无压力3. 朝九晚七点半，每周一休息（月初休周一周二），月休五天——不倒班，生活节奏稳定4. 客户净资产3000万以上——高端圈层精英人脉 【系统培训】★师徒制：一对一的师徒辅导，有自己专属的师父★线上平台：丽兹V学院，分类大讲堂★针对豪宅顾问——房地产基本知识，金融学，心理学，客户的经营管理，法律，税法等★针对精英及管理岗位——百万尖子班、LEC精英俱乐部、黄埔培训班、虎将训练营、北京大学光华管理学院MBA 详情咨询集团官网：www.lizihang.com 公司总部地址：上海浦东新区浦电路577号平安财富大厦（原葛洲坝大厦）,大客户销售代表+无责底薪7000+师徒制,https://jobs.zhaopin.com/418846213276625.htm,招20人,6K-8K
南桥,上海,上海闲风园林景观有限公司,CZ732318880,民营,2019/6/30 18:01,本科,3-5年,"中级景观施工图设计师/施工图主管负责辅助主创组内项目的操作，并具备知道、培养初级设计师的能力意识岗位职责：1、带领团队独立完成公司项目的施工图设计；2、负责现场解决问题，完成设计变更；3、团队初级成员的培养和日常管理；4、配合建立公司图片图库及施工图图库、施工图制图规范、施工图版面样板；5、其他领导安排的工作。任职资格：1、工民建、土木工程、园林等相关专业，本科以上学历；2、5年以上景观施工图设计工作经验，3年以上团队管理经验优先考虑；3、熟悉国家现行有关景观、建筑工程施工图设计规范，能独立绘制CAD园建施工图，有较高的方案理解能力及一定的项目跟进协调经验；4、具备较强的责任感及成熟主动的工作态度，良好的工作抗压能力；5、能吃苦耐劳,乐于协助他人的工作,工作细心踏实,为人诚恳热心；6、熟练使用Autocad、天正、Photoshop、SU等相关设计软件。福利：①、周末双休，节假日根据国家相关规定休假，享有年假及年终奖金；②、享受国家规定的五险一金； ③、公司提供一定的内部晋升和学习机会；       本公司是专业从事建筑规划和设计、商业地产景观设计、城市园林景观设计、室内设计以及市政园林施工的企业。　　我们坚信成功源自于专注，深入的专注度不仅是我们对客户的承诺，更是保持我们团队卓越的关键。我们的设计专注于环境，专注于健康，专注于社会，专注于人文精神，并解决这些实际需求而运用艺术化和设计手段。我们的设计不只是流于表面的形式，而是深深的植根于土地，稳定且意味深远，在时间的度量衡上生根发芽，生生不息。　　我们作为新兴的设计先锋团队，尊重、包容、互助、乐观和专注是我们团队的核心价值观。我们对团队的每一位成员的个人时间给予最大的尊重，严格按国家法定假日，能不加班尽量不加班。我们坚信最好的氛围才能激发出最好的团队创造力。我们内部严格控制各项繁琐的手续，精简一切影响设计自由度的不必要程序，一切管理活动都以创造最好的设计环境为核心目标。我们公司是一个以年轻人为主的公司，平均年龄35岁，公司氛围轻松活跃，拥有专业的乒乓球活动室、休闲咖啡吧以及工作餐厅等，每年会组织多次公司旅游以及参观学习活动，尽量为员工提供更好和更优的工作环境和条件。　　欢迎浏览公司网站：www.fvld.net；　或是微信公众号：闲风国际；　　简历及作品集请发邮箱：******************；　　请仔细查看公司的具体地址，如路途过于遥远不能过来请别投递，以免我们人事打扰您的宝贵时间，我们期待您的加入。我们公司需要初级、中级、高级等景观设计以及施工图设计相关的各个岗位的设计师，初级和实习设计师公司可以解决住宿问题，中级是15万薪以上，高级20万年薪以上，具体可面议；",景观施工图设计师,https://jobs.zhaopin.com/CZ732318880J00321245301.htm,招3人,10K-15K
南京西路,上海,上海盛易信息科技有限公司,CZ825708720,民营,2019/6/30 16:55,本科,3-5年,职位描述：1、执行采购订单和采购合同，落实具体采购流程； 2、负责按照采购申请单接收、采购、安排发货及跟踪到货日期； 3、执行并完善成本降低及控制方案； 4、开发、评审、管理供应商，维护与其关系； 5、整理采购相关记录，提交采购分析和总结报告； 6、完成采购主管安排的其它工作。 任职要求： 1、本科及以上学历，5年零售业相关品类采购工作经验；  2、良好的采购谈判能力和协调能力； 3、熟悉采购流程，熟悉供应商评估、考核，熟悉相关质量体系标准。,采购专员,https://jobs.zhaopin.com/CZ825708720J00415588801.htm,招1人,5K-8K
康桥,上海,上海凯众汽车零部件有限公司,CZ432496220,民营,2019/6/30 19:03,本科,1-3年,1：配合解决公司新产品研制、技术攻关中、生产过程中以及产品在市场使用中遇到的技术问题 2：对产品进行立项、项目研发阶段性评审和产品鉴定以及技术应用情况的评审等 3：熟悉实验室常用仪器及各种实验规程，有分析、解决问题的能力 4 ：化工工艺开发5、  对所负责的研发项目进行调研，制定计划并按进度完成6、  定期汇报技术研发工作进展，并提出自己的进一步计划或想法7、  对新产品的客户提供技术服务和支持 要求：化学工程与工艺专业本科及以上学历有水性汽车内饰胶、聚氨酯、溶剂胶相关经验者优先,汽车内饰水性胶胶黏剂研发工程师,https://jobs.zhaopin.com/CC432496225J00350195707.htm,招1人,15K-20K
古北,上海,上海芙技机械商贸有限公司,CZ459276310,外商独资,2019/6/30 19:02,本科,不限,公司出纳工作，进出口事宜的处理  ，英文熟练掌握，吃苦耐劳 ,出纳 进口,https://jobs.zhaopin.com/CC459276310J00272060108.htm,招1人,4.5K-6K
