address,city,company,company_id,company_type,date,education,experience,job_description,job_name,job_url,people_num,salary
虹桥,上海-闵行区,上海赫富斯建筑装饰有限公司,CZ370076720,代表处,2019-07-08 08:57:03,本科,5-10年,岗位职责：A：负责组织实施方案设计、项目设计管理、将设计任务落实在具体的设计人员。B：负责组织履行设计合约。C：监督和协调每一个设计助理的工作。D：独立负责地产精装修交付户型的设计任务；E：施工图审核与审批，施工图的错误负责。F：负责整个设计项目施工过程中与业主及施工公司良性沟通并跟进项目进展。G：负责将合同及设计资料按照公司的相关规定管理归档。负责实施需要客户签署文件的流程管理，如图纸签收单、文件发送记录等H:负责施工图的报建报审。J：负责指导施工阶段的活动，包括图纸审查、要求提供资料、图纸和文件的维护及各种记录存档等。H：在项目设计过程中，负责对业主方提出的预算、造价、工程成本进行控制；J：负责公司各设计部门的协调工作。K：负责指导项目组成员（或外包协作公司的设计师）解决在设计中遇到的设计难点。任职要求：1、独立完成与服务过地产公司精装交付标准户型的设计项目。2、有服务过排名前30强的地产公司的项目3个以上。3：能熟练使用CAD绘制施工图，能组织和协调其他设计师绘制施工图。能审核其他设计师绘制的施工图，并对施工图的质量和错误方面进行负责。4：能熟练掌握各种装饰施工工艺做法，并能在施工图和FFE文件中对施工工艺做法提出详细的要求。并能在日后的施工过程中对施工工艺做法进行审核。5:能熟练使用PPT制作设计方案汇报文件。,室内设计师-地产精装修项目,https://jobs.zhaopin.com/370076722250119.htm,招3人,10K-15K
赵巷,上海,上海熊猫机械(集团)有限公司,CZ302018430,民营,2019-07-08 08:27:13,本科,1-3年, 岗位职责：1、采集、调研供水管网各类运行信息，制定供水管网格局分析体系；2、使用建模软件进行城镇供水管网供水格局分析；3、设计并制定城镇供水管网压力优化方案；4、组织并带领方案落地实施活动；5、运用公司的软件产品和硬件产品，执行给水分析方法论；  任职资格：1、地理信息系统、给排水专业，本科及以上学历；2、熟悉GIS开发、具有一定的空间建库经验；3、数学逻辑优良，熟悉自来水管网，掌握各类计算机软件；4、有大型项目实施经验；5、具备较强的责任心及主动性，具备钻研精神。,给排水工程师（供水管网）,https://jobs.zhaopin.com/CC302018430J00038918504.htm,招2人,8K-16K
北新泾,上海,北京车音网科技有限公司,CZ368918310,股份制企业,2019-07-08 08:57:02,本科,3-5年,"职责：1.负责相关产品的web前端架构设计和研发，通过技术提升用户体验和可用性；2.熟练掌握HTML5/CSS/JavaScript等相关技术开发移动端和PC端前端页面；3.熟悉主流前端技术，如angularjs、react、vuejs等；4.思路清晰，善于思考，能独立分析和解决问题；5.具备良好的团队合作能力，主动性强，善于沟通，良好的问题定位分析能力；任职资格：1. 本科以上学历，工作经验3年以上；2. 精通JavaScript, CSS3, HTML5, 对Web标准和标签语义化有深入理解；-- 熟悉W3C规范，精通HTML、CSS、JavaScript/Ajax、XML/Json等前端开发技术，能脱离IDE手写代码；熟悉HTML5/CSS3优先；3. 理解web标准和兼容性，对可用性相关知识有实际的了解和实践经验；4. 代码可维护性高，对代码质量有较高要求；5. 熟悉各种浏览器和屏幕尺寸的兼容性测试；6. 能够熟练运用至少一款主流的JS框架，具有良好的代码风格、接口设计与程序架构；-- 对JavaScript/OOP有深刻的认识，熟悉主流的JavaScript框架，如jQuery、AngularJS、Vue、ReactJS等；能用JavaScript独立开发前端展现框架，对框架做过修复和优化的优先考虑；7. 良好的沟通与表达能力， 思路清晰， 较强的动手能力与逻辑分析能力；做事认真负责，执着于高标准的产品实现；8. 能够适应互联网行业高压工作，良好的团队配合能力。办公地点：泛亚技术中心，浦东新区龙东大道3999号",web前端工程师,https://jobs.zhaopin.com/CC368918312J00068263113.htm,招1人,10K-20K
虹桥,上海,上海宇井贸易有限公司,CZ150006010,民营,2019-07-08 08:22:34,本科,3-5年,岗位职责：1.负责所辖区域内的业务开展及售后服务工作；2.负责所辖区域营销网络的建立与深化，代理商、经销商的开发和维护；3.开发所辖区域直营市场；4.带领及管理所辖区域销售代表完成月度及年度销售目标；5.提供竞品市场信息并做出适当建议，以及同品种厂家和客户反馈的准确信息；6.维护客户关系，争取订单按时完成每月销售业绩，根据财务对帐单催讨销售款项；7.配合市场部做好相关市场和学术活动的策划，执行；8.公司要求的其他工作。 任职要求：1.本科以上学历，三年以上医药、医疗器械行业工作经验。2.有代理商或直营医院的渠道资源。3.敏锐的市场分析洞察力，具备全面深刻的营销知识和技能。4.有扎实市场开拓、渠道开发的知识和能力。5.对口腔行业熟悉者优先考虑。6.品貌端正，亲和力强，有良好的沟通力以及执行力，做事主动性强，责任心强。7.能适应经常出差，有区域市场销售经验者优先。,销售经理,https://jobs.zhaopin.com/CC150006015J00053412202.htm,招5人,5K-10K
华漕,上海,上海红星美凯龙置业有限公司,CZ621708320,民营,2019-07-08 00:51:12,本科,10年以上,岗位职责：1、制定价格计划、销售策略及推广策略，监督各项计划的执行与落实；  2、建立并维护与房管局等相关政府职能部门关系，维护当地媒体关系，协助处理与销售相关的各项合规手续；3、维护客户关系，开发新客户，协调与指导代理公司进行销售；    4、监控销售案场管理，监督并指导代理公司有序合规开展工作；    5、根据公司审批确定的销售价格，对项目销售价格进行管理及审核；    6、监督审核销售合同及合同台帐，审核营销费用各项支出的支付流程；    7、参与项目施工阶段性检查，把握销售口径，对客诉风险点提前预警，防范并控制客诉影响，处理突发事件；8、按计划完成销售开盘时间节点及销售额，督促并沟通协调销售回款，保证公司整体销售指标达成。任职资格：1、本科及以上学历，市场营销专业或相关管理类专业；    2、10年以上房地产开发企业销售管理工作经验；  3、2个以上项目销售全案操作经验；    4、熟悉房地产市场法律法规及相关政策；    5、了解房地产行业市场营销流程及管理要求；    6、熟悉营销学、消费者行为学等相关知识。,营销总监,https://jobs.zhaopin.com/CC621708327J00209641801.htm,招1人,30K-50K
顾村,上海,上海春育教育科技有限公司,CZ680003030,民营,2019-07-08 08:51:41,本科,1-3年,岗位职责 1. 为学生提供专业的高质量教学服务，组织好课堂教学；2. 帮助学生提高学习兴趣，养成好的学习方法及习惯；3. 与学生及家长保持良好沟通，阶段性反馈学生学习情况；4. 参加学科教研备课，提高教学水平，为校区提供高质量的本地化教学资源，在自适应学习系统中进行本地化教学内容设计；5. 为人师表、身正为范、具有良好的教师职业操守；6. 负责开放式学习社区的秩序管理／陪读／答疑解惑等教学服务工作。 任职要求1. 本科及以上学历，汉语言专业，2年以上教育工作经验，普通话标准，仪表仪态端庄，有亲和力；2. 具有良好的教师职业操守和服务意识，热爱教育教学工作，热爱学生，为人师表；3. 具备一定的信息素养和教学设计能力，学习能力强，能秉持“以学生为中心”的教学理念组织教学活动；4. 不仅着眼语文学科知识的教学，同时关注学生语文能力水平和素质的培养；5. 专业功底扎实，沟通表达能力强，讲课条理清晰、风趣幽默，能够因材施教，启发教学；6. 有责任心、抗压力强、执行力；7. 能够适应周末及节假日工作（工作日可调休）。 福利待遇：管理+教学发展双通道；提供行业内富有竞争力的薪资；职前培训及完善的在职进修学习机制；带薪年假；年终奖；子女报班优惠；节假日慰问金；年度体检；结婚礼金；车费补贴；年度旅游、丰富多彩的团建活动等,语文老师,https://jobs.zhaopin.com/CC680003030J00199369808.htm,招2人,10K-15K
江桥,上海,仪菲(上海)品牌管理有限公司,CZ394268310,民营,2019-07-08 08:39:13,本科,3-5年,岗位描述：1、根据业务需求计划，制定采购计划，保证各种物资及时充足供应，进行国内及国外的供应商开拓和联络，寻找合作商机；2、进行供应商的评价和管理，并建立合理的采购流程，建立供应商档案，维护良好的客户关系；3、以品牌或项目为单位，协助跟进采购、价格协商、物流、付款及仓储等一系列工作；4、中英文和订货方顺利沟通，完成订货，保证无库存失误；5、系统地记录、跟踪所有订单，逐步优化订货流程；6、协助业务部门按时按量按质完成采购供应计划指标，积极开拓货源市场，并降低采购成本；7、对外交流有礼貌，树立良好的公司形象，不得随意告知他人公司的商业信息；8、做到以公司利益为重，不索取回扣，不收供应商回扣和礼品，遵守国家法律。岗位要求：1、本科以上学历，4年以上采购类工作经验，2年以上管理经验；2、在美妆、快消、商超领域具有良好的业绩、经验和职业道德纪录；3、英语听说读写流利，较强中英文书面沟通表达能力，能通过电话、邮件与供货商交流无误；4、 良好的学习能力，掌握或通过快速学习掌握美妆产品英文名称、美妆行业贸易相关词汇；5、热爱美妆行业，有该行业跨国采购相关工作经验者优先考虑；6、具备良好部门内和跨部门的组织和协调能力，良好的谈判、人际沟通能力，团队协作能力强；7、对美妆、时尚、流行、潮流有强烈的敏感度；,采购经理,https://jobs.zhaopin.com/CC394268316J00132300208.htm,招1人,8K-12K
赵巷,上海-青浦区,上海熊猫机械(集团)有限公司,CZ302018430,民营,2019-07-08 08:26:19,本科,5-10年,岗位职责：1、建立、健全公司法律事务相关规章制度和流程，为公司制订发展战略提供法律支持；2、负责审核公司内部合同、法律文件，处理合同、员工劳资纠纷等运营相关的各类内部法律文件，包括重大决议、规章、合同及其他重要文件，监督合同履行；3、参与公司参与公司业务项目调研、谈判， 起草谈判刚要及合作合同，提出法律意见，处理相关法律事务，为公司的重大决策提供法律依据规避运营风险；4、管理层及业务部门的经营活动提供法律咨询、意见和建议；5、负责公司各类相关法律事务的协商、调解、诉讼与仲裁活动。6、负责处理重大投资、收购、重组、资本运作、重大合同、重大诉讼等法律业务； 7、负责集团的法务培训等事宜。 任职资格:1.统招本科及以上学历，法律专业背景； 2.10年以上知名律师事务所及集团公司法务工作经验，或5年以上法务部门负责人经验；3.具有较强专业能力，较好的沟通能力和写作水平； 4.通过国家司法考试，具备法律职业资格； 5.具有上市公司、机械制造业公司背景经验优先。,法务总监,https://jobs.zhaopin.com/CC302018430J00247216604.htm,招1人,18K-25K
五里桥,上海-浦东新区,江苏浩丰生物科技有限公司,CZ467149620,民营,2019-07-08 08:24:02,本科,1-3年,1、性别不限、年龄不限、本科以上学历，品行端正、无不良嗜好。2、会使用色谱仪、质谱仪、气质联用仪，会打谱、读谱3、有香精香料行业检测从业经验者优先录用。4、待遇面议，五险一金，节假日福利，包食宿。5、工作地点：南通海门市,香精香料检测工程师,https://jobs.zhaopin.com/CC467149622J00339337603.htm,招1人,7K-10K
江川路,上海,上海市东方海事工程技术有限公司,CZ144701210,股份制企业,2019-07-08 00:50:36,本科,1-3年,"岗位任职资格：1、全日制大学本科及以上学历，自动化和计算机相关专业，英文良好；2、有2年左右连续软件产品研发经验；3、熟悉使用C/C++,C#等编程语言进行软件界面开发；4、熟练多线程编程，了解常用的Windows多线程编程模型；5、熟悉工业以太网、CAN、串口、USB等常用接口；6、有铁路信号软件开发经验者优先；7、具有高度的敬业精神和良好的团队合作精神，有良好的沟通能力和表达能力。岗位职责：1、工业系统上位机软件数据库设计、算法实现、界面开发等；2、软件编码和软件测试；3、对所开发的软件产品进行跟踪并提出改进意见；4、配合系统工程师和硬件工程师进行产品设计过程中的软硬件联调和验证；5、确定最终产品或系统，并准备用户手册等相关文件资料。",软件工程师-研发工程师,https://jobs.zhaopin.com/CC144701219J00207625602.htm,招1人,8K-12K
七宝,上海,上海弗格化工科技有限公司,CZ636274420,民营,2019-07-08 08:34:52,本科,1-3年,任职要求：1、专业不限。本科及以上学历。2、熟悉行业研究方式方法，有一年以上行业研究经验，有成熟报告撰写经验。3、熟练操作word、excel、ppt等办公软件，会简单PS。4、善于沟通合作。岗位职责：1、通过各种渠道收集、调研行业信息，建立并填充数据库；2、根据大纲整理、编辑、撰写行业研究报告；3、根据行业研究报告拆解、编辑微信公众号文章，并发布。4、建立微信群、QQ群，通过电话、社群、展览、会议等建立行业人脉关系。5、为会议部门提供可靠行业信息。,行业研究员,https://jobs.zhaopin.com/CC636274420J00352090703.htm,招10人,6K-12K
中山公园,上海,上海链家房地产经纪有限公司,CZ307313210,民营,2019-07-08 00:51:53,本科,不限,"电话联系可优先安排面试，链家HR赵自婷15921025663.【申请条件】1、全日制统招本科及以上，专业不限，20岁-30岁之间；2、形象阳光向上，具备一定的沟通能力；3、诚实守信、勤奋主动，具有高度的工作热情和团队合作意识；4、有销售、客户服务或学生社团干部经验者优先考虑  【岗位职责】1、负责客户接待、咨询工作，为客户提供专业的房地产置业咨询服务；2、了解客户需求，促成一二手房买卖或金融业务，负责业务跟进和房屋过户手续办理等后续服务工作；3、负责公司房源的开发与积累，并与客户建立良好的业务合作关系。  【薪酬福利】1、实习期 无责底薪5000元+3000元绩效＋1000元补贴（首月）+带薪培训+大平台晋升快2、转正后业绩提成（20%一70%），其中租赁业绩50%通提3、18年入职新员工入职公司旗下品牌自如，可享一年每月500月住房补贴，单间最高可享1000元；4、精英社成员享有出国游5、公司激励活动,与父母一起在人民大会堂共进晚餐,且报销往返路费 。 你对现在所取得的业绩和收入感到满意吗？在未来的3个月你是否有清晰的计划去改变现状，让自己的收入倍增？羡慕那些收入过万的人么？那些比你厉害100倍的人，真的有比你聪明100倍那么多吗？他们只是知道的比你多，在背后付出的努力比你多而已！如果，您想只用短短三个月的时间，就彻底改变人生……如果，您想立即拥有纵横商场的能力，彻底发掘自己的所有销售潜力……加入链家吧！手把手传授技巧，带您走上人生巅峰！！Lianjia .链家大家庭，我们需要敢梦敢拼的你！【你的工作】1.负责客户接待、咨询工作，为客户提供专业的房地产职业咨询服务；2.了解客户需求，促成二手房买卖或租赁业务，并负责业务跟进和房屋过户手续办理等后续服务工作；3.负责公司房源的开发与积累，并与客户建立良好的业务合作关系。【我们需要】1.年龄20-35岁，统招本科以上学历，热爱销售工作；2.善于沟通，有较强的语言表达能力；3.有较强的进取心、学习能力，勇于挑战自我，不甘平庸；4.有较强的服务意识；5.高素质优秀应届生优先录取。【关心业绩，更关心你——你的健康和安全也是我们的责任】1.意外保险+定期体检2.季度旅游3.社保+老员工津贴+带薪年假......4.人性化关怀员工：中秋大礼包、新年礼包送回家等节假日礼物拿到手软~【风雨同行、不再孤单】1.总部集训+区域培训OJT+门店带教三位一体+雏鹰计划+经理培训+在线培训系统+多媒体课堂+链家微课堂2.成长旅程，一路相伴！包教包会，不会再教！3.你不是一个人在战斗，后台支持团队杠杠地！【联系我们】联系电话：赵小姐15921025663（由于简历量大，电话联系将优先安排面试）面试地址：上海市闵行区莘松路58号东苑丽宝链家招聘部工作地点：按照员工个人意愿就近分配地铁路线：地铁1号线莘庄地铁站北广场出链家官网：sh.lianjia.com",应届毕业生/实习生/储备干部,https://jobs.zhaopin.com/CC307313213J00266070302.htm,招15人,8K-15K
张江,上海,上海动联信息技术股份有限公司,CZ136464880,民营,2019-07-08 08:15:08,本科,3-5年,"职位描述： 嵌入式软件开发(MCU/单片机/PLC/DSP …)。任职资格： 1. 全日制大学本科及以上学历，相关专业毕业；2. 3年以上相关工作经验，有丰富产品开发经验；3. 熟悉单片机开发、MCU微处理器架构、嵌入式系统设计，熟悉MCU相关驱动开发；4. 熟悉MCU的显示器、LCD、摄像头、蓝牙模块、WIFI模块驱动开发，熟悉TCP/IP、USB、串口、SPI协议的处理，熟悉boot/固件升级等；5. 熟悉Keil, IAR等集成开发工具 精通C语言，掌握汇编、shell、python语言；6. 丰富的接口调试经验，如UART/I2C/SPI/USB/SDIO...等。",固件开发工程师（嵌入式）-急聘,https://jobs.zhaopin.com/136464882250371.htm,招1人,15K-25K
徐家汇,上海,上海挚飞信息科技有限公司,CZ701502330,民营,2019-07-08 08:09:16,本科,3-5年,必须会K2 BPM精通.NET开发（C#），精通B/S开发架构，熟悉MVC，精通SQL SERVER数据库，精通系统运行环境部署。,.net开发工程师,https://jobs.zhaopin.com/CZ701502330J00070039902.htm,招5人,8K-16K
曹路,上海,上海泓智信息科技有限公司,CZ191761020,上市公司,2019-07-08 00:53:00,本科,1-3年,Java，ssm，J2EE1、 2 年以上互联网或 B/S 项目开发经验；2、熟悉 JAVA/J2EE，理解 io、多线程、集合等基础知识，熟悉分布式、缓存、消息等机制；3、 熟练 Spring、Hibernate、JPA 等框架，熟悉 SpringBoot，了解 SpringCloud;4、 熟悉 Oracle 数据库以及优化方法，了解 Mysql、Redis、MongoDB；5、 了解常用 Linux 命令;6、 具有较强的工作责任心和优秀的沟通协调能力；,java开发工程师,https://jobs.zhaopin.com/CC191761023J00305317107.htm,招3人,8K-10K
金桥,上海-浦东新区,钰真(上海)信息技术有限公司,CZ419257080,民营,2019-07-08 08:38:35,本科,1-3年,岗位职责：1、 负责协助日常招聘工作开展；2、 负责员工入职、转正、调岗、离职等手续的办理；3、 负责员工积分办理、档案保管、基础数据维护和更新、制作准确报表并提交4、 负责社保公积金、商险的变更、调整和汇缴，并对接相关人员；5、 负责日常行政工作或领导交办的其他工作；任职要求：1、 本科及以上学历，1年左右相关工作经验，人力资源管理、工商管理专业优先考虑；2、 具有招聘相关工作经验，熟悉招聘渠道以及流程。3、 具有较强的逻辑思维，善于分析总结，较强的沟通协调能力和执行力；4、 具有较强的学习能力，工作认真负责。薪资福利待遇：1、绩效奖金+年终奖金+五险一金+假日福利+节日福利+带薪年假+加班补贴+值班补贴；2、周末双休，弹性上班，法定节假日正常休息；3、公司提供不定期旅游，福利优厚。,人事专员,https://jobs.zhaopin.com/CC419257087J00263978605.htm,招2人,6K-9K
中山北路,上海-普陀区,上海浦东新区致学教育培训中心,CZ469323280,民营,2019-07-08 08:31:03,本科,1-3年,  致学教育成立于2004年，由华东师范大学教授、博士与市级教研员共同创建，通过多年的教育教学经验积累，已成为沪上知名中小学生学习能力辅导与培养的教育培训机构。 2019年致学优化发展策略，统筹线上线下，规划每年开拓3-5家新校区，实现2020年年销售3亿的目标布局！为了配合公司的发展战略，为沪上中小学生提供更优质的教育服务，正广募天下英才。挑战高薪，成就教育，成就自己，致学教育期待您的加入！ 一、薪资福利1.领先的薪资待遇：底薪（无义务课时）+课时费+续费奖金+绩效奖金+工龄工资，年薪12万-30万轻松拿到手！2.完美的工作时间：周一、二双休，周三-周五8:30-17:30，周六、日8:00-17:003.诱人的福利待遇：社保公积金+落户申请+居住证积分+带薪年假+年度旅游+节日福利+社团活动+员工生日会等；4.清晰的晋升通道：教学晋升通道+校区运营晋升通道学科教师—教研小组长--教研大组长--教学副校长/名师合伙人学科教师—教研小组长—分校副校长--分校校长--合伙人5.完善的培训机制：新教师入职培训12次+组长专业的培训带教+优秀教师培训分享+专业的课程培训+职业素养培训 二、教师职责：1.进行6人小班授课，提供专业高质量的教学服务；2.及时和校区沟通课程进度难度、学生反馈，总结教学得失；3.从教学层面配合班主任，积极与学生、家长沟通，做到家校互促，帮助学生；4.参与学科教学培训和课程教研工作，提高自身学科水平和教学能力； 三、任职要求：1.大学本科及以上学历；有教学经验（尤其是毕业班教学经验）者优先;2.熟悉上海中学学科教材，知识点及考点方向；3.普通话标准，讲课条理清晰，风趣幽默，有互动，能够启发教学；4.善于抓住不同学生的特点，高效地提优补差，有效提升学生成绩； 四、可选择的上班地址上海目前9大校区就近安排入职（地铁零距离）：虹口上外校区：大连西路617号明耀大厦2楼（3/8号线虹口足球场）闵行南方商城校区：古方路18号南方商务大厦11楼（1号线莲花路）闵行七宝校区：漕宝路3459号汇宝广场内汇恒大厦A栋7层（9号线七宝）静安共康校区：共和新路4666 弄11号城市新汇2楼（1号线共康路）普陀华师大校区：中山北路3553号伸大厦8楼（3/4/13号线金沙江路）浦东八佰伴校区：浦东南路1036号18楼（9号线商城路）杨浦五角场校区：国宾路36号万达广场B座14楼（10号线五角场）金桥151校区：金桥杨高北路（12号线杨高北路）杨思校区：浦东杨思路（8号线杨思路）新校区：正在大量选址中，说不定离您家更近了呢！,高中数学老师（做五休二 无责高薪）,https://jobs.zhaopin.com/CC469323285J00299565401.htm,招4人,18K-35K
新闸路,上海,纳意(上海)文化传播有限公司,CZ451243430,民营,2019-07-08 09:03:47,本科,1-3年,岗位职责：1、根据学生（年轻白领为主）的需求，定制个性化学习方案：2、负责日语教学工作，面对面教授；3、参与教研活动，教案制作。任职要求：1、日语专业本科以上学历，发音标准，口语流利；2、性格活泼、教学耐心，有激情、认真负责，有团队合作精神和敬业精神，良好沟通能力、学习能力 ；3、对外语教学有浓厚兴趣，热爱教育培训行业；4、有一年以上面向中国人的日语教学经验者或日本留学就职、翻译经验丰富者优先考虑；5、全职或兼职均可。,日语教师,https://jobs.zhaopin.com/CC451243438J00267524608.htm,招2人,8K-10K
