address,city,company,company_id,company_type,date,education,experience,job_description,job_name,job_url,people_num,salary
陆家嘴,上海-浦东新区,上海泉聂智能科技有限公司,CZ672164080,合资,2019-07-08 08:59:30,本科,1-3年,1.负责公司各销售平台数据收集、整理、分析；2.负责行业、市场数据收集、整理、分析；3.编写日常报表，制作分析报告；4.满足公司业务需求数据分析；任职要求：1.全日制统招本科及以上学历，统计、数据类相关专业优先考虑；2.熟悉互联网和计算机知识，熟练使用office系列办公软件，精通Excel常用函数以及透视表工具；3.有高度的责任心，较强的逻辑思维能力、沟通能力，对数字较敏感；4.做事严谨有原则，为人诚信，爱岗敬业；,Data Analysis数据分析专员,https://jobs.zhaopin.com/CZ672164080J00138590401.htm,招1人,8K-10K
长征,上海-长宁区,昆山恒捷化工科技有限公司上海分公司,CZ157073820,外商独资,2019-07-08 09:02:11,本科,3-5年,岗位职责： 1. 发展新客户扩宽工业漆、工业涂料制造厂家原材料销售渠道； 2. 发展华东区域工业漆、工业涂料厂家原材料有效客户，提高市场占有率； 3. 发展并维护华东区域工业漆、工业涂料重点客户；；4. 开拓新市场，维持现有客户并提供必要的售后服务； 5. 市场信息调查以及熟知竞争对手情况，与团队保持高度合作；6. 负责相关客户应收帐款的回收，降低逾龄帐款。任职要求： 1、本科及以上学历，应用化学、高分子材料等相关专业； 2、三年以上工业漆行业相关经验； 3、性格外向、反应敏捷、表达能力强，具有较强的沟通能力及交际技巧，有团队合作精神； 4、具备较强的客户沟通能力和较高的商务处理能力，能够适应出差。,销售工程师（工业漆行业）,https://jobs.zhaopin.com/157073824250375.htm,招1人,7K-10K
周浦镇,上海-浦东新区,扬子江药业集团四川海蓉药业有限公司,CZ130337900,民营,2019-07-08 09:03:47,本科,3-5年,岗位职责:岗位职责：1、计划组织临床试验，负责合理分配临床试验项目相关工作，保证项目顺利推进；2、详细制定所负责临床研究项目的总进度计划表，按计划完成试验项目的启动、执行与结束工作，定期向上级进行进度汇报；3、与主要研究者、分析、统计专家沟通临床研究项目、提供临床研究相关工作的支持；4、独立组织和召开研究者会议，临床研究启动会、总结会等医学类会；5、协助临床监查员解决临床技术难题，进行必要的公关工作；6、按照公司的各项操作规程，对项目团队进行临床试验方案、操作等相关知识培训；7、负责所接项目在执行过程中项目团队与运营部、医学部人员及药品的各类协调工作；8、领导安排的其他临时性工作。任职要求:任职要求：1、学历背景：硕士及以上（医药相关专业），优秀者可考虑本科学历。2、工作经验：有2年及以上临床试验从业经验。3、技能要求：具备丰富的临床试验经验；熟练掌握临床试验相关法律法规；了解药物研发全过程，熟悉药物临床试验各个环节流程；良好的项目管理技能（计划、执行以及跟踪）；能动地识别临床试验中的风险因素，并及时规避处理。4、职业资格（证书）要求：GCP证书；英语CET六级。5、能力要求：团队管理能力、协调和沟通能力、责任心和团队意识强、计划与组织能力、问题分析与解决能力。,项目经理(J12498),https://jobs.zhaopin.com/CC130337905J00329192207.htm,招1人,15K-20K
,上海,比自特株式会社,CZ645926280,外商独资,2019-07-08 08:48:43,本科,3-5年,【工作内容】负责本公司客户的软件系统设计以及开发任务【工作地点】东京及近郊【应聘条件】1.本科及本科以上学历；2.熟练掌握JAVA、C/C++、.NET（VB.NET，C#，ASP.NET）、Salesforce、 IOS、PHP、SAP、ABAP、Android等任意一种或多种开发语言和开发技能，3年及以上软件开发经验； 3.有对日开发经验有项目管理经验者优先；          4.日语达到2级以及以上水平，有书面沟通能力，口语能日常交流，技术优秀者日语要求可适当放宽。【福利待遇】1.雇佣形式：正社员2.月薪：22万～55万日元，视能力与经验而定，根据个人业绩的百分比抽成，能力越高抽成百分比越高3.试用期：三个月，月薪与正社员等同4.年终奖：一年1次5.每年有1次加薪机会（视个人表现和考核而定）6.休假：周末双休，带薪年假以及其他日本法定假期；7.交通费补助：上限2万日元8.享有日本各种法定保险年金制度9.公司内部活动等其他福利。【应聘方法】方法一：点击立即申请 方法二：WeChat：enibun2018人事专员：阎   【仕事の内容】システム設計・開発やテスト、運用保守等【勤務地】東京及びその周辺地域【勤務時間】9：00～18:00（フレックス勤務制度あり）、昼休み1時間、標準労働時間8時間【応募条件】1.大学を卒業した以上2. JAVA、C/C++、.NET（VB.NET、C#、ASP.NET）、PHP、Salesforce、SAP、IOS、ABAP、Androidなど何れの開発経験3年以上3.日本向けのシステム開発経験またはプロジェクト管理経験がある方優先；4.日本語レベルN2以上、読書能力、日常会話能力が必要。【福利厚生】1.雇用形態：正社員2.月給：22万～55万円 (能力、経験、年齢、前給考慮の上応相談) 3.試用期：約3ヶ月の間(給与は上記と同額) 4.賞与：年1回5.給与改定：年1回（本人の実績による）6.休日・休暇：土・日・祝日、夏季休暇、年末年始、有給休暇7. 交通費：実費精算（上限2万円まで）8.社会保険完備、各種手当、資格取得補助、健康診断、社員表彰制度、報奨金など9.会社の内部研修など【応募方法】１．立即申请のボタンをおしてください。２．WeChat：enibun2018人事担当：閻（エン）,"对日软件开发(Java,PHP,.NET）",https://jobs.zhaopin.com/CC645926286J00242993605.htm,招10人,12K-24K
长征,上海,昆山恒捷化工科技有限公司上海分公司,CZ157073820,外商独资,2019-07-08 09:02:13,本科,5-10年,工作职责：1. 发展功能性电镀添加剂重点客户和相关有效客户，提高市场占有率。2. 开发新客户，拓宽功能性电镀添加剂销售渠道3. 维持现有客户，并提供必要的售后服务，降低呆账风险4. 建立并维持重点客户，和相关有效客户间良好关系，达成销售目标及业务扩展要求：1.本科以上学历，化学或金属表面处理专业2. 熟悉功能性电镀添加剂销售市场，从事8年以上销售工作。3. 诚信正直、敬业、细心谨慎、吃苦耐劳、勇于接受工作挑战、抗压性强，有良好的沟通协调能力4. 能适应出差,功能性电镀添加剂销售经理/主管/资深高级工程师,https://jobs.zhaopin.com/157073824250004.htm,招1人,10K-15K
中山北路,上海-普陀区,上海浦东新区致学教育培训中心,CZ469323280,民营,2019-07-08 08:34:03,本科,1-3年,致学教育成立于2004年，由华东师范大学教授、博士与市级教研员共同创建，通过多年的教育教学经验积累，已成为沪上知名中小学生学习能力辅导与培养的教育培训机构。  2019年致学优化发展策略，统筹线上线下，规划每年开拓3-5家新校区，实现2020年年销售3亿的目标布局！为了配合公司的发展战略，为沪上中小学生提供更优质的教育服务，正广募天下英才。挑战高薪，成就教育，成就自己，致学教育期待您的加入！ 一、薪资福利1.领先的薪资待遇：底薪（无义务课时）+课时费+续费奖金+绩效奖金+工龄工资，年薪18万-30万轻松拿到手！2.完美的工作时间：周一、二双休，周三-周五8:30-17:30，周六、日8:00-17:003.诱人的福利待遇：社保公积金+落户申请+居住证积分+带薪年假+年度旅游+节日福利+社团活动+员工生日会等；4.清晰的晋升通道：教学晋升通道+校区运营晋升通道学科教师—教研小组长--教研大组长--教学副校长/名师合伙人学科教师—教研小组长—分校副校长--分校校长--合伙人5.完善的培训机制：新教师入职培训12次+组长专业的培训带教+优秀教师培训分享+专业的课程培训+职业素养培训 二、教师职责:1.通过公司教学平台进行在线小学、初中、高中学科教学工作；2.根据学生情况因材施教，提供专业化的、高质量的6人小班教学服务；3.维护学员关系，及时处理学员需求，提升学员学习动力；4.参与学科教学培训和课程教研工作，提高自身学科水平和教学能力； 三、任职要求:1.大学本科及以上学历；有教学经验（尤其是毕业班教学经验）者优先；2.热爱互联网教育，有线上授课经验者优先；3.普通话标准，具有较强表达力、亲和力、思维灵活，有良好的教学技巧；4.学科知识扎实，熟悉上海中小学学科教材，知识点及考点方向； 四、上班地址（地铁零距离）：总部普陀华师大校区：中山北路3553号伸大厦18楼（3/4/13号线金沙江路）,小初数学老师（线上授课）,https://jobs.zhaopin.com/CC469323285J00422001001.htm,招3人,12K-20K
颛桥,上海,上海澜澈生物科技有限公司,CZ636022730,民营,2019-07-08 09:03:52,本科,1-3年,负责电子仪器仪表类产品检验工作的技术指导与培训；按ISO9000标准和公司相关质量管理体系的要求，确保及提高产品质量符规定要求；建立健全原材料、半成品、外协品和成品检验记录及质量统计报表，每月进行质量统计分析，提出改进意见；负责电子元器件的检测、实验、老化，并建立相关检验记录及报表统计；负责检验仪器的配置、使用、校正和维护保养，保证检验工作的正常运行；负责分管产品质量分析、质量信息反馈，并组织有效开展质量改进活动；负责分管产品生产各工序质量巡检监控；负责分管产品检验规程编制、整理和完善工作；,检验工程师,https://jobs.zhaopin.com/CC636022730J00290653102.htm,招1人,6K-10K
三林,上海,上海宜展会展服务有限公司,CZ310139780,民营,2019-07-08 09:02:05,本科,3-5年,职位描述：1. 外贸业务相关财务工作 ，进行账务处理；2. 银行票据、现金等财务金融凭证解送和本外币结算；3. 负责业务的成本核算、进出口退税及外汇核销，纳税申报；4. 办理与客户与供应商之间的收付结算工作；5. 进行电子口岸卡操作，办理收汇核销，出口退税。办理网上发票认证，报税， 年度汇算清缴；6. 建立、执行国内、国际业务相关的财务制度；7. 编制会计总帐和分类帐；8. 保障运作资金供应和现金流畅顺，有效进行结算管理和应收、应付账款管理；9. 协调税务、银行等相关机构的关系；10.配合工商、税务、海关等部门的年检及审计工作。任职要求：1、3年以上外贸会计工作经验，能独立操作一般纳税人企业会计和进出口业务账目，熟悉外贸企业会计处理流程和方法，能独立完成整套的财务处理及财务核算；2、熟悉进出口贸易结算、结汇、退税等作业，能够独立、熟练、准确地完成进出口外汇核销、出口退免税申报、进出口结算等整套流程，了解一般增值税认证工作；3、熟悉外贸流程、银行业务、工商、税务等工作，了解报关、出口退税等相关国家政策、财税法规、会计法规和政府职能部门的办事程序；4、大专以上，财务相关专业，有外贸公司工作经验，有中级职称优先考虑；5、熟练掌握并使用财务软件和OFFICE办公软件，熟练掌握国家退税系统软件及退税申报工作；6、工作认真负责、细心严谨、爱岗敬业，具备优良的职业道德素养。,外贸 财务 会计,https://jobs.zhaopin.com/CC310139787J00337970403.htm,招1人,8K-10K
陆家嘴,上海-浦东新区,北京众品有道餐饮管理有限公司,CZ220032530,民营,2019-07-08 00:52:13,本科,10年以上,岗位职责：1．根据集团战略制定集团公司及子公司中长期人力资源战略规划，年度人力资源发展规划，并组织实施。2．参与集团及子公司重大人力管理决策，提供人力资源战略、组织建设等方面的建议。3．制定并实施完成各层面人力招聘，培训、绩效考核、激励、任用、留才、流才，企业文化推动等人才管理系统。4．建立和完善集团及公司人力资源相关管理制度与流程，组织、协调、监督制度、流程的执行。5．根据人力资源需求计划，开发和拓宽招聘渠道、优化人才招聘流程。根据集团及下属子公司对高级人才的需求，积极招募、网聚所需人才，并辅导人才的有效落地，搭建高效、奋进的管理团队。6．组织建立人才开发培训体系，领导建立并完善各子公司各职级职业生涯体系、后备人才梯队的建设。7．定期进行薪酬福利市场调研，制定以岗位价值为依据的、对内具有公平性、对外具有竞争性的薪酬体系及相关福利政策并实施。8．建立企业文化建设、引导员工深知、理解、符合企业核心价值观理念。提升员工贡献度。9．完成董事长安排的其他工作。任职要求：1．45岁以下，本科及以上学历，人力资源管理、企业管理等相关专业优先。2．10年以上大型餐饮企业或集团公司人力资源管理工作经验；5年以上集团型企业（拥有多家分子公司，含生产型企业）人资体系第一负责人（人资总经理、副总裁、人资总监）等工作经验。3．在人力资源战略规划，组织变革、人力资源体系构建，企业文化建设和管理方面有很深的造诣。4．熟悉人力资源管理国家和地方相关法律法规，合理规避劳动用工法律风险。5．有很强的领导能力、判断与决策能力、抗压能力，有优秀的战略性思维和全局意识。6．有很强的影响力，感召力和凝聚力。强烈的事业心，忠诚度高。7．良好的职业道德和素养，规范的职业行为等。8．接受西安、北京等地区出差。薪资待遇：综合薪资在20K-40K。,人力资源总监,https://jobs.zhaopin.com/CC220032530J00134880915.htm,招1人,20K-40K
洋泾,上海-浦东新区,东方希望集团有限公司,CZ000374740,民营,2019-07-08 08:51:36,本科,3-5年,岗位职责:1、参与集团内PTA项目研究、设计优化、工艺改进、技术革新等工作；2、对集团内已投产的PTA的达产达标、对标增效工作进行督导；3、对集团内已投产目的PTA项目生产现场管理工作进行督导；4、负责寻找、引进PTA行业的先进标准，并组织开展有关对标改进工作；5、引进PTA行业的先进设备和技术，并实施改善，提高劳动效率；6、参与PTA项目的有关生产干部的绩效考核工作；7、对集团内PTA项目进行现场技术指导和现场技术服务；8、具体负责集团重化工业现场标准化工作推进，建立有关工作标准，就有关工作开展进行策划、组织、检查、总结等；9、领导安排的例外工作。 任职要求:1、大学本科及以上学历，化学工程等相关专业；2、三年以上相关业务岗位工作经验，三年以上管理岗位工作经验；3、通晓PTA行业技术知识，熟悉生产管理的一般原理与方法；4、具有较强的计划和执行能力、组织协调能力、分析判断能力；5、具有一定文字功底，能熟练运用WPS、CAD等办公软件；6、能适应长期出差。 ,PTA工程师——集团总部,https://jobs.zhaopin.com/CC000374747J00310234403.htm,招1人,10K-15K
惠南,上海,上海赋民农业科技股份有限公司,CZ450362110,不限,2019-07-08 00:52:49,本科,3-5年,岗位职责：1、能独立完成纯水处理项目需求调查、方案编写；2、负责纯水水处理工艺与工程设计，绘制相关设计图纸；3、指导工程的现场安装、设备调试，解决技术难题；4、负责组织工程项目的实施、管理和控制；5、负责水处理工程的工艺调试工作，编制工艺调试方案；6、负责编制相关工艺指导手册，配合其他部门进行技术支持工作。,水处理工程师,https://jobs.zhaopin.com/CZ450362110J00175178304.htm,招3人,10K-15K
外滩,上海-黄浦区,上海大肆文化传播有限公司,CZ718135180,合资,2019-07-08 00:53:07,本科,无经验,要求性格仔细，严谨，思路清晰帮助维护客户关系，开发新客户薪资：底薪+绩效+提成模式,客户关系管理,https://jobs.zhaopin.com/CZ718135180J00042367907.htm,招1人,2.5K-4K
田林,上海,上海强然数码科技有限公司,CZ159224710,民营,2019-07-08 08:58:38,本科,3-5年,"岗位职责：1、负责功能模块设计，开发及单元测试； 2、协助并快速定位及解决开发及运行过程中的技术问题； 3、能按计划有效且高质量的完成分配的任务； 4、负责软件各阶段技术文档的编写； 5、积极了解公司业务，并参与相应的会议提供建议。 任职要求：1.计算机或相关专业，本科及以上学历,3年以上JAVA开发经验；2.熟悉软件工程，软件体系结构，擅长系统建模，精通面向对象设计方法，良好的技术文档习惯，规范标准化的项目管理方法；3.熟悉SpringMVC，Struts2，Mybatis等主流框架及中间件，并理解其原理；4.熟练使用Oracle数据库软件和应用编程。存储过程/函数编程技能，具备数据库优化技能；5.熟练使用Git或SVN等项目管理工具；6.头脑灵活，口齿清晰，形象良好，亲和力佳；7.具有良好的人际沟通能力，有较强的的客户服务意识和团队合作精神；8.有政法行业、档案行业业务经验者优先考虑。9.有管理经验者优先考虑。",资深JAVA开发工程师,https://jobs.zhaopin.com/CC159224714J00048656108.htm,招4人,8K-15K
陆家嘴,上海-浦东新区,上海忍足建筑设计有限公司,CZ400440520,民营,2019-07-08 00:52:22,本科,不限,岗位职责：1、协助配合主案设计师完成全套日本品质的施工图绘制；2、了解设计完成所需平面，立面等图纸绘制；3、协助配合在各项材料以及项目进度上跟进；4， 熟悉CAD软件操作任职要求：1、建筑、环艺、室内设计等相关专业专科以上学历；2、熟悉掌握施工图绘制规范和要求；3、工作积极主动、热情高、效率高、态度严谨；4、能够承受较大的工作压力。较强的组织协调、团队协作能力及解决问题的能力；联系时间：每周一到五（下午2-5点）工作地址浦东新区东方路8号21D室,CAD制图设计助手,https://jobs.zhaopin.com/400440529250046.htm,招3人,2K-4K
金桥,上海,北京车音网科技有限公司,CZ368918310,股份制企业,2019-07-08 08:57:02,本科,3-5年,"岗位描述： 1.负责车厂车机相关APP的开发工作；编写高质量的代码 ，注意代码细节； 2.参与到产品设计过程中，分析需求、把需求转换为产品； 3.设计良好的代码结构,不断迭代重构；乐于尝试各种新工具以优化工作效率 任职资格： 1.本科及以上学历，计算机相关专业；3-5年Android开发经验，能独立完成功能模块开发和单元测试； 2.熟悉android平台架构，熟练掌握java语言； 3. 扎实的java基础, 对数据结构有深入的理解, 了解android的组件化开发思想, 了解常用的设计模式； 4.熟悉Android MediaSession框架者优先； 5. 有Android车载应用相关开发经验值优先；6.具备良好的分析解决问题能力，善于主动推进项目进展并达成项目目标；有良好的沟通能力和团队合作精神，有责任心、抗压好学",中高级android开发工程师,https://jobs.zhaopin.com/CC368918312J00166367013.htm,招1人,15K-20K
九亭,上海,上海昂创工程科技有限公司,CZ894387630,其它,2019-07-08 00:52:52,本科,1-3年,岗位职责:1、施工图纸审核优化和设计开发协调；2、工程设计全过程管理和现场技术服务；3、工程设计质量及进度协调控制工作；4、按流程签署技术文件及变更洽商；5、工程技术业务文件管理。任职资格：1、建筑学或相关专业本科以上学历；2、5年左右建筑工程行业设计或规划工作经验；3、具有较强的大型工程项目方案设计能力；4、熟悉项目设计流程，对项目前期的设计有较强的掌控能力；5、能组织协调团队进行方案设计，统筹大局，具有良好的沟通及表达能力，责任心强，有敬业精神；6、具有项目场地设计（总图设计）、规划设计、建筑设计等方面的能力；7、熟知城市规划、建筑设计、构造学、给排水、暖道、电气、企业管理、相关法律等知识；8、对相关专业（景观、结构、设备）设计有较深的认识和一定的审核及协调能力，具备较丰富的现场  施工配合经验；9、具有独到的创作理念及创新意识，有项目设计组织管理经验，能准确理解项目需求，并善于沟通协  调，对建筑外立面和材料有较强的审核能力； 10、熟练掌握办公自动化、CAD制图软件和相关软件操作；11、与业主有良好的沟通能力；12、敬业负责，责任心强，有良好的组织协调能力及团体合作精神。,建筑设计师,https://jobs.zhaopin.com/CZ894387630J00254813904.htm,招1人,6K-8K
三林,上海,上海典汇文化艺术发展有限公司,CZ576720520,民营,2019-07-08 09:03:39,本科,3-5年,1、大学本科及以上学历，3-5年相关工作经历; 2、具备较高的理论修养和艺术鉴赏能力，具备良好的文学素养及文字功底；3、文案写作逻辑性强、有独特视角和见解，可独立撰写重大项目提案；4、 有丰富的想象力和创新意识; 团队意识较强，具有高度的理解能力及执行力；5、具有策划、编导大型专题片（栏目）、大中型综艺节目的能力；6、有丰富的提案经验及各类视频成片案例者优先；,电视编导,https://jobs.zhaopin.com/CZ576720520J00335847405.htm,招1人,6K-9K
虹桥机场,上海,爱达克车辆设计(上海)有限公司,CZ513378720,外商独资,2019-07-08 09:03:37,本科,10年以上," We are looking for a Team Leader for our body shop planning team in   China.    Your tasks will be: Technical and disciplinary leadership of the commercial vehicle BiW teamResponsibility for employee support and personnel planning, the further development of the team, recruiting, management of employees, candidate interviews and more.Processing of customer requests and customer acquisition (quotation preparation, proposal presentation, negotiation management with client)Profit and planning responsibility for ongoing projects, represent project to  the customerSupport sales and department management on site to ensure a constant productivityUnderstanding and implementing standards of the OEM (German)Requirement:            University degree in engineering and experience in the automotive industryExperience and knowledge of Body Shop Planning and Simultaneous Engineering.Familiar with software like PS/PD, Catia, Microstation.Knowledge in the product creation process and in the project structure planningExperience in a management function, preferably in the automotive environment and in ChinaA high degree of commitment and organizational skillsGoal-oriented and self-responsible work as well as a pronounced communication strengthWillingness to travel national and international on a regular basisHigh degree of personal self-responsibility and good communication skillsGood English language skills in written and spoken are mandatory, German and Chinese language skills are a plus ",Team Leader - Planning Body Shop,https://jobs.zhaopin.com/CC513378725J00139859101.htm,招1人,15K-25K
虹桥,上海,协同共享企业服务(上海)股份有限公司,CZ338094410,民营,2019-07-08 09:03:55,本科,不限,工作职责：1、负责公司项目、产品前期话题调研，了解市场需求（案头调研+客户调研）；2、安排活动议程，文案撰写，邀请分享嘉宾（中介机构+企业嘉宾）；3、项目现场主持及协调执行工作4、负责撰写法律研究报告5、负责同媒体等外部资源的组织协调及对接工作6、负责项目推广软文等相关资料的撰写7、完成领导交办的其他工作职位要求：1、法学本科及以上学历2、优秀的中文及文案书写能力3、良好的英文写作及口语能力4、良好的与人沟通及团队协作能力5、熟练运用office办公软件6、能承受高强压力7、有法律产品工作经验者优先,活动策划专员(法务方向）,https://jobs.zhaopin.com/338094410251067.htm,招1人,6K-8K
