address,city,company,company_id,company_type,date,education,experience,job_description,job_name,job_url,people_num,salary
,上海,上海禾木城市规划设计有限公司,CZ202107110,合资,2019-08-09 09:05:53,本科,3-5年,岗位要求：1、风景园林或环境规划专业本科以上毕业；2、3年以上工作經驗，有较强的方案设计能力，能熟练使用相关绘图软件；3、具有较强的沟通能力和丰富的项目管理经验，熟悉相关技术性规范；4、具有先进设计理念和思路，大型项目设计经验；5、有责任心，有较强的敬业精神和团队协作意识；,资深景观设计师,https://jobs.zhaopin.com/202107113250876.htm,招1人,6K-10K
张江,上海,上海伊邦医药信息科技有限公司,CZ151278310,民营,2019-08-09 09:26:09,本科,5-10年,职责描述：1、主要负责公司旗下B2B产品的整体业务流程设计和市场定位，规划产品功能架构及其发展步骤和策略；2、以公司目标为导向，结合市场竞争与业务发展情况，提出产品竞争策略和持续改进计划，并对客户和市场需求的优先级做权衡决策；3、关注产品各项常规数据指标及用户反馈，深入行业和客户沟通交流，充分了解行业规则，能独立输出高质量的市场需求文档、产品需求文档和产品原型设计；4、跟进产品推进流程，协调和组织项目团队成员，如设计、研发、运营、市场等部门，推动产品完成发布，对产品的应用和体验负责。 任职要求：1、计算机相关专业本科以上学历，3年以上产品设计工作经验，对医药/电商/B2B行业有较深度的了解，能独立完成整个产品规划和设计工作，有成功经验者优先；2、具备分析市场需求、用户价值的能力和一定的创新能力，能快速理解和挖掘用户的需求并能准确描述场景，提出有前瞻性的解决方案；3、熟悉产品实施过程，包括市场分析、需求分析、产品功能设计、业务流程设计、原型设计、产品可用性测试等；4、具备较强的逻辑能力、沟通能力和良好的文档撰写能力，能独立承担业务调研、市场分析任务，快速和团队达成共识推动项目执行落地；5、熟练掌握产品需求分析、原型、交互、易用性设计的技巧，熟练使用Axure、Visio、Mindmanager等常用设计软件，能准确表达产品及其原型设计。 ,高级产品经理,https://jobs.zhaopin.com/CZ151278310J00032117806.htm,招2人,15K-20K
江湾,上海-虹口区,熠文(上海)信息技术有限公司虹口分公司,CZ868636240,外商独资,2019-08-09 09:07:17,本科,无经验,岗位职责1、审核各部门成本、费用的支付申请2、境外收入申报，出口业务免税资料的准备3、更新银行现金日记账、每月汇总各分公司的银行现金报表4、与业务部门做好财务相关数据分析与核对5、协助完成其他日常事务性工作任职资格1、性格开朗，工作认真，注重细节2、熟练使用各种办公软件3、良好的学习能力和沟通能力，有团队精神4、英语良好，能与外国人进行书面及口语的工作交流,财务助理,https://jobs.zhaopin.com/CC868636240J00443035101.htm,招1人,4K-6K
,上海,格思培训学校,CZ485714830,合资,2019-08-09 09:05:38,本科,不限,1.为初高中学生制定个性化学习方案，进行1对1、1对3、小班教学；2.帮助学生提高学习兴趣，养成良好的学习方法及习惯；3.为学生查残缺补漏，帮助学生尽快提高学习成绩；4.参加学科教研，学习活动、提高教学水平；岗位要求：1.统招本科学历以上，有教师资格证优选考虑；2.热爱教育教学工作，热爱学生；3.讲课条理清晰、风趣幽默、能够因材施教、启发教学；4.具有责任心、执行力强；员工福利待遇1、购买五险一金2、公司实行公平考核晋升的薪酬体系3、公司每月颁发优秀员工奖项和奖金4、公司不定期组织员工旅游等娱乐活动5、良好的职业生涯发展通道，助你成就事业梦想,初高中英语教师,https://jobs.zhaopin.com/CC485714834J00298091505.htm,招10人,10K-15K
漕河泾,上海,上海朗盛教育信息咨询有限公司,CZ402987710,合资,2019-08-09 00:51:58,本科,1-3年,职责范围：1.完成安排的授课工作；2.做好教学用具及教学材料的准备工作，通过各种教学方法让学生投入学习，确保学生完成学习任务及目标；3.经常与学生家长交流学生学习情况；4.设计并指导学生作业，并给予有建设性的意见；公正客观地评估学生，并做好评估记录；对学生要做到耐心、细致、态度和蔼；5.准备并整理各种学习材料与资源，并按照要求归档；6.与同学科或跨学科的中外籍老师进行良好的教学合作；7.参加教学主管或校长召集的各类会议；8.认真完成教学主管或校长安排的其他任务。任职要求：1、本科以上学历，理科专业毕业，有国际高中特别是有A-level数学教学经验优先；2、可以用中英文双语教学和进行教学交流；3、热爱教育事业；有教师资格证优先；4、熟练应用多媒体及计算机办公软件；5、工作严谨、细心、耐心、有责任感，善于合作与沟通。,A-level 数学老师,https://jobs.zhaopin.com/CC402987717J00178623404.htm,招10人,10K-15K
,上海,上海禾木城市规划设计有限公司,CZ202107110,合资,2019-08-09 09:05:53,本科,3-5年,岗位要求：1、风景园林或环境规划专业本科以上毕业；2、3年以上工作經驗，有较强的方案设计能力，能熟练使用相关绘图软件；3、具有较强的沟通能力和丰富的项目管理经验，熟悉相关技术性规范；4、具有先进设计理念和思路，大型项目设计经验；5、有责任心，有较强的敬业精神和团队协作意识；,资深景观设计师,https://jobs.zhaopin.com/202107113250876.htm,招1人,6K-10K
金桥,上海,思佳科技(北京)有限责任公司,CZ530908830,民营,2019-08-09 09:06:00,本科,1-3年," 工作内容：从技术角度整体负责公司面向ADAS/AS的高速数据记录仪产品；负责为客户提供相关技术方案从技术角度与销售一起拜访客户为客户独立做详细产品演示能为客户提供定制服务支持职位要求：车辆工程，软件工程，计算机或通信专业本科以上学历；了解以太网通信原理基础，熟悉CAN,LIN, FlexRay等总线协议；有过C语言编程经验；具备ADAS相关开发测试经验者优先；熟悉Python优先；具有XML，LUA编程经验优先；英语6级学习能力强，具备团队精神",ADAS数据采集产品工程师,https://jobs.zhaopin.com/CZ530908830J00299112304.htm,招1人,15K-20K
江湾,上海-虹口区,熠文(上海)信息技术有限公司虹口分公司,CZ868636240,外商独资,2019-08-09 09:07:17,本科,无经验,岗位职责1、审核各部门成本、费用的支付申请2、境外收入申报，出口业务免税资料的准备3、更新银行现金日记账、每月汇总各分公司的银行现金报表4、与业务部门做好财务相关数据分析与核对5、协助完成其他日常事务性工作任职资格1、性格开朗，工作认真，注重细节2、熟练使用各种办公软件3、良好的学习能力和沟通能力，有团队精神4、英语良好，能与外国人进行书面及口语的工作交流,财务助理,https://jobs.zhaopin.com/CC868636240J00443035101.htm,招1人,4K-6K
,上海,格思培训学校,CZ485714830,合资,2019-08-09 09:05:38,本科,不限,1.为初高中学生制定个性化学习方案，进行1对1、1对3、小班教学；2.帮助学生提高学习兴趣，养成良好的学习方法及习惯；3.为学生查残缺补漏，帮助学生尽快提高学习成绩；4.参加学科教研，学习活动、提高教学水平；岗位要求：1.统招本科学历以上，有教师资格证优选考虑；2.热爱教育教学工作，热爱学生；3.讲课条理清晰、风趣幽默、能够因材施教、启发教学；4.具有责任心、执行力强；员工福利待遇1、购买五险一金2、公司实行公平考核晋升的薪酬体系3、公司每月颁发优秀员工奖项和奖金4、公司不定期组织员工旅游等娱乐活动5、良好的职业生涯发展通道，助你成就事业梦想,初高中英语教师,https://jobs.zhaopin.com/CC485714834J00298091505.htm,招10人,10K-15K
漕河泾,上海,上海朗盛教育信息咨询有限公司,CZ402987710,合资,2019-08-09 00:51:58,本科,1-3年,职责范围：1.完成安排的授课工作；2.做好教学用具及教学材料的准备工作，通过各种教学方法让学生投入学习，确保学生完成学习任务及目标；3.经常与学生家长交流学生学习情况；4.设计并指导学生作业，并给予有建设性的意见；公正客观地评估学生，并做好评估记录；对学生要做到耐心、细致、态度和蔼；5.准备并整理各种学习材料与资源，并按照要求归档；6.与同学科或跨学科的中外籍老师进行良好的教学合作；7.参加教学主管或校长召集的各类会议；8.认真完成教学主管或校长安排的其他任务。任职要求：1、本科以上学历，理科专业毕业，有国际高中特别是有A-level数学教学经验优先；2、可以用中英文双语教学和进行教学交流；3、热爱教育事业；有教师资格证优先；4、熟练应用多媒体及计算机办公软件；5、工作严谨、细心、耐心、有责任感，善于合作与沟通。,A-level 数学老师,https://jobs.zhaopin.com/CC402987717J00178623404.htm,招10人,10K-15K
中山北路,上海,上海塑盈供应链管理有限公司,CZ827304260,民营,2019-08-09 09:27:43,本科,1-3年,岗位职责：1、接听电话，接收传真，按要求转接电话或记录信息，确保及时准确；2、对来访客人做好接待、登记、引导工作，及时通知被访人员；3、保持公司清洁卫生，展示公司良好形象；4、负责公司快递、信件、包裹的收发工作；5、负责办公用品的采购与盘点工作，做好登记存档。并对办公用品的领用、发放、出入库做好登记；6、不定时检查用品库存，及时做好后勤保障工作；7、协助上级完成公司行政事务工作及部门内部日常事务工作。任职要求：1、 本科以上学历，前台工作经验1-2年；2、 工作认真负责，态度端正；3、  具有良好口头表达能力、亲和力和服务意识，沟通领悟能力强。,前台,https://jobs.zhaopin.com/CC827304260J00319894503.htm,招1人,4K-6K
,上海-闵行区,北京晨光在线科技有限公司,CZ380350620,股份制企业,2019-08-09 09:06:37,本科,不限,岗位职责：1. 对网页面进行检查；2. 视频、文字回查及监控。任职要求：1. 大专及以上学历，专业不限，热爱网络行业；2. 具有良好的沟通能力和团队精神，吃苦耐劳；3. 良好的文字组织及语言表达能力，较好的逻辑分析能力；4. 了解重大新闻事件和新闻背景，对时政内容较敏感。,视频审核信息专员,https://jobs.zhaopin.com/CC380350625J00176978711.htm,招2人,5.5K-6.8K
,上海-黄浦区,上海创试网络科技有限公司,CZ379993730,民营,2019-08-09 09:03:19,本科,不限,岗位职责：1. 跟进学生的学习进展情况并沟通反馈，为在读学员提供高水平的服务；2. 兼顾学生与教师的上课时间，确保课程如期进行；3. 与教师、学生双向及时沟通，与学生、家长建立长期、稳定、良好的关系。任职要求：1. 本科及以上学历，日语N2或J.TEST C级以上水平，水平高者优先；2. 善于沟通，亲和力强，协调说服力强；3. 热爱教育行业，有良好的客户服务意识，责任心强。关于公司：创试科技秉承对伙伴惺惺相惜、对事业将心注入、对用户创造价值的企业价值观，于2016年2月正式公司化运营。旗下拥有致力于职业能力评价的面试吧和致力于职业能力提升的知诸学院两大品牌。公司位于上海市中心黄浦区的黄金地段，周围有轨道交通4、8、13号线，交通方便，生活便利。关于团队：公司员工全部为80、90后，团队成员年轻化、管理扁平化，注重每一个员工的发展，为每一位创业伙伴提供开放的成长空间。2018年，公司的人员和规模都需随着业务发展急速扩张，期待你能加入这个年轻有激情的团队，和我们共同成长！,用户运营/日语班主任,https://jobs.zhaopin.com/379993730250041.htm,招1人,4K-6K
北外滩,上海,上海梯度信息技术有限公司,CZ684251720,民营,2019-08-09 09:07:55,本科,5-10年,职位描述：1、负责公司备份功能的后端开发设计；2、根据开发设计，负责模块的详细设计、开发等工作；3、负责备份业务功能开发。岗位要求：1、本科及以上学历；2、至少具备5年以上 C/C++实际开发经验，C/C++基础扎实；3、熟练的使用linux操作系统，具有在linux操作系统下开发的经验；4、善于独立解决问题，对技术有浓厚兴趣。5、要有银行工作经验，本岗位为外派性质请慎重考虑。,C#/C++开发工程师,https://jobs.zhaopin.com/CC684251729J00411745505.htm,招3人,8K-15K
九亭,上海,时慕国际贸易(上海)有限公司,CZ228232280,外商独资,2019-08-09 09:08:26,本科,1-3年,工作职责：1、根据公司确定的品牌风格、定位及市场需求，按要求提出产品设计创意并完成设计任务；2、配合设计总监做好每个季度的婚纱、头纱设计开发计划并实施；3、在每个设计周期前提供主题方案建议，并汇报设计总监；4、参与面辅料选购工作，掌握面料流行趋势提出合理使用建议；5、收集产品及销售相关资讯，为产品设计积累素材；6、跟进产品出版、样衣制作，确保样衣符合设计要求；7、有效控制产品开发成本；8、收集上一季产品设计反馈，为下一季设计提供参考信息； 任职资格：1、教育背景：服装设计及相关专业，本科及以上学历。有欧美国家留学经验者优先！2、工作经验：2－5年同职位或类似职位的工作经验，有高定品牌婚纱工作经验者优先。3、知识/技能：（1）设计思维敏捷、绘画功底深厚、表达能力清晰，对婚纱设计有较好的感觉；（2）熟悉服装设计、制作工艺流程，对婚纱面料、原材料、配饰有较丰富的认识；（3）对流行趋势和时尚元素有很强的洞察力和敏锐度，能熟练操作photoshop、coreLRAW、CAD等设计软件。4、素质要求：（1）性格开朗，具有良好的沟通协调能力；（2）具有丰富的想象力和开拓创新能力；（3）对工作认真负责，具有较强的进取精神及团队合作精神。,高定婚纱设计师,https://jobs.zhaopin.com/CZ228232280J00312356605.htm,招1人,8K-10K
,上海-虹口区,中国新兴上海进出口有限责任公司,CZ131371360,国企,2019-08-09 09:05:45,本科,1年以下,职位要求：工作内容：1.通过阿里巴巴、环球等平台拍照上线产品，并维护网站2.独立开拓客户，与客户进行日常联系、沟通、及时掌握客户需要，了解客户状态3.处理客户订单和供应商签订采购合同，与国外客户确认订单细节并及时传递给生产厂商4.联系工厂，负责跟进订单的生产进度、质量，收款与出货，完成跟单到发货全过程5.及时与工厂、客户沟通，协调处理订单突发事件，保证货期及产品品质6.业务相关资料整理和归档要求：1.文化程度:本科及以上，英语六级以上，计算机操作熟练，应届毕业生、往届毕业生优先。2.有事业心并热爱外贸工作，接受偶尔的出差、工作刻苦、勤奋、有责任心，具有良好的团队合作精神和业务拓展能力。3.上班时间：9:00-17:00，中午休息2小时。4.常年有各种福利，如生活用品补助、高温补贴、过节费、体检等等5.公司氛围好，同事乐于助人。6.交通便利，公司附近地铁3号线、8号线虹口足球场站,外贸业务员-外贸销售-销售专员,https://jobs.zhaopin.com/CC131371365J00305040101.htm,招8人,4K-6K
交通大学,上海,蕾洛（上海）商用厨房设备工程有限公司,CZ470990630,民营,2019-08-09 09:25:25,本科,不限,要求：1、本科及以上学历，专业不限营销、机械、机电专业优先考虑；2、经验不限，有厨房设备类销售经验优先考虑；3、勤奋踏实，努力上进，肯虚心学习；4、具有团队意识，善于沟通。待遇：1、项目有提成，具体面议；2、公司依法为员工缴纳社保；3、员工享有国家法定假日。,销售员业务员,https://jobs.zhaopin.com/CC470990630J00293730908.htm,招1人,4.5K-5K
淮海路,上海,信都国际租赁有限公司,CZ299239310,上市公司,2019-08-09 00:51:20,本科,1-3年,岗位描述：1、收入、费用等凭证录入；2、增值税及附加、增值税即征即退、所得税等纳税申报；3、固定资产、待摊费用或者其他财务台账的登记工作；4、简单账套的开票、做账、税务申报、工商年检、汇算清缴等；5、与代理记账公司的沟通及事项处理等；6、财务其他临时安排的工作；岗位要求：1、本科以上学历；2、两年以上财务工作经验，有融资租赁行业或者金融、类金融行业经验优先；3、熟悉业务简单的全盘财务处理和税务处理；3、熟悉财务软件的office软件；4、具备一定沟通能力，有较好的学习能力，做事积极主动，善于思考；,总账税务会计,https://jobs.zhaopin.com/299239314250774.htm,招1人,6K-7K
,上海-静安区,上海埃飞电子科技有限公司,CZ404664630,合资,2019-08-09 09:03:15,本科,不限,仪器设备销售 1.熟悉仪器和设备产品的应用和使用 2.通过各种方式寻找到潜在客户 3.拜访客户，并讲解仪器设备的应用和硬件功能 4.熟知订单操作流程，如报价，与不同客户的交流技巧，招标，订货，发货，收款。 5.每周需要发布反馈市场和客户情况给上司 6.需要适应国内出差，必要时候需要出国 7.懂得如何开发各地经销商 8.达到任务目标，完成规定业绩 岗位要求 1.必须有责任心，进取心，有韧劲，有经验优限2.为人开朗，乐观，真诚待人 3.英语有一定听说写能力（基础资料都为英语） 5.懂得如何开发客户，讲解仪器设备 6.与客户沟通，维护客户关系7.了解招标等系列流程 9.最好有仪器设备类销售经验 待遇 1.五险一金、旅游2.一年两次旅游，一次体检、培训3.工作满一年后享有年假 4.个人交通和午饭补贴5.底薪+提成+奖金+岗位津贴,仪器销售工程师/渠道销售专员（高薪）,https://jobs.zhaopin.com/404664635250003.htm,招5人,6K-12K
金桥,上海,无锡天昊华芯管理咨询有限公司,CZ738932980,合资,2019-08-09 09:16:36,本科,不限,岗位职责：1.负责相关软件开发设计工作； 2.负责软件系统架构分析、平台搭建、核心代码开发及重点技术难点预研； 3.负责配合开发测试搭建测试平台，协助开发设计、推行、实施和持续改进； 4.对产线现场的支持5.对客户产测软件集成的支持； 技能技巧精通c/c++，熟悉数据结构和算法，有很强的编码能力；熟悉Windows系统应用软件开发； 熟悉多线程、Socket网络通信编程技术，熟悉移动终端特性和开发特点； 熟悉USB、SPI、UAR等通信协议，并有相关开发经验。素质要求勤奋好学，敬业实干，有独立工作能力，能承受一定压力，愿意参与创业型企业； 经验年限3年工作经验；有大型手机工厂对接经验优先；,产测软件工程师,https://jobs.zhaopin.com/CZ738932980J00377471703.htm,招1人,10K-20K
,上海,柯维自动化设备(上海)有限公司,CZ210426610,外商独资,2019-08-09 09:24:23,本科,3-5年,工作职责：1.安排顾客终验收会议、产品的评审和讨论。2.在项目进行中解决任何的因为缺少信息或不同观点而出现的矛盾。3.精确的解释需要，以确保特定的项目按计划完成。4.创建和执行项目的重要事项和时间表。5.为项目小组准备每周的项目进展报告。6.创建和保存项目档案，将所有所需的文件存在项目管理文件夹。7.指导不同的柯维员工去确保项目执行、交货和财务目标。8.协调并按需求的改变而更改项目运行。9.解决一切项目呈现出的有关问题。10.提供所有的项目验收测试，顾客终验收的文件工作。11.确保所有交付给顾客的资料达到顾客满意。12.收集和整理项目关闭的资料。13.协调、计划所有做的工作确认或证明都是必须的。14.确保其他或接下来的项目的地点、公司指导方针、程序和技术。15.与供应商和顾客沟通去解决问题。16.项目成本，风险，时间，质量的管控和平衡。17.提供部门员工的评估给领导。18.必要时监督项目工程师和项目团队成员。  任职要求：1、在不同和工业企业，有6年作项目经理或流程管理经验；2、熟悉计算机操作、熟练使用office办公软件；3、在英语和汉语方面，有书面和口头上有较好的交流能力；4、在新项目上有与客户和供应商交涉能力；5、逻辑性强，有书写清楚、简明的流程和报告的能力；6、工作仔细认真，有很强的抗压能力，能适应出差；7、有很强的应变能力，预见风险的能力，对于突发事件具备良好的判断能力和解决能力；8、作为一个团队成员在团队中有领导能力，工作认真负责、踏实敬业，具备良好的组织能力与团队合作精神； 9、有商业或管理知识，从而可以参与战略计划、资源分配、领导力、设备设计及制造、谈判及有效的表现力。,量产项目工程师,https://jobs.zhaopin.com/CC210426617J00302493506.htm,招1人,10K-15K
南翔,上海,上海胜者教育科技有限公司,CZ658402230,民营,2019-08-09 09:08:22,本科,1-3年,你也许想找一个老板：他懂你的天马行空，更能助你妙笔生花；你也许想找一堆同事：他们赞赏你的才华，更愿与你一辨高下；你也许想找一个公司：像家一样温暖，却不止给你庇护，更给你无限成长的空间； 在胜者教育，这些全都不是梦！我们急需文案小伙伴入伙，充当司宠！ 除上述之外，我们还提供有竞争力的薪资！五险一金是必须的，更有超多世界各地考察的机会！这里有一群热爱教育的小伙伴！更有无比轻松氛围！不仅如此，你还能获得与超多行业大牛交流学习的机会！ 我们希望你：热爱写作，喜欢在文字世界里畅游；头脑灵活、执行力强、靠谱；有趣有料，最好还有点对教育和公益事业的小情怀 谁说做文案要改稿一千次？这一页只铺开画卷，等你落下题跋！,文案编辑（11号线南翔站）,https://jobs.zhaopin.com/CC658402231J00131757108.htm,招1人,8K-12K
,上海,青岛知行国际经济技术合作有限公司,CZ543924420,民营,2019-08-09 09:10:32,本科,不限,"       日本东京高端奢侈品店销售员（日语翻译）正社员 长期招聘要求：1、30岁以下，男女不限。相貌端庄，口齿清楚。2、本科。日语二级水平以上。3、有日本留学经历及销售经验的优先录取。工作内容：1、工种：翻译，导购2、工作地点：日本关东、东海、东北地区等14家店铺。 3、签证类型：工作签证   电话：一八五六二七五九三一八4、工作内容：高端品牌箱包、手表、珠宝等销售、翻译工作等。5、销售品牌：HERMES,CHANEL,GUCCI,BVLGARI, Cartier,PRADA,COACH,dunhill,LOUIS VUITTON,ROLEX,OMEGA等。待遇：1、正社员。2、月基本工资215000日元。3、每天工作8小时。每周休两天。（轮休）4、超过固定工作时间以外的出勤为加班，加班费每小时1575日元。5、住房补贴：有，每月15000日元。服从会社安排转勤的情况下，搬家费由会社承担，另外会社负担80%房租。6、通勤费：会社承担。7、加薪制度：有，根据个人能力及业绩，半年或一年后加薪。8、奖励制度：有，奖励金额根据业绩。面试报名： 1、身份证、毕业证、户口本原件、2寸白底正装照片（电子版）；2、体检表。检查项目：乙肝五项、胸透、心电图、血型、血常规、尿常规、血脂。",日语翻译免税店奢侈品正社员,https://jobs.zhaopin.com/CC543924421J00360330903.htm,招10人,10K-15K
