address,city,company,company_id,company_type,date,education,experience,job_description,job_name,job_url,people_num,salary
长征,上海,轶药享药品零售(上海)有限公司,CZ846330850,民营,2019/6/30 19:59,本科,10年以上,任职资格：1. 专科以上，医学、药学专业，10年以上采购或销售经理任职经验。2. 了解医学基础知识，了解药品管理相关法规，熟悉合同法，熟悉采购业务流程，计划制订与监控能力，沟通协调、激励及绩效评估能力职位职责：1. 根据市场需求变化，修订新供方、新品种、新业务推入与发展原则，保证公司才哦股策略的实施。2. 监督折让正常的执行，保障公司应得利益。3. 组织制定商品分类标准、商品合理库存标准，进行库存分析，保证库存管理科学高效。4. 参与洽谈、签订商品合作协议，保证合作的延续性，维护公司利益。5. 制定采购成本策略，监控商品购进价格及采购费用，保证经营利润最大化。6. 参与协助招标相关事宜，协助完成公司预定招标指标。7. 随时建立、完善、改进工作流程，并完成上级交办的其他工作。,药品采购部经理,https://jobs.zhaopin.com/CZ846330850J00283759706.htm,招2人,15K-20K
梅园,上海,大连千海金资产管理有限公司,CZ677644920,民营,2019/6/30 16:50,本科,1-3年,职责描述1. 熟悉市场上热销的海外保险产品，并对其进行分析、比较，突出公司现有保险产品的优势；、2. 具有较强的观察分析能力、产品研究能力，有良好的沟通、演讲及管理技巧；3. 开拓新市场，发展新客户，增加销售范围；4. 全面开展海外保险销售业务；5. 通过各类渠道促成成单；任职要求：1.形象气质佳，思维严谨，有进取心，责任感和团队合作精神，具有较强的沟通、协调能力和组织策划能力；2.本科以上学历，保险、经济、金融、管理类专业优先，条件优秀者可放宽学历要求3.有良好的语言表达和、文字、组织能力；4.强烈的团队意识、客户服务意识；5.掌握电脑等、办公自动化、工具、使用技能；,资深理财规划师,https://jobs.zhaopin.com/CC677644927J00294718505.htm,招2人,8K-12K
金沙江路,上海-浦东新区,兖矿海外能源发展有限公司,CZ282003030,国企,2019/6/30 19:59,本科,1-3年,工作内容：1.负责银行收付结算、对账、现金/有价证券/信用证/票据业务管理；2.负责日常报销、费用支付；3.财务凭证、档案的打印整理装订；4、财务相关数据统计分析上报工作；5.上级领导交办的其他工作；岗位要求：1.全日制本科学历，会计学、财务管理等相关专业，CET4 及以上；2、1～3年相关岗位工作经验，优秀应届毕业生也可；3、熟练使用办公软件，具会计从业资格证；4、具备较好沟通能力，良好的职业操守，工作认真负责、细致严谨；,财务助理出纳,https://jobs.zhaopin.com/CZ282003030J00268055108.htm,招1人,6K-8K
洋泾,上海,上海浦东禾苗托育有限公司,CZ823696070,民营,2019/6/30 19:24,本科,1-3年,岗位职责：1、协助完成新媒体平台日常内容的整理、编辑、审核、发布。工作细心，认真负责，能够确保内容输出的准确性和时效性；2、协助新媒体运营负责人，完成新媒体运营的当前目标，协助策划和执行各类互动平台（如微信、微博、抖音等）运营策略。3、对新媒体内容、活跃度以及推广活动进行跟踪反馈，并不断优化内容和活动。定期策划线上活动，提升品牌曝光度和用户关注度；4、对各类新媒体平台进行深入研究，从而为产品宣传、目标用户引导找到新的突破口；5、对社群运营具备一定的热情，根据活动推广的时间节点，及时建立社群，跟进活动进度，并完成社群后续的维护工作；6、完成部门交予的其他任务。任职要求：1、大专学历以上，专业不限，有1年以上工作经验；2、能熟练使用电脑及各种办公软件，会简单使用秀米、创客贴等在线工具，具备基础文字编辑能力；3、工作积极主动，头脑灵活，思维有灵性；4、具备互联网思维，熟悉互联网文化，熟知微信等产品者优先，具备公众号运营经验者，从事过教育行业者优先。,新媒体运营,https://jobs.zhaopin.com/CZ823696070J00255635808.htm,招1人,5K-8K
徐泾,上海,上海犀点建设科技有限公司,CZ457195880,民营,2019/6/30 19:14,本科,3-5年,职位描述：1. 负责运营部门整体工作运作与管理；2. 充分理解客户产品业务需求，针对工作任务进行分解，合理安排部门工作并保证高效完成。3. 负责营销策划方案的制定、包括品牌建立与推广、全年市场计划、市场活动创意策划等；4. 负责网络推广和媒体渠道搭建，提高品牌影响力，包括公司内部公众号日常维护和运营，实时更新和数据备份；5. 具备良好的提案能力，能够同客户在策略方面进行较好的沟通；6. 管理督导各项目的运营管理工作，并进行监督、考核，提升商业整体运营管理。 任职要求：1.   本科及以上学历，市场营销相关背景行业5年以上经验，拥有建筑、装配式建筑经验者优先2.   具有敏锐的市场意识、良好的市场思维和创新意识，熟悉市场各类策划技巧3.   具备良好的逻辑思维能力及创意发散思维4.   具备活跃的策划创新能力，、商务谈判能力；5.   具备较强的团队意识及组织领导能力，严谨、踏实、敬业。6.   熟练运用PPT、Excel、Word等办公软件,市场经理,https://jobs.zhaopin.com/CZ457195880J00364739905.htm,招1人,13K-17K
顾村,上海-长宁区,上海丽兹行房地产经纪有限公司SH-Y9,CZ418846210D00113142861,民营,2019/6/30 18:11,本科,不限,你是想要一份工作还是想拥有一份满腔热血全情投入的事业？你是想要平淡安稳度日还是想要在百舸争流中夺得一席之地？如果你想通过自己的努力和才华，给自己给家人一个理想的生活，丽兹行和你一起实现梦想！我们不会编织梦想，因为我们就是梦想！ 【我们的薪资及福利待遇是】1.无责底薪6000~7000元/月，无业绩要求的哦~2.提成：提点5%-68%，根据个人业绩核算（豪宅顾问年薪收入约30万，销冠年收入破百万）3.福利待遇：六险一金+免费体检+10天带薪年假+国内外旅游+各种奖励 【我们的要求是】1.统招本科及以上公办院校毕业生，具有良好的学习能力和领悟能力；2.具有良好的亲和力、理解能力、逻辑协调和沟通能力；3.积极乐观开朗，为人诚实守信，工作积极主动，注重团队合作； 【岗位的职责是】1.新员工入职，熟悉了解所在的高端豪宅项目；2.学习业务相关知识，掌握豪宅交易流程，并且能够解决流程中出现的问题；3.与客户沟通，详细了解客户的需求，了解公司产品，高效匹配；4.与客户进行商务磋商、谈判，促成豪宅成交；5.为客户提供豪宅市场分析报告、价值对比分析报告等； 【你的顾虑】1.底薪为什么那么高，是无责任底薪吗？丽兹行用人要求很高，优秀的人才应当匹配相应的薪资；其次丽兹行从员工角度出发，高薪可以保障大家在上海的基本生活，有更多的精力投入到工作当中。底薪是无责任底薪，与业绩不挂钩，当然我们也是没有业绩指标的，每个月固定发放底薪。 2.没接触过这个行业，怕做不好？公司新进员工，大多数都没有接触过房产行业。因为这个岗位是公司的核心岗位，我们实行的是一对一师徒辅导制，师父会是你未来在丽兹行工作的引路人。有任何工作或者生活上的问题都可以找师父解决。而且公司针对岗位会有系统全面的培训，其中针对豪宅顾问的业务技能培训占比60%，针对管理技能的培训是占比40%。每一位候选人都可以通过公司的培训得到专业的提升。所以公司会对学历和学习能力有要求，没有经验要求。 3.客户资源哪里来？公司会给员工提供优质精准的客户资源，所以完全不用担心！,底薪6000起 销售代表/销售经理/客户经理,https://jobs.zhaopin.com/CC418846213J00091162413.htm,招20人,6K-10K
江桥,上海-嘉定区,仪菲(上海)品牌管理有限公司,CZ394268310,民营,2019/6/30 17:56,本科,5-10年,岗位职责描述：1、全盘账务处理；2、业务报表制作、分析报表制作；3、应收、应付业务处理；4、配合预算控制相关成本及费用；5、领导交办其他事项；资质要求：1.大专及以上学历，财务、经济等相关专业，五年以上工作经验；2.有电商工作经验优先；3. 良好的沟通能力，思路清晰，工作主动认真、责任感强，热爱挑战和创新，具有抗压能力和吃苦耐劳意识。,总账会计,https://jobs.zhaopin.com/CC394268316J00095296208.htm,招3人,8K-15K
陆家嘴,上海,上海常导教育培训有限公司,CZ285371930,民营,2019/6/30 0:50,本科,不限,职位描述：（1）辅助外教英语课程的教学工作；（2）能配合外教完成课程的准备和课堂管理及翻译；（3）对学生进行课后辅导和答疑；（4）能主动与家长沟通，交流孩子英语学习情况并做好记录；（5）能够配合完成学校交办的其它工作。 任职要求：1. 国内外本科或以上学历，优秀的英语听说读写能力，英文水平在CET6/TEM4以上；2. 有教育培训类工作经验者优先考虑；3. 有亲和力及较强的沟通能力，思维灵活，性格开朗；4. 工作积极主动，有责任心及良好的团队合作精神；5. 熟练使用办公软件。 福利待遇：1. 面议(依能力及经验而定)，欢迎有授课经验的老师可以单独进行小班授课，带课老师根据代课情况有额外奖金提成，一般加底薪可达到9000左右。2. 按照国家规定缴纳社保(工作表现优异者，福利另议)； 工作时间：每周工作五天(可适应工作日晚及周末上班)，标准工时。 工作地点：上海市浦东南路1036号隆宇大厦12楼(八佰伴对面) ；轨道交通9号线商城路站，或2号线东昌路站 学校电话：********;（工作时间：周三——周五 13:30-21:00； 周六、日 9:00-17:30）【简历请务必附照片】简历也可投递至********************或*********************,英语助教,https://jobs.zhaopin.com/CC285371938J00198778802.htm,招3人,4.5K-8.5K
人民广场,上海,丽勒高(上海)人才服务有限公司,CZ896370330,合资,2019/6/30 18:46,本科,3-5年,（日系知名企业）工作职责：1.了解产品及其技术，编写销售工具如：产品方案、推荐书、软硬件配置方案等；2.关注了解医疗软件行业的竞商产品，分析并优化销售工具；3.对售前支持团队开展产品及技术培训；4.指导和解决售前支持过程中的各种技术问题。职位要求：1.大学本科及以上，临床医学、医疗设备、医学工程相关专业；2.3年以上相关行业工作经验；3.良好的英语书面表达和口语能力，熟练操作office办公软件；4.拥有自我学习意识和创新能力，具有团队合作精神，一定的抗压力和沟通能力。----------------------------------------------------------------,【日语岗位】医疗网络产品售前主管 ID:6449,https://jobs.zhaopin.com/CZ896370330J00165341002.htm,招1人,14K-25K
,上海-宝山区,上海丽兹行房地产经纪有限公司SH-Y9,CZ418846210D00113142861,民营,2019/6/30 18:11,本科,3-5年,【薪资待遇】无责任底薪6000元/月+高额提成（5% - 68%）+带薪年假 【岗位要求】1.21-35周岁，本科及以上学历或国外五百强院校毕业（有国内认证）；2.不限专业，不限经验，愿意学习新知识；3.工作积极主动，注重团队合作；4.愿意参加公益活动，具有爱心和感恩之心。 【岗位职责】1.伙伴加入公司，熟悉了解产品信息（一二手高端公寓别墅，国内主北京上海，国外英国、美国、加拿大、澳大利亚）；2.详细了解客户的核心诉求，精准匹配合适的豪宅项目；3.与客户面对面商务洽谈，进行Ipad作业展示、720度环景看房，通过丽兹行豪宅APP、微信小程序、楼盘字典等营销工具进行前期介绍；4.通过市场数据分析，进行商务谈判，促成项目成交。 【晋升路径】公司所有团队长都是内部公平竟聘产生，从无空降兵。★营销精英A0-A8级：豪宅顾问、资深豪宅顾问、高级客户经理、资深客户经理★管理岗位晋升（入职半年后可公开竞聘）：店经理（年薪40万起）→店面总监→大区总监 【系统培训】★师徒制：一对一的师徒辅导，有自己专属的师父★线上平台：丽兹V学院，分类大讲堂★针对豪宅顾问——房地产基本知识，金融学，心理学，客户的经营管理，法律，税法等★针对精英及管理岗位——百万尖子班、LEC精英俱乐部、黄埔培训班、虎将训练营、北京大学光华管理学院MBA 【福利体系】1、六险一金：商业险+五险一金2、各种嘉奖：新人奖、价值范、品质奖....3、各种旅游：司龄游、父母游、丰富团建,国内外旅游  大客户经理/豪宅销售/区域销售,https://jobs.zhaopin.com/CC418846213J00054463013.htm,招20人,15K-30K
浦江,上海,上海申排成套装备产业有限公司,CZ465593080,民营,2019/6/30 0:50,本科,3-5年,【公司排水中心-项目经理】岗位职责依据上海市政工程设计总院集团设计的产品，提供产品与服务；拓展上海市政工程设计总院集团服务内容与渠道；完成领导交办的其他工作。任职要求建筑、排水、环保、化工和机械类大学本科及以上学历；有3年以上相关工作经历；熟练使用办公软件；责任心强、为人诚信、没有违法犯罪前科；能够接受经常出差，工作时间较弹性；尽快到岗。,排水中心项目经理,https://jobs.zhaopin.com/CC465593086J00341064105.htm,招3人,20K-30K
肇嘉浜路,上海,上海华予信企业信用征信有限公司,CZ000572260,民营,2019/6/30 18:44,本科,1-3年,帮助律师寻找案源，具体方向：1、知识产权客户；2、抵押担保客户；3、应收账款催收客户；4、法律顾问及其他。,律所案源开发（底薪5000+提成）,https://jobs.zhaopin.com/CC000572267J00142746203.htm,招3人,15K-20K
北蔡,上海-浦东新区,新钶电子(上海)有限公司,CZ000464910,外商独资,2019/6/30 20:06,本科,1-3年,工作职责：1.对于项目执行2.组织和跟踪技术设计、开发进度3.制定总体的项目计划并跟踪4.协调项目执行过程中的所有问题 5.与客户接口交流，组织并参加各种接口会议  工作要求：1.电子通讯、自动化或同等专业，1年以上工作经验2.有系统调试经验及现场服务人员优先考虑3.熟悉Word/Excell/Powerpoint/Visio/CAD以及其他的项目工具 4.有良好的沟通能力,项目工程师,https://jobs.zhaopin.com/000464915250117.htm,招2人,6K-8K
九亭,上海,上海凡亚园林景观设计有限公司,CZ231757720,民营,2019/6/30 0:50,本科,5-10年,园林景观专业毕业有专业的制图能力，审图能力，团队管理能力及培养能力有极强的沟通力和说服力大景观工作并且担任过项目组长的优先考虑有酒店景观设计经验和样板展示区经验的优先考虑有创业梦想的优先,景观设计师,https://jobs.zhaopin.com/CC231757726J00210261505.htm,招1人,20K-30K
张江,上海,上海见智信息技术有限公司,CZ284704780,民营,2019/6/30 14:13,本科,3-5年,职位要求：1.本科及以上学历，计算机相关专业优先，3年以上前端开发经验。2.精通javascript/html5/css3/PHP等相关开发技术。3.熟悉页面结构，有良好的程序设计和架构能力，具备与UI设计、美工及产品良好的沟通能力。4.熟悉并在项目中实际应用过EasyUi（必须项）。5.熟悉Vue/react等相关框架和技术，其中vue有开发经验优先。6.对前端工程化与模块化熟悉，并有实践经验（例如：grunt/webpack等）。7.有独立完成复杂前端模块的设计与实验经验、优化代码并保持良好的写作习惯。,Java前端开发工程师：,https://jobs.zhaopin.com/CZ284704780J00307944407.htm,招1人,10K-20K
人民广场,上海-浦东新区,温岭市上海从业商会,CZ657186830,社会团体,2019/6/30 19:49,本科,3-5年,岗位描述：（薪资面议）1. 负责商会重要文字（工作计划、总结、领导讲话、会议纪要、新闻报道等）撰写。2. 负责商会刊物、宣传片、活动手册等宣传产品的制作执行。3. 负责商会各项会议、活动的策划组织与实施。4. 负责商会官方网站、微博、微信、短信平台的维护与管理工作。5. 负责协助维护、运作商会的媒体关系，做好商会日常宣传。6. 负责秘书处对外联络、接待、宣传和拓展等工作。7. 配合市政府驻沪办、人才联络处做好温岭在沪各团队相关服务工作。8. 会长及秘书长交办的其他工作。任职要求：1. 全日制中文、新闻、传媒、公共关系及相关专业，大学本科学历。2. 形象好，气质佳，富有亲和力，具备较强的责任心和敬业精神。3. 熟练运用OFFICE等办公软件，文字撰写能力好，能独立撰写各类商会文案，并掌握一定的摄影技术。4. 三年以上相关工作经验，具有媒体、商协会、事业单位等相关岗位经验优先录用。5. 具有较强的活动策划、组织能力，有组织策划大型活动经验者优先。工作地址：（暂）上海市浦东新区张杨路2798弄4号楼，地铁6号线德平路站1号口出，步行3分钟试用期2个月,商会外宣部长,https://jobs.zhaopin.com/CZ657186830J00226770404.htm,招2人,6K-8K
,上海-嘉定区,上海链家房地产经纪有限公司,CZ307313210,民营,2019/6/30 19:58,本科,不限,应聘HR推荐：1、拨打【总部招聘部】曹庭芳 电话 15618352236（欢迎来电咨询）2、编辑短信“姓名+年龄+学历”预约面试3、快捷高效简历投递：caotingfang001@lianjia.com及添加微信：CC7782010工作职责：1、负责Online渠道链家网的房产信息维护推广，房产经济时代，打造个人的专业品牌2、负责客户的接待、咨询，了解客户的需求，Offline为客户提供优质的看房体验3、促成买卖双方交易的达成，负责商务谈判、协助双方合同的签署、办理权属转移等工作任职资格:1、统招本科学历，专业不限；2、认为自己有不错的亲和力、沟通能力和逻辑思维能力，有演讲、辩论、主持、播音等经验者优先；3、渴望高收入、渴望和一群优秀的同事一起工作，让自己也变得同样优秀；4、不安于现状、敢于挑战。近几年来，中国的互联网领域慢慢进入资本寒冬，伴随而来的是大量创业公司在发展的过程中面临越来越艰难的局面，难以维持生计的创业公司更是不计其数，尤其是O2O、P2P、共享单车、共享充电宝、直播等领域。2018年以来，无数的公司减员、缩招，甚至连阿里巴巴、腾讯、华为、百度这种级别的巨头，也会时不时被媒体报道缩招、停招，但互联网领域内仍然有极少一部分创业公司在逆势增长，并且在自己所在的领域不断的创造着新的奇迹。上海链家就是这些奇迹中的一个，加入你讲获得：★ 努力付出就可轻松过万的月薪；★ 远超想象的成长速度、晋升机会；★ 为培养成熟的职业经理人打造的职业环境；★ 互联网和房地产，两个最高薪行业的最前沿知识；★ 简单的工作氛围，完善的培训机制，健全的福利体系！,链家销售管培生/8K起,https://jobs.zhaopin.com/CC307313213J00269218502.htm,招5人,8K-10K
周浦镇,上海,上海基泰生物科技有限公司,CZ304562310,外商独资,2019/6/30 19:46,本科,1-3年,职位描述： - 开发和维护液相色谱仪，液质联用仪等产品相关市场及客户群。 - 与应用工程师及产品专家配合，为客户提供技术解决方案。 - 执行公司的销售/促销计划并完成各项销售指标。 - 遵守公司的信用制度，与客户协调货款回收。任职资格：- 大专以上学历，分析化学，生物制药等相关专业。- 1-3年以上工业品销售经验，有液相，液质联用仪，气质联用仪销售或市场营销经验者佳。- 积极进取，良好的沟通协调能力，能够承受工作压力。- 愿意出差。,液相色谱，质谱销售经理,https://jobs.zhaopin.com/304562317250528.htm,招2人,10K-15K
江桥,上海-嘉定区,仪菲(上海)品牌管理有限公司,CZ394268310,民营,2019/6/30 17:56,本科,5-10年,所属部门：人力行政中心直接上级：人力资源总监直接下属：二个招聘小组岗位职责：一、招聘1、根据公司战略规划做年度招聘计划及预算；2、开拓、维护、分析各大招聘渠道，建立企业人才库；3、不断完善、优化招聘流程，提升候选人筛选和识别方法；4、管培生项目的开展执行。二、团队管理1、招聘团队的目标建立；2、团队员工的工作安排及培训；3、团队员工的绩效考核。任职要求：1、【此条为必要条件】五年以上电商/快消行业/互联网招聘背景，三年以上管理经验；2、29-35岁，本科以上学历；3、有校招项目经验；4、良好的沟通表达及协调能力，敏锐的洞察力，较好的亲和力；5、会管理、能独干，责任心强，学习力佳，能自我驱动。发展方向：招聘总监,招聘经理,https://jobs.zhaopin.com/394268316250197.htm,招1人,15K-20K
吴泾,上海-闵行区,上海非夕机器人科技有限公司,CZ556366230,股份制企业,2019/6/30 16:56,本科,3-5年,"职位描述：1、 负责机器人底层实时控制系统的设计与开发；2、  与软/硬件工程师协同工作，实现并调试机器手臂的EtherCAT驱动接口；3、  了解并实现机器手臂对外的工业通讯协议接口；4、  与系统工程师，机械设计工程师协同合作，优化机器手臂的整体软/硬件设计；5、  编写清晰、简洁的文档，以确保团队之间交流通畅；6、  开发自动化测试验证的相关软件，以便快速开展相关工作。 任职要求：1、 具备解决系统问题的创造性思维；2、  熟悉QNX 与Linux (RT Preempt) 实时系统的开发，包括BSP开发、多线程编程、多任务编程，熟悉实时系统的软件架构；3、  熟悉工业通信协议EtherCAT, PROFINET, EtherNet/IP, Modbus TCP等，熟悉通信协议相关通用标准；4、  了解机电系统的模块和部件组成，对底层硬件有一定的了解；5、  电子工程相关专业本科或硕士学历，或相关电子行业三年以上工作经验。",嵌入式软件工程师,https://jobs.zhaopin.com/CC556366230J00255139404.htm,招1人,15K-25K
张江,上海-浦东新区,北京广源达科技发展有限公司,CZ239797910,民营,2019/6/30 19:50,本科,不限,"1.     职位描述：  销售经理助理2.     学历和技能要求：  市场营销或生物医学工程、动物医学、生物学、药学、毒理学相关专业毕业，有本科或以上学历，通过国家4级英语水平考试，有一定的听说读写能力；有独立的学习工作能力、良好的表达能力和高度的责任心、服务意识；有较强的计算机操作应用能力。有动物实验研究经验者优先。3.     工作范围： 动物实验仪器设备销售 。4.     工作地点：北京或上海，需要能经常出差到全国各地。5.      工作待遇:  底薪 5000元 , 根据学历、工作经验、技能等可面议，有销售提成和年终效益奖。 入职后有技术培训，有社保和住房公积金； 双休假和带薪年假",销售经理助理 上海,https://jobs.zhaopin.com/CC239797911J00152718012.htm,招2人,5K-10K
陆家嘴,上海,上海中纺联纺织服装有限公司,CZ236323510,股份制企业,2019/6/30 16:44,本科,1-3年,招聘岗位：一、面料业务专员（负责开展外销贸易工作）招聘要求：1、 人数：1-2名，男女不限2、 本科毕业，纺织工程类毕业为佳。 3、 有相关服装出口业务经验。有接单能力优先。4、 英语良好，收发MAIL熟练，电脑操作熟练。4、 踏实肯干，能吃苦，有团队协作精神。 公司缴交五险一金，福利待遇优厚！,业务员助理,https://jobs.zhaopin.com/236323513250029.htm,招1人,4K-6K
