address,city,company,company_id,company_type,date,education,experience,job_description,job_name,job_url,people_num,salary
,上海-徐汇区,邦缔实业(天津)有限公司,CZ578776880,民营,2019-07-25 00:50:28,本科,1-3年,Role Purpose 职位目标：Responsible for providing efficient & timely support to National Sales Director and sales team and provide supports / co-ordination with various function teams为全国销售总监提供有效及时的各项业务支持工作，并协调处理工厂、客户、销售团队等各个部门的联络工作主要工作职责负责及协助销售总监进行销售管理工作，包括部门工作信息更新及传递，配合制定部门内部各种相关流程、制度。配合销售总监做好日常业务报告的收集和整理，管理和整理代理商合同，协助销售人员进行销售订单的处理。协助管理部门日常费用预算和行政支出，安排部门会议，准备演示文稿，销售数据准备及汇总，安排会议纪要并检查跟进行动进度。接待外部客户，协调外部客户进行各项活动，为外部客户提供有效支持。为区域和总部相关人员提供有效沟通和支持。协助部门人员的日常差旅工作，安排行程及预约，为部门安排费用报销。协助销售部和工厂进行沟通和衔接，尤其是做好订单处理的沟通和协调。 上海销售总部的备用金管理：包括各类费用支出统计，所有发票的汇总黏贴报账。物业管理：与大楼物业良好沟通，保证各种物业款项的及时支付及报账采购执行：行政类采购、分发及管理，包括各种办公用品、办公设备等办公室管理：负责办公室环境和各项设备的管理，包括办公室清洁阿姨的管理                职位要求大学本科以上学历，年龄24-32容貌端正，性格稳重、仔细，易于沟通应聘人定位于上海稳定工作，有上海户籍者优先二年以上相关工作经验，有外资企业同类工作经验者优先能熟悉使用电脑及各种办公应用软件，能够熟练使用PPT报告英语四级以上，有一定的读写能力,销售总监助理,https://jobs.zhaopin.com/CZ578776880J00160924810.htm,招1人,6K-9K
,上海-青浦区,上海链家房地产经纪有限公司,CZ307313210,民营,2019-07-25 18:54:10,本科,不限,上海链家总部直招，不收任何招聘费用，为了避免公司收到重复简历，请您针对链家投递一份简历即可，有疑问联系总部HR李小姐13061893063 公司简介：链家房地产经纪有限公司（以下简称“链家”）成立于2001年，是一家集房产交易服务、资产管理服务为一体以数据驱动的全价值链房产服务平台，业务覆盖二手房交易、新房交易、租赁、装修服务等。链家目前已覆盖北京、上海、广州、深圳、天津、成都、青岛、重庆、大连等30个地区，全国门店数量约8000家，旗下经纪人超过13万名。为不断提高购房服务体验，链家积极布局线上平台。目前线上已覆盖PC端、链家APP、链家网手机版等终端，是具备集房源信息搜索、产品研发、大数据处理、服务标准建立为一体的综合型房产服务平台。平台为买卖双方用户提供全面真实的房产相关信息及咨询服务，并满足用户估价、约带看等个性化服务。旨在不断提高服务效率、提升服务体验，为用户提供更安全、更便捷、更舒心的综合房产服务。,社区运营,https://jobs.zhaopin.com/CC307313213J00281221702.htm,招4人,8K-10K
马陆,上海-嘉定区,上海未替奇企业管理有限公司,CZ510145130,民营,2019-07-25 14:30:47,本科,不限,工作职责：1、教授英语课程；制定授课计划和课前准备，在课堂上配合外籍教师授课；2、协助校方管理，对学生进行课前辅导与课后预习，督促学习进度和效果；3、收集学生的反馈信息并及时做出回复，协助处理学生投诉；4、配合学校组织的各种教学活动和市场活动。 任职要求：1、男女不限，英语专业本科以上学历，具有教师资格证者优先；2、1年以上教育行业工作经验，优秀的汉语和英语语言能力，发音清晰准确，熟练操作Office办公软件；3、具有责任心和团队意识，良好的沟通、组织和管理能力； 4、有爱心，积极，热情 ；5、热爱教学，热衷于投身教育事业。 加入我们，您将获得：* 舒适、整洁的工作环境，轻松、愉快的工作气氛* 广阔的职业提升空间，公平的晋升机制；* 完善的社会保险制度；* 人性化的福利：带薪年假、法定节假日等福利* 完善的入职培训+在职培训机制；* 员工子女入学享受折扣至学费全免的优惠……  爱贝国际少儿英语官网页面：www.abiechina.com；,英语老师/英语助教——上海嘉定大融城校区,https://jobs.zhaopin.com/CC510145135J00060721602.htm,招1人,6K-8K
顾村,上海-宝山区,上海埃飞电子科技有限公司,CZ404664630,合资,2019-07-25 22:02:36,本科,1-3年,"上海埃飞电子科技有限公司公司隶属于WAD（H.K）集团旗下子公司。专业代理和生产高端科研类仪器和设备，公司代理德国，英国，美国，瑞士，中国台湾各类尖端仪器设备，并在电子行业，物理研究，光电领域，新能源领域享有盛名。公司目标是做成全球知名的代理分销商，涉及不同行业领域。所以现在诚邀有志之士加盟我们团队，由于公司处于发展期，今后会在全国各重要城市建立分公司，只要你有能力就一定能在我们公司找到你的位子和价值.我们的客户：清华大学，北京大学，复旦大学，华中科技大学，哈尔滨工业大学，中山大学，中科院物理研究所，中科院蛋白质所，中科院过程所，中科院光电所，3M，拜耳，GE，HP，华为，ABB，KUKA，YASKAWA，秦山核电站，核能设计院等等，涉及行业：生物，机器人，核能，运动康复，流体，外太空，新能源各领域。Our company specializes in agency or production testing of the instruments and equipment, agenting from Germany, the United Kingdom, the United States, Switzerland, Taiwan all kinds of advanced equipment. In the electronics industry, physics research, the field of optoelectronics, the field of new energy is prestigious. Our goal is to do the world's leading agents and distributors, involving different industries. So we invite people with lofty ideals to join our team. With the development of the company, future will be to establish branches in important cities across the country, as long as you have the ability we will be able to find your place and value in our company.Our clients: Tsinghua University, Peking University, Fudan University, Huazhong University of Science and Technology, Wuhan Institute of physics, Institute of physics, Chinese Academy of Sciences, Chinese Academy of Sciences, CAS process Institute, Chinese Academy of Sciences, 3M, Bayer, GE, HP, HUAWEI, ABB, KUKA, YASKAWA, Qinshan nuclear power station, nuclear power plant Institute and so on, involving industries: biology, robotics, nuclear power, sports rehabilitation, fluid, outer space, new energy fields.  职位描述：1.熟悉仪器和设备产品的应用和使用2.通过各种方式寻找到潜在客户3.拜访客户，并讲解仪器设备的应用和硬件功能4.熟知订单操作流程，如报价，与不同客户的交流技巧，招标，订货，发货，收款。5.每周需要发布反馈市场和客户情况给上司6.需要适应国内出差，必要时候需要出国7.懂得如何开发各地经销商8.达到任务目标，完成规定业绩9.工资构成结构（稅后）：底薪＋补助（交通，电话，住宿）＋岗位津贴＋奖金＋提出＋各福利10.完成目标年薪：15－35万人民币11.工作地点：上海 岗位要求：1.必须有责任心，进取心，有韧劲，有事业心2.为人开朗，乐观，真诚待人3.英语有一定听说写能力（基础资料都为英语）4.有一年以上销售经验5.懂得如何开发客户，讲解仪器设备6.如何和客户沟通，维护客户关系，知道如何处理紧急突发事件，和为公司创造最大利益7.了解招标等系列流程8.本科以上文聘（理工科为佳）9.最好有仪器设备类销售经验10.能承受工作压力11.男女不限 福利待遇：1.标准五险一金2.一年2次公司旅游（国内外各一次）3.一年一次体检4.享有所以国定假日（工作时间：9：00~17：30）每周五下午运动放松日5.培训6.个人交通和午饭补贴 Job description1.familiar with the application and use of instruments and equipment products2.find potential customers through various ways3.visit customers and explain the application and hardware function of instruments and equipment.4.familiar with the order operation process, such as quotations, communication skills with different customers, bidding, ordering, shipping and collecting.5.need to release feedback to market and customer situation weekly and monthly6.need to adapt to domestic travel and go abroad when necessary.7. understand how to develop distributors everywhere8. achieve the goal of the task and complete the specified performance9. Wage structure (after tax): base salary + subsidy (transportation, telephone, lodging) + post allowance + bonus + welfare.10.Yearly Salary after achievement from 150K-350K RMB11. working place: Shanghai Post requirements1. must have sense of responsibility, initiative, tenacity, enterprising2. cheerful, optimistic, and sincere.3. English has certain listening and speaking abilities.4. have more than one year sales experience5. understand how to develop customers and explain instruments and equipment6. how to communicate with customers, maintain customer relationship, know how to deal with emergencies, and create maximum benefits for the company.7. understand the series of bidding processes8. bachelor degree (Engineering preferred)9. it is best to have equipment sales experience10. can bear work pressure Treatment1. normal social insurance benefits2. a year's 2 company travel3. a year for a physical examination4. enjoy a national holiday5. training6. people's traffic and lunch allowance",急招高薪销售 (会英语)待遇超好,https://jobs.zhaopin.com/CC404664635J00152532008.htm,招5人,6K-12K
张江,上海-浦东新区,汇纳科技股份有限公司,CZ131214280,上市公司,2019-07-25 19:39:16,本科,5-10年,岗位职责：1、建立和制定适合公司发展战略和人力资源发展战略的薪酬规划及福利计划；2、根据公司业务发展情况和市场水平，制定薪酬政策和薪酬调整实施办法；3、负责子公司的整体薪酬体系执行督核，为保障公司的经营战略实现服务；4、按照公司对绩效管理的要求，制定绩效考核及相关管理制度；5、完善、监督公司考核绩效管理体系，建立公司考核绩效工作的后续跟踪、评估、分析与优化工作；6、根据不同阶段绩效考核管理要求，调整绩效考核标准，监督控制各部门绩效考核过程；7、完成领导交办的其他工作。岗位要求：1、5年以上薪酬绩效工作经验，本科及以上学历；2、精通薪酬模型和薪酬体系建立方法，熟悉绩效管理工具；3、熟悉国家、地区及企业关于合同管理、薪金制度、用人机制、保险福利待遇、培训等人事方面的法律法规及政策；4、工作条理性、计划性、沟通能力强，工作认真负责并具有较强的执行力；5、为人正直、踏实、办事沉稳细致，具有高度的责任感与敬业精神。,薪酬绩效主管,https://jobs.zhaopin.com/CC131214289J00398316505.htm,招1人,10K-15K
,上海-青浦区,上海链家房地产经纪有限公司,CZ307313210,民营,2019-07-25 19:41:36,本科,不限,"链家集团2001年创立于北京，集地产经纪、互联网科技、地产金融、资产管理于一体的集团企业，具有全产业链服务能力的房产020平台。上海链家房地产经纪有限公司（前身德佑地产）创立于2002年，是链家集团旗下上海分公司。起步高端，面向上海市民及企事业单位提供不动产交易、房屋租赁、营销代理、资产管理和地产金融业务等服务。【您的工作】1.负责客户接待、咨询工作，为客户提供专业的房地产职业咨询服务； 2.了解客户需求，促成二手房买卖或租赁业务，并负责业务跟进和房屋过户手续办理等后续服务工作； 3.负责公司房源的开发与积累，并与客户建立良好的业务合作关系。 【我们能给你提供的】1、工作时间：弹性工作,让你摆脱长时间捆绑在办公楼里枯燥无味的上班族生活；每周休息一天。2、收入不封顶：试用期无责任底薪5000+3000绩效奖励，7月30日前入职首月还可以补贴1000，转正高提成（租赁统提50%，买卖20%-70%，一手统提30%）3、培训免费：公司提供专业系统的带薪培训（没经验？No Problem！）4、晋升���拼爹：不定期举行公开公正的晋升考核，有能力咱就升！5、福利想不到：带薪年假、社会保险、假日礼包、员工旅游、野外拓展等等！新人入职配置一台最新小米定制机！助你有效完成工作！【我们需要这样的你】1、全日制统招本科及以上学历，年龄18-36周岁，不包含自考学历；2、有无工作经验均可，优秀应届生优先考虑；3、学习力强，积极向上,文化价值观OPEN、正直、进取；4、喜欢与人交流，有亲和力，工作积极主动，乐观开朗；5、做事认真踏实，为人正直诚恳；高度工作意识，良好团队精神。面试地址：全上海可根据应聘者意愿就近分配链家官网：sh.lianjia.com",本科起招、链家房产、中介、销售、住宿,https://jobs.zhaopin.com/307313213284335.htm,招6人,6K-10K
顾村,上海-宝山区,上海埃飞电子科技有限公司,CZ404664630,合资,2019-07-25 21:03:30,本科,1-3年,"上海埃飞电子科技有限公司公司隶属于WAD（H.K）集团旗下子公司。专业代理和生产高端科研类仪器和设备，公司代理德国，英国，美国，瑞士，中国台湾各类尖端仪器设备，并在电子行业，物理研究，光电领域，新能源领域享有盛名。公司目标是做成全球知名的代理分销商，涉及不同行业领域。所以现在诚邀有志之士加盟我们团队，由于公司处于发展期，今后会在全国各重要城市建立分公司，只要你有能力就一定能在我们公司找到你的位子和价值.我们的客户：清华大学，北京大学，复旦大学，华中科技大学，哈尔滨工业大学，中山大学，中科院物理研究所，中科院蛋白质所，中科院过程所，中科院光电所，3M，拜耳，GE，HP，华为，ABB，KUKA，YASKAWA，秦山核电站，核能设计院等等，涉及行业：生物，机器人，核能，运动康复，流体，外太空，新能源各领域。Our company specializes in agency or production testing of the instruments and equipment, agenting from Germany, the United Kingdom, the United States, Switzerland, Taiwan all kinds of advanced equipment. In the electronics industry, physics research, the field of optoelectronics, the field of new energy is prestigious. Our goal is to do the world's leading agents and distributors, involving different industries. So we invite people with lofty ideals to join our team. With the development of the company, future will be to establish branches in important cities across the country, as long as you have the ability we will be able to find your place and value in our company.Our clients: Tsinghua University, Peking University, Fudan University, Huazhong University of Science and Technology, Wuhan Institute of physics, Institute of physics, Chinese Academy of Sciences, Chinese Academy of Sciences, CAS process Institute, Chinese Academy of Sciences, 3M, Bayer, GE, HP, HUAWEI, ABB, KUKA, YASKAWA, Qinshan nuclear power station, nuclear power plant Institute and so on, involving industries: biology, robotics, nuclear power, sports rehabilitation, fluid, outer space, new energy fields.职位描述1.熟悉相关生物仪器和设备产品的应用和使用2.通过各种方式寻找到潜在客户3.拜访客户，并讲解仪器设备的应用和硬件功能4.熟知订单操作流程，如报价，与不同客户的交流技巧，招标，订货，发货，收款。5.每周需要发布反馈市场和客户情况给上司6.需要适应国内出差，必要时候需要出国7.懂得如何开发各地经销商8.达到任务目标，完成规定业绩9.工资构成结构（稅后）：底薪＋补助（交通，电话，住宿）＋岗位津贴＋奖金＋提出＋各福利10.完成目标年薪：15－35万人民币11.工作地点：上海岗位要求1.必须有责任心，进取心，有韧劲，有事业心2.为人开朗，乐观，真诚待人3.英语有一定听说写能力（基础资料都为英语）4.有一年以上生物类销售经验5.懂得如何开发客户，讲解仪器设备6.如何和客户沟通，维护客户关系，知道如何处理紧急突发事件，和为公司创造最大利益7.了解招标等系列流程8.和生物相关的本科以上文聘（理工科为佳）9.最好有仪器设备类销售经验10.能承受工作压力11.男女不限待遇1.正常社会保险类福利2.一年2次公司旅游3.一年一次体检4.享有所以国定假日5.培训6.个人交通和午饭补贴Job description1.familiar with the application and use of instruments and equipment products2.find potential customers through various ways3.visit customers and explain the application and hardware function of instruments and equipment.4.familiar with the order operation process, such as quotations, communication skills with different customers, bidding, ordering, shipping and collecting.5.need to release feedback to market and customer situation weekly and monthly6.need to adapt to domestic travel and go abroad when necessary.7. understand how to develop distributors everywhere8. achieve the goal of the task and complete the specified performance9. Wage structure (after tax): base salary + subsidy (transportation, telephone, lodging) + post allowance + bonus + welfare.10.Yearly Salary after achievement from 150K-350K RMB11. working place: ShanghaiPost requirements1. must have sense of responsibility, initiative, tenacity, enterprising2. cheerful, optimistic, and sincere.3. English has certain listening and speaking abilities.4. have more than one year sales experience5. understand how to develop customers and explain instruments and equipment6. how to communicate with customers, maintain customer relationship, know how to deal with emergencies, and create maximum benefits for the company.7. understand the series of bidding processes8. bachelor degree (Engineering preferred)9. it is best to have equipment sales experience10. can bear work pressureTreatment1. normal social insurance benefits2. a year's 2 company travel3. a year for a physical examination4. enjoy a national holiday5. training6. people's traffic and lunch allowance",销售代表/客户经理/生物技术,https://jobs.zhaopin.com/CC404664635J00113521308.htm,招3人,8K-10K
田林,上海,北京大生知行科技有限公司上海分公司,CZ657990420,上市公司,2019-07-25 19:40:22,本科,无经验,    51talk于2016年6月10日在美国纽交所上市，成为目前国内唯一赴美上市的在线教育企业。         【岗位职责】    1. 以专业学习顾问的角色与已付费学员保持良好的、周期性的沟通，为学员提供学习的支持和帮助；    2. 课程周期内督促学员及时、准时学习相应课程，完成课耗率；    3. 了解学员英语水平情况及诉求，有效管理学员的学习进度和学习效果；    4. 适时提醒并推动学员续费，提高客户满意度和忠诚度，保持良性续费频率，从而达成个人任务指标。         【任职要求】    1.本科及以上学历（英语、商务英语专业优先）；    2.大学英语四级及以上英语水平；    3.求职目标明确（有教育行业或销售工作经验者优先）；    4.具备极强的上进心、责任心，抗压能力强；    5.具有积极主动的服务意识及良好的沟通学习能力；    6.熟悉最基本的office办公软件操作；    7.能够完成领导临时安排的工作任务。             【薪资福利】    1. 薪资架构：无责任底薪（4-8k）+提成+达标奖金+交通补贴（入职3-6个月，月薪可轻松破万）；    2. 岗位及薪资每三个月一调整，晋升体制：学习顾问→储备销售主管→销售主管→储备销售经理→销售经理→储备销售总监→销售总监；    3. 享受带薪专业培训，入职员工每月都获赠免费学习外教1对1英语课程；    4.  节假日活动及福利享受；    5. 七险一金（基本五险+综合商业保险）；    6.  入职初期前三个月可获得找房补贴；    7. 享受国家规定的带薪年假、法定节假日等福利。         如果你想挑战高薪    如果你想公平晋升    如果你想提升自我    如果你想加入一个不断稳步上升的平台    请选择51talk！ ,51talk诚邀班主任,https://jobs.zhaopin.com/CC657990420J00261926503.htm,招10人,10K-15K
虹桥,上海-徐汇区,上海逐元教育科技有限公司,CZ531225930,合资,2019-07-25 17:06:19,本科,1-3年,工作内容1.开拓新渠道，通过各种主动搜寻方式与知名企业、世界500强等，建立良好合作关系，为学生争取更多内推机会，同时也为企业输送校招全职精英和优秀实习生。2.挖掘Top500强级别等名企的实习招聘需求，开发对标行业的优秀导师，带教实习生项目。3.负责筛选带教老师，进行合作洽谈，制定规范流程，监督和协调to B和to C端的业务衔接。4.负责内部业务培训，分析和总结各行业招聘人才的标准框架，已达精准推荐目的。职位要求1.全日制本科以上学历。2.1-3年猎头经验优先，需要有金融、咨询行业资源。3.善于与雇主方打交道，有极强的责任心和感染力。4.有创业精神，能深入了解本行业，把握最新信息，对职业咨询/求职教育行业感兴趣。 ,企业拓展主管,https://jobs.zhaopin.com/CZ531225930J00052321902.htm,招1人,8K-10K
共和新路,上海,上海润蒙医药科技有限公司,CZ461025280,民营,2019-07-25 18:43:32,本科,3-5年,岗位职责：1.组织学术会议、业务代表培训、SOP编写及执行监督、项目申报；2.学习并掌握相关疾病知识、竞争产品和知识；深刻了解本公司产品的特点、定位、核心推广信息；3.分析本地区相关产品治疗领域的市场趋势以及其他领导交办事宜；职位要求：1.医学医药相关专业本科以上学历；2..医学、医药专业背景；3.3年以上相关职位工作经验；,医药学术专员,https://jobs.zhaopin.com/CC461025280J00386894001.htm,招1人,10K-15K
华漕,上海,阿吉安(福州)基因医学检验实验室有限公司,CZ825704300,民营,2019-07-25 18:15:05,本科,3-5年,岗位职责：1.    负责/参与体外诊断试剂盒的研发；2.    负责/参与体外诊断试剂盒申报资料的撰写；3.    负责/协助实验室分子检验人员相关实验技术和操作的培训和指导；4.    为其他部门或客户提供技术支持； 任职要求：1.    分子生物学、分子遗传学等相关专业本科以上学历（硕士优先），英语优良，计算机运用熟练；2.    3年以上体外诊断试剂盒研发经验（荧光定量PCR优先）；3.    熟悉体外诊断试剂盒申报流程；4.    具丰富的分子遗传学或分子生物学实验室工作经验，能独立完成实验项目；5.    具较强的上进心和责任心，谨慎仔细的工作态度，良好的独立工作及学习能力，良好的语言表达及人际沟通能力；,研发项目经理,https://jobs.zhaopin.com/CC825704300J00359385107.htm,招1人,6K-10K
颛桥,上海-闵行区,南德认证检测(中国)有限公司上海分公司,CZ000420620,外商独资,2019-07-25 21:44:04,本科,3-5年,职位概要:该职位负责带领团队进行食品接触材料的化学测试。工作职责:1. 带领团队成员及时有效地完成所分配的日常测试工作;2. 根据商业标准和作业指导书正确监控分析工作;3.研发测试新方法，完成方法验证;4. 新测试项目的不确定度计算;5. 监控测试设备和设施的良好性能;6. 对每项测试的过程/设备/环境/原材料进行监控并保持清晰/详细的记录，且测试数据易于跟踪;7. 监测并保持检测室整洁、良好;8. 完成上级交办的其他工作。工作要求:1. 本科以上学历，食品/药物/化学专业;2. 3年以上食品/药品/化学检测工作经验，尤其在食品接触材料分析领域，且熟悉液相色谱质谱分析操作;3. 熟悉食品接触材料化学检测的国际标准;4. 对相关工作目标、标准、政策、程序和指示有良好的理解和执行;5. 鼓励团队成员，不断提高工作效率;6. 勤奋，自我激励，自我完善，有较强的团队合作精神。,有机测试高级测试员（液相液质方向）-上海闵行-02957,https://jobs.zhaopin.com/CC000420624J00371163407.htm,招1人,薪资面议
