address,city,company,company_id,company_type,date,education,experience,job_description,job_name,job_url,people_num,salary
桃浦,上海,上海思博机械电气有限公司,CZ131560520,民营,2019/6/30 20:10,本科,不限,一，岗位要求：1、全日制本科以上学历（可应届毕业生），自动化、机械电气或国际贸易类相关专业；CET-4及以上，听说读写流利； 2、熟练使用Word、Excel、PPT等OFFICE类软件，熟悉各大电子商务平台如阿里巴巴国际站等的运营，有服务外贸行业经验优先； 3、性格乐观开朗，具有服务意识、团队精神、协调沟通能力和工作责任感，能承受一定的工作压力；4、不断学习进取，提高自身专业能力和综合能力； 5、无不良嗜好，身体健康。二，职位要求：1、运用网络推广平台及搜索引擎等资源开发海外市场，维护公司网络，统计网络平台后台数据并做好新产品的发布工作2、负责日常处理国外买家询盘和跟踪，熟练应用外贸英语函电，能与外商进行沟通和交流；3、负责所接定单各环节出现的问题，做好跟单的细节工作和及进出口业务流程管理；4、协助部门经理整理每周/月订单、报价报告及各类报表；收集整理相关市场发展趋势、需求变化和客户反馈数据等信息。5、相关信息的录入和CRM工作、ERP工作，季度、年度数据的统计；6、完成领导布置的各项工作；税前收入（十三薪）：70000/年起,业务助理/专员（外贸类）,https://jobs.zhaopin.com/CC131560524J00207556505.htm,招2人,6K-8K
徐泾,上海-青浦区,上海凯京信达科技集团有限公司,CZ506421780,民营,2019/6/30 16:52,本科,1-3年,岗位职责：①建立、完善、执行与供应商、客户的对账结算流程；②协助各营运部门把应收、应付费用及时录入系统；③在结算过程中，对每笔费用进行核查，分析费用结算有无异常，及时反馈；④配合核算和资金进行数据报表提供和对账⑤保证公司的应收、应付账款及时处理，提高公司结算效率。岗位要求：1.财务相关专业全日制本科学历，1年以上物流工作经验2.熟悉结算系统配置，结算流程管控3.了解国家财税政策、企业财务制度及流程，了解相关财税法律法规4.具有成本管理、风险控制和财务分析的意识5.熟悉计算系统操作，办公软件应用,清结算专员,https://jobs.zhaopin.com/CC506421783J00309883303.htm,招1人,6K-10K
,上海-嘉定区,上海嘉烁教育培训有限公司,CZ306688830,民营,2019/6/30 16:46,本科,不限,位职责：1、 熟悉所在年级教材及地区考情。2、 认真备课、授课，保证教学质量。3、 定期电话回访，保持有效沟通。4、 多方面、准确掌握学生动态，做好续班。任职要求：1、全日制专科以上学历，有相关教学管理经验者优先。2、普通话标准，形象佳，具有亲和力。3、热爱教学工作，具有良好的教师职业操守和服务意识。4、有责任心，执行力强。5、在教育行业有一定的工作经验。6、接受周末上班，周中休息,小学语文老师,https://jobs.zhaopin.com/306688830250180.htm,招2人,6K-8K
花木,上海-浦东新区,上海金准机电设备有限公司,CZ133640150,股份制企业,2019/6/30 16:47,本科,1-3年,岗位职责： 1.负责中央空调的采暖、通风系统工程设计；2.熟悉变频空调系统、水系统空调、通风工程的设计、施工、报价、工程招投标预结算等工作；3.协助项目经理完成施工现场技术指导工作；4.做好本专业有关技术资料的整理工作；5.完成主管领导交办的其他工作。任职资格:1.暖通相关专业，本科以上学历；2.两年以上暖通设计工作经验；3.熟悉设计行业和业务，掌握设计工作流程，具备本专业的基本理论知识，了解相关专业知识；4熟练运用制图软件及办公软件（word、excel、ppt等），具有良好的文案编辑能力；5.有设计院工作经历者优先。薪资待遇： 基本待遇（6000-8000）1.薪资优厚：基本待遇（底薪+月度岗位津贴）+年终奖金（根据“全年部门综合绩效考评）；2.公司每年安排员工体检；,暖通技术工程师,https://jobs.zhaopin.com/133640158250000.htm,招2人,6K-8K
莘庄,上海,维正知识产权服务有限公司,CZ817178030,民营,2019/6/30 15:30,本科,不限,【你的工作】1、 搜索整理政府部门发布的相关项目申报、资质认定、政策扶持、产业推进等政策文件；2、 协助项目工程师负责科技项目申报材料的统筹、编写；3、 协助做好与客户的沟通联系、维护及跟踪等工作；4、 协助对各类项目申报资料的整理、留档，做好技术资料交接、保管工作。【任职要求】1、 本科（含）以上学历，财务类/理工类相关专业，机械、电学、化学、医药、材料专业者，优先考虑；2、无工作经验均可（公司提供带薪培训）；3、 具有较强的归纳总结和文案撰写能力；4、 具有较强的统筹组织、沟通协调、逻辑分析、决策表达能力；5、 熟练使用office、ps、cad等软件；【薪资待遇】1. 薪资待遇底薪+高额提成+奖金+带薪年假+节日福利+生日福利+社会保险+住房公积金2.员工宿舍：转正后可申请员工宿舍；3.培训机会：入职一个月之内，专业部门组织开展完整的新人培训；4.聚餐福利：重大节日外加不定期团队聚餐，放节日礼品；5.生日福利：员工生日礼金发放；6.团队出游：公司每年至少组织1-2次团队出游；（国内外均可）7.股权奖励机制：入职优秀员工均可享受股权赠送，享受集团上市分红。我们做的可不是一份工作，是一辈子的事业！8.晋升通道：凭借个人的实力，入职按能力享受职级，都有机会晋升。所有管理岗位均从内部员工提拔产生：专员→组长→主管→经理→分公司总经理→集团副总裁……,项目申报工程师,https://jobs.zhaopin.com/CC817178030J00224588904.htm,招2人,5K-10K
安亭,上海-嘉定区,上海威派格智慧水务股份有限公司,CZ337595230,上市公司,2019/6/30 16:07,本科,3-5年,岗位职责：1、负责阀门产品设计工作及技术资料的收集、整理； 2、负责新产品的开发及项目管理工作，确保新产品开发及项目顺利进行； 3、负责阀门销售过程中的技术支持工作； 4、积极完成相关技术文件编制工作，保证文件的准确性、适用性。  任职要求： 1、 教育背景： 大学本科及以上学历 2、 专业：机械设计及相关专业； 3、 工作经验：3年及以上阀门设计研发经验； 4、 基本技能和素质： 基本熟悉各类阀门标准及结构、熟练使用AUTOCAD和Solidwork等制图软件； 薪资福利：1、缴纳社保公积金；2、公司有老员工计划，满五年工作，可以增加商业保险或者增加年休假天数；3、公司管三餐；4、在嘉定外冈租房人员可享受400元/月住房补贴；5、公司配备班车；6、生日礼品；7、结婚、生育礼金；8、每个月团队活动（聚餐或部门旅游）；9、每年一次体检；10、每年两次旅游（周边游）；11、公司厂区设置有健身房、书吧、咖啡厅等多种休闲放松区域；12、丰富多彩的各种专业的培训。,阀门工程师(上市企业),https://jobs.zhaopin.com/CC337595238J00250007104.htm,招1人,8K-12K
安亭,上海-嘉定区,上海威派格智慧水务股份有限公司,CZ337595230,上市公司,2019/6/30 16:07,本科,1-3年,岗位职责：1、与市场及销售团队一起深入了解客户的需求并出具针对性有竞争力的解决方案；通过各种形式（技术交流、方案宣讲、应用演示等）使客户了解方案的价值；2、对市场及销售团队进行产品与方案的培训，使其掌握基本的明了的产品方案讲解能力；3、参与重要招投标文件的编写并参与重要市场活动的产品讲解；4、对行业进行深入研究，了解竞争对手的产品、方案特点，了解竞争对手的资质及样板示范，最新的产品动态、市场动态及商务特点，形成对公司自身竞争价值的理解；5、协助销售团队进行客户的客情维护。任职要求：1、软件工程、网络工程、通信工程、电气自动化或相关专业本科以上学历；2、两年及以上以上IT行业、网络或者通信行业、系统自动化行业等系统集成相关领域售前支持的经验或者实施经验；3、热爱技术，有钻研精神，爱学习，学习能力强。,售前工程师售前技术支持,https://jobs.zhaopin.com/CC337595238J00190940004.htm,招3人,7K-14K
人民广场,上海,上海宜佰信息技术有限公司,CZ652847480,民营,2019/6/30 20:17,本科,不限,1. 沟通顺畅，能清楚的知晓对方的需求与反馈的问题点；2. 技术能力，硬件方面知晓常规PC的硬件更换操作方法和外设常用维护处理方式；3. 软件方面包含操作系统与常规办公软件如outlook，office相关的使用和故障处理；4. 日常OA应用系统的前端基本维护（IE相关）；会议支持的经验（本地、电话或视 频会议均可）；5. 网络相关，交换机前端的网络相关维护，跳线巡线等；6. 应变能力，对于非常规问题有应急处理问题能力，具备一定的软技能；7. 懂日语的优先。,it系统工程师,https://jobs.zhaopin.com/CC652847480J00260902505.htm,招2人,6K-12K
龙华,上海,中金天公共设施运营管理有限公司,CZ664247580,国企,2019/6/30 16:36,本科,1-3年,"岗位职责：1、技术研发人员：配合总工平时产品开发中的相关任务。制定公司立项产品开发计划和进度，配合总工完成产品前后期开发过程中的各项产品测试任务。配合总工完成一些相关的培训资料制作，负责公司人员相关技术培训工作，负责产品的测试工作。2、品质管控技术员：制定产品质量控制程序，参与技术部前期研发的产品在供应商处ES/PP/PR/MP过程的质量分析和产品质量认定工作，负责巡视供应商的生产前后质量把控情况；负责产品的相关认证和第三方测试工作。任职要求：1， 技术人员：能够吃苦耐劳，有经常独立出差外地的能力和准备，熟练使用CAD/PPT等设计办公软件；熟练运用道路照明设计软件进行照明设计，参与相关工程的验收工作；工作中能够使用专业的仪器仪表，完成产品和部件的测试工作。2，品质管控技术员：能够独立或在技术部人员配合下完成以下任务，工作中能独立出差外地的能力和准备。3，主持质量管理的全面工作，并对质量管理的各项工作结果负责4，组织建立质量管理体系,确保质量体系的有效运行5，制定质量目标和质量计划，经批准后组织实施6，制定产品质量检验标准，对公司采购品质量控制负责，7，负责设计与开发活动的质量策划，8，参与新产品开发的先期策划，审查产品设计、工艺的科学性、合理性9，组织实施质量统计，对统计数据的真实性、可靠性负责10，负责产品第三方检测工作11，有对各类产品质量事故进行调查，分析和提出处理意见权12，对质量问题行使否决权13，定期通报各有关厂家质量检查结果，对存在的质量问题制订纠正和预防措施并组织实施",技术工程专员,https://jobs.zhaopin.com/CC664247580J00357986807.htm,招2人,6K-8K
莘庄,上海,维正知识产权服务有限公司,CZ817178030,民营,2019/6/30 15:36,本科,不限,【你的工作】1、主要负责对接企业，挖掘企业的知识产权和可申报的政府政策项目，并与企业进行商务洽谈。2、掌握知识产权服务行业一手资源，调动集团内部优势资源，帮助企业实现利益最大化。3、深入了解客户需求，通过公司服务体系，强力执行团队目标，实现自我与客户的共有价值。4、以上前期考核之后，进行知识产权专业服务系统内的各部门轮岗学习和考核，考核通过后方可进入最终的管理定岗（轮岗过程中可结合个人和公司双向发展需求进行直接定岗，具体需面议）。【选择维正的七大理由】1. 新兴行业，国家政府支持，行业领先；2. 创业团队，90后为主，氛围和谐轻松，发展无限，机会多；3. 接触高端客户，接洽企业高管，提升自己能力、开拓视野；4. 股权制度，为自己的梦想奋斗，实现个人价值最大化；5. 带薪培训，师傅一对一，学习速度快；6. 培训课程丰富多彩，人员成长快；7.专业部门能力强、效率高，没有后顾之忧；8.所有管理层晋升，皆需轮岗。你提前完成这个步骤。【任职要求】1、统招本科及以上学历；理工科优先。2、看好知识产权行业的发展前景，有志于在本行业长期发展。3、优秀的学习理解能力，开放的视角和思维，具备领导潜质。4、做事有条理，目标责任感强。【薪资待遇】1. 薪资待遇底薪+奖金+带薪年假+节日福利+生日福利2.员工宿舍：转正后可申请员工宿舍；3.培训机会：入职一个月之内，专业部门组织开展完整的新人培训；4.聚餐福利：重大节日外加不定期团队聚餐，放节日礼品；5.生日福利：员工生日礼金发放；6.团队出游：公司每年至少组织1-2次团队出游；（国内外均可）7.股权奖励机制：入职优秀员工均可享受股权赠送，享受集团上市分红。我们做的可不是一份工作，是一辈子的事业！8.晋升通道：凭借个人的实力，入职按能力享受职级，都有机会晋升。所有管理岗位均从内部员工提拔产生：专员→组长→主管→经理→分公司总经理→集团项目负责人,管培生,https://jobs.zhaopin.com/CC817178030J00225160104.htm,招3人,6K-8K
张江,上海,上海勤壮汽车科技有限公司,CZ479438480,民营,2019/6/30 0:50,本科,1-3年,岗位职责：1. 负责产品需求分析、器件选型、电路设计，包括原理图、layout图、gerber图等；2. 实现基于STM32嵌入式软件软件的编写，完成设备产品设计功能；3. 能完成硬件部件、嵌入式软件设计相关说明文档制作，测试、验证与报告制作；4. 负责产品生产跟进和协调；5. 优质完成上级交办的其它事项。任职资格：1. 本科计算机相关学位及以上专业2. 具有4年以上电子产品研发经验，具有独立完成过产品的设计和开发工作经验；3. 具有常规MCU驱动开发经验，有操作系统开发经验；4. 有绘制多层板经验，能独立完成电路设计和PCB布线、调试测试；5. 责任感强、积极乐观、善于沟通，良好的团队合作精神；6. 英语6级优先。工作地址：上海, 嵌入式开发工程师（汽车诊断）  ,https://jobs.zhaopin.com/CC479438481J00414433901.htm,招3人,15K-25K
江桥,上海,上海楚非信息科技有限公司,CZ461070230,民营,2019/6/30 12:30,本科,3-5年,1、负责手机客户端项目开发；2、基于HTML5、CSS3、前端JS框架进行页面制作，编写可复用的用户界面组件。3、兼容各种分辨率手机、微信平台；兼容多浏览器；优化前端体验和页面响应速度；4、配合后台工程师一起研讨技术实现方案，进行应用及系统整合。任职资格1、大学本科及以上学历，计算机相关专业；2、利用html5相关技术，开发网站及移动平台web前端页面；3、负责公司旗下产品前端开发工作，完成前端架构；4、配合产品经理和UI设计师研究并改善用户体验；5、参与研发部门产品和项目研发，配合团队产品界面和功能；6、持续的优化前端体验和页面响应速度，并保证兼容性和执行效率。福利待遇：1、节假日福利、公司年会抽奖、优秀员工奖等;2、每年至少一次旅游和团建（国外游机会）;3、享有带薪年假及法定节假日，春节带薪多休3-5天,HTML5开发工程师,https://jobs.zhaopin.com/CZ461070230J00290032608.htm,招1人,6K-8K
曲阳,上海,卓越教育集团,CZ435259620,民营,2019/6/30 19:44,本科,1-3年,岗位职责:1.针对学生情况，对其进行个性化的课程讲授，提供专业、高质量教学服务2.帮助学员提高学习兴趣，养成良好的学习习惯，掌握高效的学习方法；3.在教务部的统筹安排下，负责授课、试卷出题、批改工作，同时与其他教师协作进行本学科的教学研究 ，参加学科日常的各项教学、教研及培训活动，包括期中期末考试；4.紧密结合学生特点，为学生查漏补缺，帮助学员尽快提高成绩5.协助学生自习的管理任职资格:1、本科以上学历。1年教学经验优先；2、学习能力强，工作认真负责，有耐心，能吃苦耐劳，服从学校的安排；3、能快速的熟悉小学生的生活及学习特点，善于因材施教，能开拓发掘组织多种教学方式，灵活教学；4、有师德，善于与学生、家长交流沟通，解决问题；5、热爱教师工作，愿意扎根教育事业。工作地址虹口区四平路710号,小学语文教师,https://jobs.zhaopin.com/435259622250536.htm,招1人,8K-10K
南桥,上海,上海奉贤交通能源(集团)有限公司,CZ304031880,国企,2019/6/30 19:01,本科,不限,上海奉贤交通能源（集团）有限公司作为城市公共事业服务商、城市基础建设投资商、城市土地综合开发商“三位一体”的城市运营商，是奉贤区的大型国有企业。因集团发展需要，现公开招聘3名规划专员，具体要求如下：工作内容：1.负责项目文档资料、设计变更、竣工图纸等日常记录的收集管理；2. 协助项目全过程相关工作；3. 完成领导交办的其他工作。职位要求：1.建筑设计、规划等相关专业大学本科及以上学历；2.责任意识强，具有良好的协调能力和沟通能力。,规划专员,https://jobs.zhaopin.com/CC304031880J00383711205.htm,招3人,6K-8K
七浦路,上海,永瞿(上海)财务咨询有限公司,CZ604991220,民营,2019/6/30 19:29,本科,3-5年,职位描述：1、客户原始凭证的审核，会计凭证的编制2、每月在规定时间内完成整套账务处理、编制财务报表，编制税报表、并完成纳税申报3、负责解答客户提出的财务和税务方面的问题，配合客户完成与财务相关的工作4、与公司同事合作，为其他同事做账务处理的审核工作5、完成客户公司的年度汇算清缴，年检等工作6、税务局与外管局事宜的日常对应和以及联络负责商务局，工商局，统计局等报表的填报工作7、完成上级交付的临时工作及其他任务职位要求：1、全盘会计经验者，能独立完成公司记账及税务申报业务。2、2-3年以上财务工作相关经验3、为人诚实，有责任心，能吃苦，有较强的服务意识4、日资企业工作经验者优先5、会日语者优先,财务会计（代理记账）,https://jobs.zhaopin.com/CC604991229J00378871001.htm,招1人,6K-8K
六里,上海-浦东新区,上海凯京信达科技集团有限公司,CZ506421780,民营,2019/6/30 16:34,本科,1-3年,岗位职责：1、协助完善企业贷后管理系统的更新迭代；2、根据公司的产品（融资租赁、保理）的操作要求进行贷后业务跟踪、数据分析，判断企业的逾期原因（数据层面），结合销售反馈的现场信息，预判企业逾期的真实原因及未来一段时间的风险级别；3、根据预判的风险原因及风险级别，提出针对性解决方案；4、汇总各项目的解决方案，落实跟进且及时反馈，根据方案进展，适当调整既定的解决方案，直至解决问题；5、督促相关客户经理进行逾期客户的催收并更新相关贷后事项，催收进度监控；6、根据贷后逾期的跟进情况，总结规律，及时将共性问题反馈至授信及其他有关部门；7、领导交待的其他事宜；岗位要求：1、本科学历及以上，优先财会、审计专业，有银行、小贷公司或商业保理公司的贷后管理经验优先；2、熟悉物流行业背景，有较强的财务分析能力；3、工作认真细致有条理，有责任感，有良好的沟通和协调能力，有职业操守，无不良记录；4、熟练使用计算机常用办公软件。,贷后管理岗,https://jobs.zhaopin.com/CC506421783J00310528503.htm,招1人,6K-8K
枫林路,上海,初恩医疗咨询(上海)有限公司,CZ752840880,民营,2019/6/30 17:24,本科,1-3年,职位亮点：跨区域工作，全流程统筹，项目奖金制，海外培训，扁平化管理 岗位职责：  1、 负责客户赴美医疗前的咨询和服务介绍，获得和培养潜在客户2、 收集整理客户信息，协助客户完成与美国医生的咨询，为客户订制个性化方案3、 为客户建立档案，协助客户完成赴美前的流程准备4、 负责客户项目过程中的协调、文件翻译、口译等工作5、 将客户的问题与美国合作机构进行沟通，及时反馈给客户，督促相关部门及时解决  职位要求： 1、本科以上学历，有海外留学经验者优先    2、为人积极、诚恳，工作态度认真、细致、耐心 3、服从公司安排，有良好的团队协作精神，有良好的沟通能力和协调能力  4、大学英语英语六级或专业八级以上，听说读写能力优秀者优先,英文客服 高端客户 医疗健康运营专员[上海],https://jobs.zhaopin.com/CZ752840880J00145834701.htm,招4人,6K-12K
徐家汇,上海,麦修(上海)商务咨询有限公司,CZ574795530,港澳台公司,2019/6/30 16:53,本科,1-3年,岗位职责：1.     配合领导组织新媒体（包括但不限于微信公众号、微店等）平台对快消品行业热点栏目的选题，活动策划，创意构思及文案创作；2.     新媒体运营：负责公司微信公众号及其他新媒体图文/软文内容的撰写，编辑，页面设计，宣传和推广工作；3.     对推文内容的质量进行把控，保证有持续不断的优质内容产出； 4.     微信公众号平台日常的维护与管理：通过相关运营工具，有效提升粉丝数和阅读量； 与粉丝保持日常的交流和互动，增加粉丝对公司产品的粘性；5.     有效把握与捕捉社会热点、打造有传播性的话题和内容；6.     分析数据并反馈，发现问题并解决问题；7.     完成领导安排的其他工作。 任职要求：8.     有快消品类新媒体／微信公众号／电商平台公众号编辑， 内容运营经验；9.     创意独到， 文字功底深厚，有良好的审美观；10.  广告学、新闻学、文学编辑类、市场营销学等相关专业毕业；11.  英文听说读写具备一定的水平， 能看懂国外品牌的介绍；12.  具有良好的沟通能力和执行力，高效灵活的团队合作精神，有责任心；13.  熟练运用办公软件，精通Photoshop、Premiere等设计制作软件；14.  简历投递、面试时请准备个人前期作品（以往发表过的推文等）。,微信公众号,https://jobs.zhaopin.com/CC574795530J00285120502.htm,招1人,6K-8K
安亭,上海-嘉定区,上海威派格智慧水务股份有限公司,CZ337595230,上市公司,2019/6/30 16:07,本科,3-5年,岗位职责：1.负责电机电磁设计，结构设计及电磁仿真工作；2.及时完成项目相关的设计文件，技术文件以及测试规划；3.分析、解决项目中出现的问题，并进行经验的总结与交流。任职要求：1、全日制统招本科及以上学历、机电一体化/电机等相关专业；2、熟练应用ANSOFT等电磁设计分析软件进行电磁性能分析；3、熟练使用机械制图软件如AutoCAD、SolidWorks等；4、了解电机定转子相关机械加工及装配工艺。薪资福利：1、缴纳社保公积金；2、公司有老员工计划，满五年工作，可以增加商业保险或者增加年休假天数；3、公司管三餐；4、在嘉定外冈租房人员可享受400元/月住房补贴；5、公司配备班车；6、生日礼品；7、结婚、生育礼金；8、每个月团队活动（聚餐或部门旅游）；9、每年一次体检；10、每年两次旅游（周边游）；11、公司厂区设置有健身房、书吧、咖啡厅等多种休闲放松区域；12、丰富多彩的各种专业的培训。,电机工程师,https://jobs.zhaopin.com/CC337595238J00191146904.htm,招1人,8K-15K
