address,city,company,company_id,company_type,date,education,experience,job_description,job_name,job_url,people_num,salary
北新泾,上海-长宁区,北京车音网科技有限公司,CZ368918310,股份制企业,2019-07-08 08:57:02,本科,3-5年,"岗位职责：1、 负责护现有的项目（移动端H5）2、 负责现有产品的移动端用户体验及改进工作3、 负责开发新的web应用类产品4、 根据设计图，实现web界面并且优化保证各系统的兼容性任职要求：1、 拥有3年以上移动端H5开发经验2、 敏捷的思维和清晰的逻辑3、 对用户体验、交互操作流程、及用户需求有一定了解4、 精通JavaScript与HTML5、CSS3编写，熟练使用jquery和VUE前端框架5、 能够熟练的将UI输出的设计文件转换成页面布局6、 能够熟悉解决主流浏览器的兼容性问题7、 能够熟练使用grunt,gulp,webpack等",H5前端开发工程师,https://jobs.zhaopin.com/CC368918312J00156183713.htm,招1人,15K-20K
马陆,上海-嘉定区,西信科技有限公司,CZ681874930,民营,2019-07-08 08:46:17,本科,1-3年,1）1年以上Android开发经验，本科及以上学历；2）熟悉Android软件的开发、测试、分发流程；3）熟悉AndroidAPI，熟练掌握AndroidUI系统控件及自定义控件的开发；4）熟练掌握Java语言，熟悉常用设计模式；5）熟悉移动网络通信机制，对Socket通信，TCP/IP和HTTP有充分理解。,android开发工程师,https://jobs.zhaopin.com/CC681874930J00281237406.htm,招1人,8K-12K
花木,上海,快钱支付清算信息有限公司,CZ121046010,民营,2019-07-08 09:02:08,本科,1-3年,职位描述：1、 根据Devops的工程化过程标准，推进各产品线在端到端上线发布各阶段的实施和落地，为项目组提供过程指导咨询和审计；2、 负责审核产品线的研发过程、工作产品，定期发布质量报告和工程化实施报告，确保组织标准的过程执行质量以及产品交付质量；3、 负责收集和分析数据，协助健全组织度量体系，为过程改进提供依据；4、 持续发现过程改进点，和优化工具平台，提升产研的质量和效率；5、 组织技术能力相关的宣导和培训工作。职位要求： 1、 计算机软件、质量工程管理或计算机相关专业大学本科以上学历； 2、 2年以上SQA工作或软件项目管理或配置管理相关工作经验；3、理解Devops理念， 熟悉相关过程实践，掌握AML、Pipeline相关支撑工具使用；4、 具有金融科技或互联网行业工作经验；5、 善于与持不同意见的人合作和灵活应变的处事能力，有较强的问题协调、说服、组织能力；6、 个性乐观开朗，逻辑性强，沟通能力良好，富有责任感，,sqa质量工程师,https://jobs.zhaopin.com/CC121046017J00291546302.htm,招1人,10K-15K
曹家渡,上海-普陀区,上海恒润商品检验有限公司,CZ436942610,民营,2019-07-08 09:04:22,本科,5-10年,任职要求：1.五年以上现场检验或船上经验，对船舶加油、起退租、件杂货/大件监装、水尺检验有深入的理解；2.英语四级以上，能用英语进行文字和语言交流；3.积极进取，有开拓精神和良好的职业素养，品行端正；4.熟悉行业及市场5.能独立开发客户并完成指标；具有一定管理能力。岗位职责：1.负责区域员工的管理工作，提高工作质量和员工的斗志；2.做好市场开发工作，维护和客户之间的关系；3.配合公司的战略部署和市场布局，提出合理可行的商业计划；4.吸纳行业优秀员工或公司的加盟。待遇：年终分红；提供广阔的职业发展通道。,海事经理,https://jobs.zhaopin.com/CC436942611J00286164306.htm,招1人,8K-10K
曹家渡,上海-静安区,上海同策房产咨询股份有限公司,CZ000509950,合资,2019-07-08 08:55:27,本科,5-10年,工作职责：1、全面负责项目前期、开盘期和销售期的策划案及营销方案的制定；2、进行各项计划目标及方案执行的监督；3、媒体、广告方案的联络与洽商；4、项目宣传及实施效果的评定。 任职资格：1、28-40岁，大学本科及以上学历，市场营销类、房地产管理类等相关专业毕业；2、5年及以上一线城市地产公司或知名代理机构营销策划或项目管理工作经验，3年以上经理级及以上团队管理经验；3、熟悉地产项目的策划流程及开发运作流程，对地产项目的产品规划设计等具有良好的专业认知水平，具有领导完成大型项目的成功经验4、较强的团队管理、沟通协调能力，良好的自我学习、团队合作和创新能力，强烈的责任感和事业心，为人正直诚信。 ,策略总监,https://jobs.zhaopin.com/CC000509954J00248027504.htm,招1人,20K-25K
七浦路,上海-黄浦区,吉双艺工程咨询(上海)有限公司,CZ000111650,外商独资,2019-07-08 09:01:06,本科,10年以上,"职责描述：1、  与客户管理层保持密切联系，以确定客户对GEE人力资源管理援助的要求，包括职位描述、工作时间表、为派往项目的GEE人员提供的福利等；2、  统筹规划集团人才招聘战略，配合支撑企业战略目标实现； 3、  领导团队建立和改进招聘策略、选择流程和工具、人才库、雇主品牌等。不断提高招聘效率，建立高效敏捷的人才输送系统，满足客户需求；4、  领导团队不断拓展招聘渠道，了解行业动态，强化高端人才招聘和储备；5、  制定招聘计划，完成公司中高端空缺职位的招聘，根据招聘计划的执行情况，不定期的提出招聘工作的改善建议；6、  充分协调配置集团招聘资源，控制招聘成本；7、  指导体系招聘人员专业能力全面赋能；8、  负责公司其他与招聘相关的事情。 任职要求：1）  学历: 人力资源管理学位或相关学位2）  必须有良好的英语与客户和GEE管理层的日常沟通3）  15年工作经验4）  10年招聘工作经验5）  10年石油气化行业经验6）  4年招聘经理或人事主管工作经验7）  入职时间：一个月 Job description:   Keep in close contact with client management to determine clientrequirements for human resource management assistance from GEE, including jobdescriptions, work schedule, benefits provided for GEE personnel to bedispatched to the projects etc;    Plan the recruitment strategy of the group as a whole and supportthe realization of the strategic objectives of the enterprise;   Lead the team to establish and improve recruitment strategy,selection process and tools, talent pool, employer brand, etc. to continuouslyimprove recruitment efficiency and build an efficient and agile talent deliverysystem to meet client requirements;   Leading the team to continuously expand recruitment channels,understand industry trends and strengthen recruitment and reserve of high-endtalents;   Formulate the recruitment plan, complete the recruitment of high-endvacancies in the company, and make suggestions for improvement of recruitmentfrom time to time according to the implementation of the recruitment plan;   Fully coordinate and allocate group recruitment resources andcontrol recruitment costs;   The guidance system recruitment personnel professional ability fullyenabled;   Be responsible for other recruitment related matters of the company. Job requirements:   Education：Degree in Human Resources Management or related degree   Must have good English for daily communications with clients and GEEmanagement   15 years’ work experience   10 years recruitment work experience   10 years oil & gas industry experience   4 years Recruitment Manager experience or Human Resource (HR)Manager experience   Available time: one month",招聘经理,https://jobs.zhaopin.com/CC000111654J00286322406.htm,招8人,30K-40K
张江,上海,上海超恒软件技术有限公司,CZ384186210,民营,2019-07-08 08:48:23,本科,5-10年,岗位职责：1. 负责前期项目价值分析、技术预研和立项工作；2. 负责与客户沟通，理解收集客户需求，以及后期解答客户问题；3. 负责产品用户场景设计，系统架构框架图设计；4. 负责根据行业技术、用户要求进行需求收集、分析和分解，要求逐级分解到开发粒度；5. 负责与项目经理、架构师、测试开发人员进行沟通，负责需求交付实现进度；6. 负责或者协助其他研发人员撰写项目测试用例；技能要求：1. 本科毕业；2. 有2年以上需求分析工作经验，有软件研发经验者更佳；3. 熟练使用需求管理系统，如Rally、Leangoo等；4. 熟练使用需求分析/建模工具；5. 精通软件UML建模，数据设计建模，Web原型设计，客户端原型设计者优先；6. 有良好的沟通能力，工作认真负责，心思紧密。{~CQ 2031 CQ~},软件需求分析师,https://jobs.zhaopin.com/CC384186213J00285314906.htm,招2人,15K-20K
徐泾,上海,上海美满人生旅行社有限公司,CZ680118930,合资,2019-07-08 00:51:55,本科,3-5年,岗位要求：1、具备丰富的健康行业从业经验，大学本科及以上学历， 市场营销等相关专业优先，熟悉健康管理运作模式；2、具有国家承认的三级及以上公共营养师证书或健康管理师证书，营养学、医学、食品营养专业优先；3、在国内相关行业有任职经验，有过直销行业培训管理工作经验（如：安利、如新、康宝菜等），熟练制定企业培训课程规划及培训教案，组织参加过大型销售培训会及有培训讲师经验者的优先录用，外资行业任职者优先;4、具有较强的现场互动能力，组织协调能力，团结协作，爱岗敬业； 5、年龄28-40岁，形象好，气质佳，富有激情，较强的亲和力和感染力、良好的文字和语言表达能力、沟通能力，思维敏捷。岗位职责：1、围绕本公司产品，了解产品研发、特点和功能，结合市场特点，提出有效产品开发提案；掌握产品信息，并擅长授课的形式对产品进行讲解；2、把营养知识和营销活动相结合，并对业务人员、目标客户、经销商、代理商进行产品及营养学知识方面的培训，帮助市场完成销售任务；3、制定和不断优化公司产品的培训内容、培训方案，根据市场情况，组织开发培训课程及拟定培训计划；4、根据公司及客户的需求随时调整培训内容并进行营养知识培训和产品培训；5、能适应出差（上海及周边为主）；薪酬福利：1、五险一金、带薪培训、带薪年假、月度奖金、年底红包、公司旅游；2、节日礼物、节日补贴、每月公司聚餐；3、优秀的团队、合理的晋升空间；4、工作环境优越，管理扁平化，人性化，以自觉为主；5、综合薪资8-12k，具体薪资可面谈；6、上班时间：周一至周五 早9:00-17:30；7、上班地点：虹桥商务区  路线：地铁2号线，10号线，17号线，虹桥火车站步行5-10分钟 ,高级营养师,https://jobs.zhaopin.com/CC680118930J00114848706.htm,招1人,8K-12K
漕宝路,上海,北京五八信息技术有限公司上海徐汇分公司,CZ607663020,上市公司,2019-07-08 08:56:31,本科,不限,工作职责：1、通过广阔的社交渠道，借助58的后台资源推广58集团的线上服务产品；2、运用专业的知识为客户提供准确、个性化的推广法案。3、拓展、开发新客户，维护老客户，完成预期的业绩目标，通过工作实践锻炼商务销售能力；4、参与分公司商务管理工作，分析商务数据，掌握产品运营方法；参与销售目标设定、分解、执行以及商务团队组建、培养、激励等商务管理活动，掌握管理技能与技巧；职位要求：1、即便你满腹经纶也要正规大学本科及以上学历的应届毕业生，对销售管理类工作有浓厚兴趣；2、即便你阅历丰富也要懂得互联网知识，会使用app，市场营销、企业管理等经济管理类相关专业优先考虑；3、即便你是月光族，也要有为客户搭理百万资产的方服务意识；4、对工作和生活充满激情，不甘于平庸，不断追求进去与自我突破，具备良好的客户服务意识和抗压能力；5、乐观外向、乐于与人交往，有自己的想法和梦想，善于学习思考，能快速的接受新鲜事物，具备良好的语言表达、人际沟通能力；6、在校期间，担任过学生干部，或组织过社团活动，有团队荣誉感和高度的执行力。培养方向：中层精英→高层管理1、与客户进行一对一沟通，对个人业绩负责，挑战高薪高提成。2、管理培训期结束，经公司考察合格后，担任商务主管职位，开展销售计划管理，销售精英队伍打造，！！！这不是一份普通的销售工作，我们要寻找的是能够成为公司中层管理干部的优秀人才，加入我们你将得到：1、成长：专业培训团队集中训练营，专业的小师傅帮带，经理和总监精心关怀和指导，不用担心自己是小白！2、待遇：超越同届应届生的薪酬待遇，不用担心被比下去，底薪+高额提成+各种补助，成长为管理者将享受团队业绩提成。3、发展：快速发展的集团企业，私人订制的发展通道，双通道的发展途径。4、人生价值的实现：这是一家纽交所上市的集团企业，秉承着用户第一，学习成长，简单可信，主动协作，创业精神的价值观，为打造人人信赖的生活服务平台我们共同努力！5、舒适的公司气氛：领导nice，90后团队，营销团队超过1万人，年终带薪年假10天以上（不用紧张的抢过年车票），五险一金入职即缴，30多家分公司任你挑！,销售管培生（2019届）,https://jobs.zhaopin.com/CC607663020J00343172907.htm,招6人,8K-12K
惠南,上海,上海平度广告策划有限公司,CZ725225180,合资,2019-07-08 08:54:03,本科,3-5年,薪资待遇：试用期一个月（10000），入职后：税后15000岗位要求：1：精通photoshop、lllustrator、coreldraw等相关图形及图像处理软件，俱备平面KV、活动物料等创意 2：会看文案，能抓住方案设计理念，独立完成文案企划 3：俱备清晰的活动策划思路和前卫的活动创新能力4：热忱、开朗、足够的创新意识、强烈的服务意识和时间观念，良好的团队协作精神5、本科以上，展示设计、艺术设计等相关专业毕业6、3年以上广告公司相关工作经历，俱备广告创意执经验，具有广告标识标牌、景观设计、活动策划经验者优先考虑职位描述：负责公司项目中活动内容，对客户的项目进行调研分析，提供专业性的活动策略、策划等,平面设计师/平面设计师助理/平面设计师美工,https://jobs.zhaopin.com/CZ725225180J00013574107.htm,招2人,10K-15K
人民广场,上海-浦东新区,温岭市上海从业商会,CZ657186830,社会团体,2019-07-08 08:55:31,本科,3-5年,岗位描述：（薪资面议）1. 负责商会重要文字（工作计划、总结、领导讲话、会议纪要、新闻报道等）撰写。2. 负责商会刊物、宣传片、活动手册等宣传产品的制作执行。3. 负责商会各项会议、活动的策划组织与实施。4. 负责商会官方网站、微博、微信、短信平台的维护与管理工作。5. 负责协助维护、运作商会的媒体关系，做好商会日常宣传。6. 负责秘书处对外联络、接待、宣传和拓展等工作。7. 配合市政府驻沪办、人才联络处做好温岭在沪各团队相关服务工作。8. 会长及秘书长交办的其他工作。任职要求：1. 全日制中文、新闻、传媒、公共关系及相关专业，大学本科学历。2. 形象好，气质佳，富有亲和力，具备较强的责任心和敬业精神。3. 熟练运用OFFICE等办公软件，文字撰写能力好，能独立撰写各类商会文案，并掌握一定的摄影技术。4. 三年以上相关工作经验，具有媒体、商协会、事业单位等相关岗位经验优先录用。5. 具有较强的活动策划、组织能力，有组织策划大型活动经验者优先。工作地址：（暂）上海市浦东新区张杨路2798弄4号楼，地铁6号线德平路站1号口出，步行3分钟试用期2个月,商会外宣部长,https://jobs.zhaopin.com/CZ657186830J00226770404.htm,招2人,6K-8K
浦江镇,上海,上海明厦物联网科技有限公司,CZ837675860,民营,2019-07-08 09:03:52,本科,1-3年,      岗位职责1.   负责公司产品硬件设计开发工作，能独立进行嵌入式设计、编程、测试、验证工作；2.   负责编制产品操作说明书、设计开发文档，测试文档；3.   负责及时解决客户反馈的使用问题；4.   负责公司产品输出硬件版本和嵌入式软件版本的存档、维护工作；5.   负责产品使用培训工作；6.   按时完成公司领导交办的其它工作任务。    任职要求1.   计算机、通信、电子本科学历及以上；2.   精通嵌入式软件UI与应用软件设计； 3.   熟悉嵌入式操作系统，如Linux、ucos、rtos等；4.   熟悉STM32、TI、NXP等MCU主控芯片的硬件设计，熟悉模拟电路设计、数字电路设计，能够熟练制作电路板图；5.   对无线通信和有线组网通信有开发经验；6.   掌握常用的设计工具，调试仪器仪表的使用方法；7.   具有产品的开发工作经验；8.   工作态度积极，责任心强，良好的沟通与团队配合；9.   独立设计过完整的电子产品，能读懂英文产品规格书；10.  具有较强的学习能力、执行能力，具有良好的协调沟通能力，做事细心、负责任，工作态度积极，能吃苦。,产品硬件开发工程师,https://jobs.zhaopin.com/CC837675860J00354552503.htm,招10人,10K-15K
南翔,上海,米儿谷(上海)教育科技有限公司,CZ347225430,民营,2019-07-08 00:50:36,本科,1-3年,岗位职责：1、负责幼儿保健，晨检、幼儿定期体格检查及对体弱儿设专案管理等工作。2、幼儿日常健康的护理和疾病预防。3、卫生常识的宣传指导。4、合理安排幼儿膳食，以及对厨房工作的监督指导。任职条件：1、大专及以上学历，有卫生、护理、营养等相关专业背景优先。2、具备幼儿保健资格证书、专业技术职称证书3、有幼儿园保健老师工作经验者优先考虑,幼儿园保健医生,https://jobs.zhaopin.com/CC347225430J00257592508.htm,招1人,6K-8K
城隍庙,上海-黄浦区,维罗软件技术有限公司,CZ263132910,民营,2019-07-08 08:51:10,本科,3-5年,1.精通HTML5、CSS3，熟悉页面架构和布局，保证对主流浏览器的兼容；2.熟悉常见Web框架原理，熟悉前端的MVC，MVP MVVM等思想，熟悉 Angular VUE react 熟悉http协议3.熟练使用webpack等工具，能独立开发完成web项目，包含页面重构和js编码。4.熟悉SPRING框架。,JAVA开发（偏前端）,https://jobs.zhaopin.com/CC263132912J00283881304.htm,招1人,15K-20K
人民广场,上海-静安区,诺幼(上海)教育科技有限公司,CZ825683270,外商独资,2019-07-08 08:51:07,本科,5-10年,"Responsibilities:1.       Lead theCustomer Support team to provide Business Clients with great using consultingexperience.2.       Establish andoptimize the systematic process of quality control, routine operations,training and reporting service, etc. while ensuring all processes run smoothly3.       Improve theoperational guidelines and scripts for customer support team on a regularbasis, while guiding the team to progress to better level of service. 4.       Handle theroutine tasks on management, training, quality control, work arrangement andperformance evaluation.5.       Makeefficient connections with other departments related while pushing forward alloptimization processes6.       Manage theaccount information in Royalabc platform.7.       Build up andmaintain healthy relationship with clients in order to enhance customer loyaltyand maximize the possibility of renewal. 岗位职责:1.       负责带领客服团队为B端客户提供良好的产品使用体验和服务咨询2.       负责建立和优化客服业务的日常运营系统、质量、流程、培训、报表等体系，并确保有效运转；3.       负责定期优化客服操作手册和话术，指导团队不断改善客服的服务水平4.       负责客服团队的日常管理、培训指导、质量监控、工作安排及绩效评估5.       与相关业务部门建立高效的对接机制，推动各项产品及流程优化工作6.       管理RoyalABC 产品平台帐户信息7.       与客户建立良好的工作关系，增强客户粘性，最大化增加客户续约率 Requirements:1.       Bachelor’sDegree and above with more than 5 years’ working experience in customersupport. Education-related experience is preferred2.       Familiaritywith the management process of customer support system. Experience in buildingup customer support team for enterprises is preferred. 3.       Great senseof customer service and relatively good abilities of expression, data analysisand business judgment, capable of evaluating problems and put forwardproposals.  4.       Strongresponsibility and execution, being able to endure pressure and value teamcooperation.5.       ExcellentEnglish abilities in listening, reading, writing and speaking with goodcommunication skills and strain capacity.6.       Acceptflexible working time and business trips at times. 任职要求:1.       本科及以上学历，至少5年以上客户服务经验，具备教育行业工作经历优先2.       熟悉客户服务体系的管理流程，有企业客服团队体系搭及管理经验3.       具有良好的服务意识，有较强的文字语言表达能力、数据分析能力及商业分析判断能力，能够诊断问题并及时提出改善方案4.       工作责任心强，执行力强，能承受工作压力，具有团队合作精神5.       具有优秀的英文听说读写能力，沟通表达能力强，应变能力佳6.       接受弹性工作，及一定的出差工作",客户体验经理,https://jobs.zhaopin.com/CZ825683270J00357671903.htm,招1人,18K-25K
城隍庙,上海-黄浦区,维罗软件技术有限公司,CZ263132910,民营,2019-07-08 08:50:38,本科,3-5年,1、计算机、信息管理或相关专业，本科及以上学历；2、熟悉证券业务知识、金融行业的分析型应用；3、具备应用数据集市的设计、开发经验。对大数据和数据仓库的概念有深入理解，能够熟练进行数据模型的设计、SQL的开发；4、具备数据挖掘经验的优先。,数据应用开发岗,https://jobs.zhaopin.com/CC263132912J00283880304.htm,招1人,15K-20K
莘庄,上海,上海速优装饰有限公司,CZ477979980,民营,2019-07-08 09:00:43,本科,不限,岗位职责：   1、负责按照维修部要求，及时从系统内接单并通知到相关负责维人员 2、负责及时跟进维修工单并及时反馈甲方3、与甲方供管理部对接，品质数据、超期数据、投诉数据整理、反馈与分析；4、组织工长认证；5、与甲方保持良好沟通；岗位要求：   1.统招专科及以上学历；2.能够熟练使用EXCEL等办公软件；3.了解装修，有相关工作经验者优先；4.沟通能力强，学习能力强，能承受一定压力。 ,维修调度专员/400跟单,https://jobs.zhaopin.com/CC477979986J00368987507.htm,招1人,6K-8K
北蔡,上海,上海悉成资产管理有限公司,CZ664104220,民营,2019-07-08 08:37:17,本科,不限,1、职位描述公司日常办公秩序的维护，做好来电、来访的登记、接待工作；负责日常办公用品及设备的采购、登记管理、发放、维护、保养；负责办公区域的管理及邮件、快递收发等管理；负责传真件的收发工作；协助人员招聘、录用、培训、离职等相关工作；完成领导所交代的其他相关行政工作。 2、任职要求大学专科及以上学历，相关工作经验1年以上；年龄30岁以下，身高160cm以上；普通话标准、形象气质佳，亲切热情，谈吐得体；较好的礼仪知识和接待工作经验；熟悉办公室行政管理工作流程，熟练使用office办公软件及自动化设备，具备基本的网络知识；工作仔细认真，具备较强的责任心和服务意识；能够全面配合上级领导的工作。,行政前台,https://jobs.zhaopin.com/CC664104221J00062923007.htm,招2人,4K-6K
重固,上海,上海靓凯实业有限公司,CZ425883010,民营,2019-07-08 00:50:07,本科,不限,年龄：23岁至34岁学历：常日制本科以上专业：工程项目相关的建筑专业，土木工程专业。性别：男、女都可以户籍：江浙沪为主，其他省市也可以应届毕业生也可以薪资待遇 5000-10000福利：五险一金 双休 国内游 体检 年终奖 加班费 工作餐其他：适应加班，会开车。公司介绍：本公司是一家从事电力排顶管的公司，并承接道路绿化修复等工程。上班地点：上海是青浦区重固镇。,工程助理专员,https://jobs.zhaopin.com/CC425883010J00256643206.htm,招3人,6K-8K
