address,city,company,company_id,company_type,date,education,experience,job_description,job_name,job_url,people_num,salary
张江,上海,上海安锐盟企业服务有限公司,CZ397839210,合资,2019-07-08 00:50:45,本科,无经验,岗位职责：1.    协助项目经理或专业顾问，完成节能项目的前期调研、能源审计、节能方案制定与编写、系统图及平面图的绘制、设备材料清单编制、既有节能改造项目运维数据分析等。2.    协助项目经理完成节能诊断工作，了解工业设施或公共建筑的用能特性，分析包括建筑围护结构、暖通空调系统、照明系统、热水系统和楼宇自控在内的主要用能系统的特点，收集能源系统运行记录及使用习惯，完成能源审计报告及调研报告；3.    根据项目本身特点，针对不同用能系统制订出合理的节能技术改造措施，计算节能量，完成节能方案；4.    协助专业工程师，根据节能方案完成基本的机电图纸设计；5.    参与项目施工及调试过程，协助项目工程师完成系统优化调试工作；6.    根据运维数据完成既有项目节能量的计算，分析项目运营中出现的问题，并提出运维优化方案；7.    跟踪节能行业政策形势，配合项目经理各类绿色或节能示范项目申报。  任职资格：1、  暖通、热动、机电一体化、电气自动化等相关专业，全日制本科大三、大四、硕士、博士研究生在读学生或应届生；2、  学习成绩在专业前50%，有较强的学习和理解能力，谦虚好学，善于沟通，具有责任心、事业心和团队合作精神；3、  熟练掌握各办公软件和主要的专业软件，如Office、CAD等；4、  具备良好的组织、计划、执行、沟通、协调、分析和学习能力；5、  有建筑水、暖、电相关设计或节能公司实习经验者优先；6、  具有良好的英语阅读及写作能力者优先；7、  逻辑性强，表达能力好，善于与客户交流沟通的优先。,助理节能技术工程师,https://jobs.zhaopin.com/CC397839211J00242891502.htm,招2人,5K-10K
淮海路,上海,达致高工程咨询(上海)有限公司,CZ257789820,外商独资,2019-07-08 09:02:45,本科,不限,"一. 岗位职责：工作职责包括但不限于：-1. 在工程师或项目经理的指导和要求下，执行助理设计顾问之职责，包括CAD制图，设计计算，文本编制，招标配合，施工配合，调试验证等。2. 协助达致高项目经理或工程师，与客户、管理公司、承包商和项目各有关方的沟通和联系。3. 能够独立工作，并与项目团队协作。4. 本职位将驻上海工作，但如果项目需要，则需在大陆，香港及其它亚太地区出差。二. 任职要求：1. 有电气工程 / 自动化专业本科及以上学位；2. 具备一定的英语听说读写能力3. 有数据中心设计领域工作经验者优先；4. 有设计院或者工程顾问公司工作经验者优先；A . DUTIES:You responsibilities will include but not limited to:-1. Performing duties as an assistant engineer such as CAD drafting, design calculation, report drafting, tender cooperation, construction cooperation as well as testing and commissioning under the guidance and requirement of Engineer or Project Manager.2. Assist DSCO Project Manager or Senior Engineer and liaise with clients, project managers, contractors, and various stakeholders in the projects.3. Work independently and collaboration with project team.4. You will be stationed in Shanghai and you shall be willing to travel throughout China, Hong Kong and Asia Pacific Region when such requirement arises.B.  JOB REQUIREMENTS:-1. Have a bachelor's degree or above in electrical engineering or automation engineering;2. Capable of English ability3. Candidates with experience in Data Centre design will be given a higher preference;4. Candidates with experience in Local Design Institute or Engineering Consultancy Company will be given a higher preference;",助理电气设计,https://jobs.zhaopin.com/CC257789823J00294695507.htm,招1人,4K-6K
漕河泾,上海,中国平安人寿保险股份有限公司上海徐汇钦江路营销服务部融承部,CZ859222950,国企,2019-07-08 00:50:55,本科,1-3年,平安1号主管招募计划（简称“1号计划”）是平安上海分公司面向社会公开招募若干25-45岁高素质、高学历的社会英才，通过公司培养和学习，在未来一年内的时间成为平安的业务主管。1号计划将分成三大阶段进行培养（市场实习阶段、进修培养阶段、管理转型阶段），三个阶段达成标准后，将前往国内最好的企业大学—中国平安金融学院参加研修培训，以便未来向更高职级发展，一但成功晋升为平安主管，不仅有每年8万元的医疗保障费用，更能拥有很好的管理收入和职务津贴。职位要求：1. 大专及本科以上学历，年龄25岁—45岁；，性别不限；2. 至少5年销售及团队管理工作经验；3. 相貌端正、身体健康、无不良嗜好与违法犯罪记录；4. 具有较强的逻辑思维及规划能力，良好的沟通技巧，良好的行政、文书能力；5. 具备客户服务意识和市场营销经验，有一定的客户资源；6. 具有优秀的团队打造及管理能力，能带领团队完成考核任务；7. 敢于挑战高薪，有良好的学习能力和执行力，能承受较大的工作压力；岗位职责：1、 根据公司下达的业绩目标，制定合理的业务计划，分解落实到每个业务人员，并追踪达成；2、 协助和支持进行有效的人员招募活动，协助部门经理做好团队人力的发展及培育；2、 完成团队销售目标，形成相应的销售策略，并确保有效地执行，持续跟踪直至落实达成；3、 协助部门经理提升团队经营技能，协助培训部门举办各类在职培训，参与部分课程授课；4、 组织早夕会，协调业务人员及业务团队之间的关系，做好业务团队与公司各部的联络与协调工作；福利待遇：1、试用期内享有底薪、业务提成、卓越奖、个人季度奖、实习津贴等奖励；2、顺利晋升后额外享有团队管理津贴、新主管津贴、晋升奖金、辅导津贴、增员奖金、年终奖金等奖励、平均年薪 30-50万3、享有人身意外保险、定期寿险和医疗保险、基本养老补贴、养老公积金等；4、入司五周年开始享有长期服务奖；5、工作时间朝九晚五，周末法定假日正常放假；6、 一经录用转正，公司将提供行业内最专业、有效的技能培训（新人职岗代等系列培训，综合金融开拓专业培训，中高级管理储备干部培训，星级讲师认证培训等；长期享有团队管理、营销知识、综合金融知识、法律知识、社交礼仪技巧等专业培训以及全国各地学习交流分享旅游等机会。,平安1号主管计划（主管）,https://jobs.zhaopin.com/CC859222950J00233777308.htm,招1人,20K-30K
浦江镇,上海-闵行区,厦门艾德生物医药科技股份有限公司,CZ220438010,合资,2019-07-08 00:50:26,本科,不限,工作职责：1. 独立负责数据系统需求分析、设计、开发和维护2. 负责系统后台服务的流程搭建、调试、以及性能优化3. 按照项目计划，及时提交高质量代码和规范化的技术文档4. 负责公司分布式系统配置、搭建和管理工作任职要求：1. 计算机本科以上学历，1年及以上软件开发工作经验2. 熟悉NFS文件系统，以及数据安全和数据备份方法3. 了解常用算法和数据结构，以及多线程和网络编程4. 熟练使用Linux系统，熟悉Shell、Python、Java等编程语言5. 精通MySQL、MongoDB、HBASE等关系型以及分布式数据库6. 深入理解Django以及Flask等web开发框架，可独立搭建大型系统7. 熟悉Docker、Kubernetes等容器技术，以及SPARK等分布式计算原理8. 至少熟悉Vue、React、Angular等一种主流前端开发框架,软件开发工程师,https://jobs.zhaopin.com/CC220438015J00289884602.htm,招1人,15K-20K
张江,上海,上海互问信息科技有限公司,CZ494096930,民营,2019-07-08 09:01:07,本科,不限,岗位职责：1、无需代码背景，以普通人工智能音箱体验者的角色，设计人机交互方案；2、根据任务，进行文字的相关编辑整理工作；3、测试人工智能音箱，并提出自己的改进意见。任职资格：1、希望拥抱人工智能行业浪潮并投入其中；2、积极乐观；3、思维活跃，沟通表达能力优秀，具备良好的团队协助意识；4、有强烈学习热情；5、对文字有一定的敏感性，善于处理文字。6、本科学历，专业不限(接受应届生/实习生)。工作地址上海市浦东新区盛夏路570号12楼, 语义数据编辑,https://jobs.zhaopin.com/CC494096937J00106090106.htm,招1人,4.5K-6K
南桥,上海-奉贤区,上海成途自动化工程股份有限公司,CZ837547810,民营,2019-07-08 09:02:02,本科,1-3年,"工作职责:-熟练运用机械绘图软件或CAD二维设计软件进行绘图-熟练运用至少一种主流3D设计软件(UG, Catia, Inventor）进行绘图-熟练运用办公软件编写设备零件表、采购件清单、长周期加工件清单-理解并且制定项目中的规划文件，如客户技术文档、项目进度表、系统工程师制定的设备方案、系统布置图-制定加工件的关键工艺操作流程-具备和电气部门联合设计的能力-协调项目中采购、制作、现场安装和调试环节任职要求:-本科及其以上学历，机械相关专业-白车身/动力总成/新能源电池装配等行业2年以上非标设计工作经验或工装夹具设计经验-精通机械结构动作原理、熟悉自动化控制的原理和基本流程-能看懂机械和电气安装图，并对安装调试过程提供技术指导-熟练的运用一门外语读写能力，英语优先",机械设计工程师（夹具设计方向）,https://jobs.zhaopin.com/CC837547810J00158021006.htm,招2人,6K-12K
金桥,上海,上海奇发生物医药科技有限公司,CZ464964910,民营,2019-07-08 00:52:11,本科,3-5年,职责描述 1．负责完成药物分析研究，独立承担研发项目质量研究部分的实验方案制定安排；负责CTD申报资料的撰写2. 负责分析研究人员的工作安排；按时完成各项分析研究任务，并确保数据的真实性、准确性及及时性 3. 负责检验仪器、设备的管理；严格执行实验室各项管理规程，保证实验安全和实验的准确性  任职条件 1. 药物分析或相关专业；本科以上，4-5年以上相关经验；硕士毕业，1-2年以上经验；博士毕业，应届生亦可 2. 熟练掌握各类分析仪器的操作，熟悉基本维护要领 3. 熟悉国内外各项法规要求；熟悉相关法规（ICH，USP，EP，JP，CP） 4. 具备较强的计划、领导、协调、沟通、学习、创新、适应能力，具有较强的文字表达能力 5. 熟练掌握药物分析专业英语，能阅读翻译专业英文文献；有较强的文献检索能力 6. 热爱研发工作，具有团队合作精神，乐于学习，有思考解决问题能力，富有责任心，工作态度积极,药物分析高级研究员、分析部负责人,https://jobs.zhaopin.com/464964910250083.htm,招1人,10K-15K
周浦镇,上海-浦东新区,上海开始网络科技有限公司,CZ287464530,民营,2019-07-08 00:50:31,本科,1-3年,"公司和产品：开始网络作为一家专注企业市场的软件与互联网创业公司，于2006年在国家软件基地的浦东张江软件园创立，公司致力于为用户提供更快捷更安全的文档管理方式，目前公司已成为国内最好的文档管理软件与企业社会化云服务提供商，公司近年来销售增加5倍以上，一年内连续数次获得超千万融资，这是一家开放、透明、公平的互联网公司，是可以承载梦想和发展诉求的职业舞台，非常期待您的关注。岗位职责：1、负责公司产品开发设计、维护；2、负责项目定制需求沟通、编码实现并配合实施工程师部署；3、负责定制化项目文档的交付要求编写；任职要求：1，性别不限，计算机软件相关专业，本科以上学历；2，具有两年以上大中型Web系统、企业管理软件开发经验；3，熟练使用Java，Jsp，Javascript，jQuery，html,css等语言；4，了解操作系统常规知识例如：进程、线程、内存管理、文件存储；5，基础知识扎实，有良好的代码风格，及技术文档编写能力；6，具有良好的团队合作精神、沟通能力及抗压能力；有下列条件之一者优先：1、有分布式存储开发经验优先2、有分布式搜索开发经验优先3、有流程引擎Activiti开发经验优先",JAVA开发工程师,https://jobs.zhaopin.com/287464538250032.htm,招2人,8K-10K
洋泾,上海-杨浦区,上海雷龙信息科技有限公司,CZ272604630,民营,2019-07-08 09:01:00,本科,1-3年,岗位职责：1）负责软件产品的策划，包括目标用户分析、产品原型开发、产品立项、路标设定等；2）负责软件产品的市场调研、用户调研、需求分析、用户体验设计，并完成产品功能规划、原型设计、功能需求书及说明书撰写、产品宣传资料准备等； 3）协助销售完成客户产品方案设计与现场支持； 岗位要求：1） 大学本科或以上学历，计算机相关专业；2） 熟悉使用VISIO， AXURE等产品设计工具；3） 熟悉车辆保险销售场景；4） 具有保险行业从业经验或支付行业从业经验优先考虑；5） 具备较强的信息采集和数据分析能力以及逻辑思维与风险判断能力；6） 工作积极主动、认真、严谨、负责，有较强的沟通协调能力以及团队合作能力并具有良好的职业操守。  ,产品经理,https://jobs.zhaopin.com/CC272604636J00129665208.htm,招1人,10K-15K
陆家嘴,上海,普信恒业科技发展(北京)有限公司,CZ371111510,民营,2019-07-08 09:01:12,本科,1-3年,"岗位职责:1、服务于超高净值个人客户，为超高净值个人客户提供全方面资产配置服务； 2、通过参与公司的投资沙龙、高端论坛、市场活动、家族峰会等活动，提升客户转化率，对已开发的客户进行定期维护和回访，开发客户潜力，并发掘新客户资源； 3、根据客户的资产规模、生活目标、预期收益目标和风险承受能力进行需求分析，出具专业的资产配置方案，推荐合适的金融产品；4、通过调整各种金融产品比重达到资产的合理配置，使客户的资产在安全、稳健的基础上保值升值； 5、定期与客户联系，报告理财产品的收益情况，向客户介绍新的金融服务、理财产品及金融市场动向，维护良好的信任关系，并通过持续跟进与服务，为客户不断提供专业的投资咨询与服务。 任职资格:1、本科或以上学历，有海外留学经验优先考虑，条件特别优秀者可适当放宽； 2、具有丰富的金融专业知识，了解国内外投资理财市场的发展，对于该行业有自己的认识与思考，持有AFP,CFP优先； 3、有私人银行，投资顾问等5年以上工作经验相关背景优先；有服务高净值客户经验或可以接触当地高端客户的资源，且主动开发能力极佳； 4、具有敏锐的市场洞察力和准确的客户分析能力，有较好学习能力、关系经营能力，拥有较好的成熟度和坚韧性。5、较强的语言表达与沟通交流能力，上进心强，富有开拓精神和自我实现的愿望，具备团队合作意识。",高级理财经理,https://jobs.zhaopin.com/CC371111518J00078957309.htm,招1人,15K-20K
张江,上海,恺佧生物科技(上海)有限公司,CZ832571360,合资,2019-07-08 00:51:52,本科,1-3年,"岗位职责：  · 进行哺乳动物（HEK293、CHO）和大肠杆菌细胞进行重组蛋白的表达和检测 · 运用各种纯化技术进行大肠杆菌，哺乳动物细胞表达的重组蛋白纯化，能够在指定的时间内完成,并达到规定的数量及质量要求 · 相关文献的查阅和实验设计 · 问题分析及解决方案的提出 任职资格：  · 生物制药、生物技术、生物化工等相关专业，具有重组蛋白表达、纯化相关经验· 硕士，或本科毕业两年以上相关行业工作经验· 熟练使用 AKTA 自动化操作，掌握各种纯化原理和纯化填料 · 掌握重组蛋白的相关检测技术，如 SDS-PAGE、Western Blot · 熟练使用相关软件，能独立进行实验设计和结果分析· 一定程度的英文口语和书写沟通能力 · 愿意承担一定的工作压力",蛋白纯化研究员,https://jobs.zhaopin.com/CZ832571360J00261414901.htm,招2人,10K-15K
长寿路,上海,上海伯特管理咨询有限公司,CZ120041060,合资,2019-07-08 09:03:25,本科,1-3年,岗位职责：1、外部信息调研，并撰写相关PPT版本的调研报告及项目建议书等；2、负责访谈提纲撰写、组织项目访谈，并完成访谈信息整理工作；主持客户沟通会议等；3、负责项目中的各阶段交付成果，主动与客户沟通，确保成果质量和客户满意度；4、主动思考所承接的工作任务，在提出问题的同时明确解决思路，给出推荐方案并说明理由；5、严格遵守项目各个时间节点，保质保量地落实既定工作内容并输出相关成果，在提交文件前主动复查，避免出现错别字、语句不通、内容疏漏等错误，调整文件排版。 任职要求：1、本科以上学历，1~3年相关工作经历；2、了解人力资源管理、企业管理相关知识，良好的Office应用能力，尤其是Excel和PPT；3、理解能力较强，能够抓住所沟通内容的关键；4、有责任心，按照承诺的时间点交付工作结果；5、善于沟通交流，能够流畅地汇报工作、访谈调研、征求意见等；6、逻辑思考、信息处理能力较强；7、正向阳光，开朗乐观；8、有IT背景更佳。 ,管理咨询顾问,https://jobs.zhaopin.com/120041060250255.htm,招1人,15K-25K
平凉路,上海,上海冉地景观设计有限公司,CZ360387530,民营,2019-07-08 08:55:44,本科,3-5年,岗位职责:1、负责项目景观部分的植物设计工作，包括项目前期的植物配置分析，并落到景观方案的设计表现上；2、完成景观方案的植物设计方案，包含方案扩初及施工图设计等；3、配合进行施工图的评审及修改，参与设计方、现场施工方的沟通、衔接；4、负责苗木配置甄选，现场提供种植施工建议，并监督植物部分施工标准及规范的达成；5、完成上级交代的其他工作任务。任职要求:1、全日制本科及以上学历，风景园林/环境艺术等相关专业，3年以上同类经验；2、有较强的美学概念，熟悉常用园林植物品类、习性及苗木市场行情，对植物设计有独到的见解；3、熟悉必备技术软件、办公软件的操作，熟悉植物配置施工图的制图技术及规范；4、优秀的学习能力、沟通协调能力，责任心强，正能量；,植物设计师,https://jobs.zhaopin.com/CC360387532J00261025902.htm,招1人,8K-10K
人民广场,上海,中国建筑第八工程局有限公司,CZ146142290,国企,2019-07-08 07:59:36,本科,1-3年,1、身体健康、年龄在45岁以下；2、给排水、电气、暖通等安装工程相关专业，全日制统招、公办二本及以上学历；3、具有2年及以上岗位工作经验；4、工作认真、能吃苦耐劳、性格开朗、擅于沟通，工作积极、有进取心；有团队观念、大局意识；5、具有国家一级注册建造师（机电、建筑、市政）、注册造价师资格者优先。,现场商务工程师/商务主管/商务经理,https://jobs.zhaopin.com/CC146142292J00276585306.htm,招10人,8K-10K
高行,上海,易格斯中国,CZ120010420,外商独资,2019-07-08 08:56:23,本科,不限,岗位职责：1)根据客户要求进行产品选型、报价和图纸的设计、绘制。2)德国总部设计图纸的转化、转译。3)协调所负责产品的生产进度；4）确保产品选型的合理性，报价和图纸的准确性；5）确保项目进展不会因图纸设计速度等因素而受到影响；6)上级领导交代的其它工作。任职要求：1）本科或以上学历；电气、自动化类专业背景；2）熟悉Office等办公软件，尤其是Excel软件；3）熟练掌握各种主流品牌连接器的应用；4）英语听说读写熟练者优先考虑；5）有各种线束选型与制作经验者优先考虑。,线束项目工程师,https://jobs.zhaopin.com/120010425250424.htm,招2人,8K-10K
颛桥,上海,博纳天健(上海)知识产权代理有限公司,CZ817849020,民营,2019-07-08 08:45:52,本科,1-3年,福利待遇：1、八小时工作制，做五休二，法定假日；2、需实习期满2年，持代理人职业资格证上岗3、基本工资+业绩提成+业绩奖金+排名奖金+通讯补贴+餐饮补贴有能力者，公司给予晋升空间，有机会成为公司股东！岗位职责：1、合理利用公司提供的平台和资源寻找目标客户、开拓市场、与客户建立联系，明确客户需求；2、联络、跟进客户，在专利、商标、科技项目申报、版权等方面为客户提供热情、积极、专业的咨询与服务；3、收集、整理客户信息，维护客户关系，提高客户满意度；4、有良好的书面表达能力、沟通能力及较强的领悟能力；5、责任心强，踏实肯干，有较强的团队合作意识6、负责部门的整体运营，根据部门要求达成工作任务与目标。7、有能力者，薪资待遇不设上限。 ,专利代理人,https://jobs.zhaopin.com/CC817849020J00362758307.htm,招2人,15K-20K
平凉路,上海,上海冉地景观设计有限公司,CZ360387530,民营,2019-07-08 08:55:44,本科,1-3年,岗位职责：1、主要负责跟进景观设计项目，负责日常档案的收集、汇总、整理、立卷；2、协助主创设计师完成前期资料搜集整理设计；3、方案的深化、文本的制作和后期施工现场配合工作。任职资格：1、园林景观相关专业本科学历，工作1-3年以上；2、熟练掌握word、excel、powerpoint等办公软件，熟练使用AutoCAD、SketchUp、 Photoshop等设计软件，徒手表达能力强者为佳；3、言语理解、表达能力好，具备较强沟通协调能力和准确的判断力，领悟力较高；4、较强的项目跟踪、管理、协调能力，熟悉设计项目运作流程；学习能力强，能应付高压力工作；5、诚实、谦逊、有责任心，工作中具有良好的团队合作精神。,景观方案设计师,https://jobs.zhaopin.com/CC360387532J00154484202.htm,招5人,8K-12K
花木,上海,上海互问信息科技有限公司,CZ494096930,民营,2019-07-08 09:01:07,本科,1年以下,岗位职责：1、原理图&PCB设计：根据产品定义，负责完成硬件部分器件选型和原理图设计；完成硬件部分layout摆件和走线检查。2、BOM输出：负责PCBA BOM输出。3、功能调试及整机问题解决：负责硬件电路功能调试，解决整机音频Demo，以满足客户和认证标准的要求。4、产线支持：为了保证项目交付进度，支持产线解决硬件相关的问题，确保产线交付按要求达成。5、售后维护：分析售后中反馈的重点关键问题，找出根本原因和对策，为后续项目总结经验。任职要求：1、电子、通信或自动化相关专业，本科或以上学历。2、了解数字电路、模拟电路理论基础，可使用各种设计软件、调试工具和测试设备。3、能承受较大的工作压力，具备良好的沟通能力和组织能力，善于团队合作 。4、高度的敬业精神及工作激情。此岗位面向2018年应届生招聘，欢迎投递！,硬件工程师,https://jobs.zhaopin.com/CC494096937J00080303006.htm,招1人,6K-8K
打浦桥,上海,上海中海物业管理有限公司,CZ191580020,国企,2019-07-08 08:57:21,本科,3-5年,岗位职责：1、贯彻执行公司各项方针、政策，全面负责管理处的日常事务和管理工作；2、领导管理处全体员工，完成公司下达的各项责任目标；3、安排和调整本项目人员工作，做好各项工作计划；4、负责对下属的工作考核及监督，指导各级工作人员按质按量完成工作任务；5、主持管理处日常和定期工作会议，负责传达公司文件、通知和会议精神；6、随时掌握本管理处如安全管理、工程管理、环境管理等方面的工作情况，并组织解决有关业户投诉，不断提高服务质量；7、与业户保持良好的关系，与各职能部门保持良好的沟通。任职要求：1、3年以上知名物业公司（商业、住宅）项目管理经验；2、熟练掌握物管公司的运作方式及物业管理服务的各项工作及操作规范，掌握客户服务技巧；3、 熟悉有关物业管理的各项规章制度及国家相关的法律、法规；4、了解国内、国际先进的物业管理模式和服务方式及发展动态；5、较强的责任心与敬业精神；6、具有从业相关资格认证人员优先。,储备住宅、商业物业项目经理,https://jobs.zhaopin.com/191580021250359.htm,招2人,10K-20K
